date,text,clean_text_analysis,clean_text_sentiment,sentiment_label,sentiment_score,sentiment_value,has_keyword
2025-03-06,Insightful!!,insightful,insightful!!,positive,0.8890625238418579,1,False
2025-03-06,Can't wait to see the new iphone 17 series price. 899? 999? lol,cant wait see new iphone series price 899 999 lol,can't wait to see the new iphone 17 series price. 899? 999? lol,positive,0.9766839146614075,1,False
2025-03-06,If they just made this a mini it would make sense again,made mini would make sense,if they just made this a mini it would make sense again,neutral,0.6165707111358643,0,False
2025-03-06,"I’m getting it. It’s gonna be an upgrade from my iPhone 13 mini, I don’t even need all the fancy functions like precision whatever, I even have I cloud so I literally just need a base model to stay in the eco system. I probably am their target customer here",getting gon upgrade iphone mini dont even need fancy function like precision whatever even cloud literally need base model stay eco system probably target customer,"i’m getting it. it’s gonna be an upgrade from my iphone 13 mini, i don’t even need all the fancy functions like precision whatever, i even have i cloud so i literally just need a base model to stay in the eco system. i probably am their target customer here",positive,0.9189141392707825,1,False
2025-03-06,"Apple is clearly going round in circles now, whereas android flagships are moving forward",apple clearly going round circle whereas android flagship moving forward,"apple is clearly going round in circles now, whereas android flagships are moving forward",neutral,0.5259367823600769,0,False
,iPhone make this phone under $299 so every one can buy and people get iphone in budget,iphone make phone 299 every one buy people get iphone budget,iphone make this phone under $299 so every one can buy and people get iphone in budget,positive,0.6225187182426453,1,True
2025-03-13,He is playing Michael Key,playing michael key,he is playing michael key,neutral,0.9067224264144897,0,False
2025-03-13,I’m just upset they didn’t made an iPhone 16e mini next to it. Still rocking my 13 mini!,upset didnt made iphone 16e mini next still rocking mini,i’m just upset they didn’t made an iphone 16e mini next to it. still rocking my 13 mini!,negative,0.3924480676651001,-1,False
2025-03-13,It looks like they're trying to remake the iPhone SE after all these years.  The camera and flash are located the same.,look like theyre trying remake iphone year camera flash located,it looks like they're trying to remake the iphone se after all these years.  the camera and flash are located the same.,neutral,0.7035711407661438,0,False
2025-03-06,"I don't get MagSafe... so you can't really use a phone while it's on a wireless charging pad, so they came up with MagSafe, which essentially tethers the phone to...a cable.  You could also just use a cable. Am I missing something?",dont get magsafe cant really use phone wireless charging pad came magsafe essentially tether phone toa cable could also use cable missing something,"i don't get magsafe... so you can't really use a phone while it's on a wireless charging pad, so they came up with magsafe, which essentially tethers the phone to...a cable.  you could also just use a cable. am i missing something?",negative,0.5654576420783997,-1,True
2025-03-06,"Apple's thinking - you will pay as much as we can make you pay, in light of needing an iphone as you are locked in, yet feeling left behind without a button that is not a button, but is a button; and needing a feature that isn't a feature, but is all new, but isn't new, but is. Would sir like the cable with the phone?",apple thinking pay much make pay light needing iphone locked yet feeling left behind without button button button needing feature isnt feature new isnt new would sir like cable phone,"apple's thinking - you will pay as much as we can make you pay, in light of needing an iphone as you are locked in, yet feeling left behind without a button that is not a button, but is a button; and needing a feature that isn't a feature, but is all new, but isn't new, but is. would sir like the cable with the phone?",neutral,0.5156403183937073,0,False
2025-03-06,"I have to agree with the conclusion: The phone is good but the price isn't right. When I saw the announcement, I was hoping it would be $ 100 less. Well, it's not. And it wasn't even clear from the presentation that the camera has a smaller sensor and that it doesn't have MagSafe. That is a bummer. We can only hope its value increases once Apple Intelligence really is a thing but other than that... Well, the basic iPhone 16 is still a better deal.",agree conclusion phone good price isnt right saw announcement hoping would 100 le well wasnt even clear presentation camera smaller sensor doesnt magsafe bummer hope value increase apple intelligence really thing well basic iphone still better deal,"i have to agree with the conclusion: the phone is good but the price isn't right. when i saw the announcement, i was hoping it would be $ 100 less. well, it's not. and it wasn't even clear from the presentation that the camera has a smaller sensor and that it doesn't have magsafe. that is a bummer. we can only hope its value increases once apple intelligence really is a thing but other than that... well, the basic iphone 16 is still a better deal.",negative,0.811846137046814,-1,True
2025-03-06,"when is the 16 e coming review
  coming out arun?",coming review coming arun,"when is the 16 e coming review
  coming out arun?",neutral,0.9438608884811401,0,False
2025-03-06,Love the Mustache!,love mustache,love the mustache!,positive,0.9681528806686401,1,False
2025-03-26,I will be upgrading from an iphone 8…..is 16e worth it or should I just go for 15,upgrading iphone 8is 16e worth,i will be upgrading from an iphone 8…..is 16e worth it or should i just go for 15,neutral,0.8297317028045654,0,False
2025-03-06,"Tbh, I want to see how many of those refurbished 15pro for about 600$ are actually around and don't look like from a warzone",tbh want see many refurbished 15pro 600 actually around dont look like warzone,"tbh, i want to see how many of those refurbished 15pro for about 600$ are actually around and don't look like from a warzone",negative,0.5367650985717773,-1,False
,"iPhone is premium phone and not cheap at all 

1- 16e for regular users 
(Social Media, average games, calls, internet searches, e shopping) 


2- 16 for younger generation mostly who still cares about latest tech 
( video games, long hours watching, spending time for better camera shots) + all extra commonly usable tech features 

3- 16 pro is for premium and advanced experience 
For tow users 
1/ you want to brag about it 
2/ you gonna defiantly use it to it’s limits because you need it or need more from it",iphone premium phone cheap 16e regular user social medium average game call internet search shopping younger generation mostly still care latest tech video game long hour watching spending time better camera shot extra commonly usable tech feature pro premium advanced experience tow user want brag gon defiantly use limit need need,"iphone is premium phone and not cheap at all 

1- 16e for regular users 
(social media, average games, calls, internet searches, e shopping) 


2- 16 for younger generation mostly who still cares about latest tech 
( video games, long hours watching, spending time for better camera shots) + all extra commonly usable tech features 

3- 16 pro is for premium and advanced experience 
for tow users 
1/ you want to brag about it 
2/ you gonna defiantly use it to it’s limits because you need it or need more from it",neutral,0.6026857495307922,0,True
,been rocking my iphone 13 mini and was hoping this was an upgrade but it really isnt,rocking iphone mini hoping upgrade really isnt,been rocking my iphone 13 mini and was hoping this was an upgrade but it really isnt,positive,0.5472806096076965,1,False
2025-03-06,Best skit,best skit,best skit,positive,0.9122084975242615,1,False
2025-03-06,Does the 16e have a more resilient screen—less likely to crack?,16e resilient screenless likely crack,does the 16e have a more resilient screen—less likely to crack?,neutral,0.7110902667045593,0,False
2025-03-06,If it was $429 still it would have a good place in the lineup. Again for kids/older people/people who don’t really care about phones,429 still would good place lineup kidsolder peoplepeople dont really care phone,if it was $429 still it would have a good place in the lineup. again for kids/older people/people who don’t really care about phones,neutral,0.49622252583503723,0,False
2025-03-13,"This is for corporate accounts, I could see companies like GEM Industrial buying these pieces of shit by the thousands",corporate account could see company like gem industrial buying piece shit thousand,"this is for corporate accounts, i could see companies like gem industrial buying these pieces of shit by the thousands",negative,0.8582720756530762,-1,False
,"I know that this may not be the place for this comment, but in addition to all Apple's mistakes, one simply cannot be forgiven, and that is that when you move a picture from recent to alum with the ""move"" option, it is not actually moved there, but copied. If I wanted it in recents, I wouldn't open a separate album. The most annoying thing",know may place comment addition apple mistake one simply forgiven move picture recent alum move option actually moved copied wanted recent wouldnt open separate album annoying thing,"i know that this may not be the place for this comment, but in addition to all apple's mistakes, one simply cannot be forgiven, and that is that when you move a picture from recent to alum with the ""move"" option, it is not actually moved there, but copied. if i wanted it in recents, i wouldn't open a separate album. the most annoying thing",negative,0.8816064596176147,-1,False
2025-03-06,"Something that annoys me about the iPhone 16e isn’t that “cheap” even for me as an Australian as for me it’s costs about $1,000 dollars which is crazy because at that price I could buy an iPhone 16 Pro Max with an extra 700 dollars, Which is crazy!",something annoys iphone 16e isnt cheap even australian cost 1000 dollar crazy price could buy iphone pro max extra 700 dollar crazy,"something that annoys me about the iphone 16e isn’t that “cheap” even for me as an australian as for me it’s costs about $1,000 dollars which is crazy because at that price i could buy an iphone 16 pro max with an extra 700 dollars, which is crazy!",negative,0.8614404201507568,-1,True
,Was that a severance reference??,severance reference,was that a severance reference??,neutral,0.887276828289032,0,False
2025-03-13,I was planning to buy a 16e until they released it and had the price at $599. Now I’m just getting a used 15 Pro instead.,planning buy 16e released price 599 getting used pro instead,i was planning to buy a 16e until they released it and had the price at $599. now i’m just getting a used 15 pro instead.,negative,0.5384222865104675,-1,False
2025-03-13,"In all honesty, we live in a world where people are not blinking eating a $5 donut (instead of the $0.79 average just a few years back), so yeah, what's $599+? Meh.",honesty live world people blinking eating donut instead 079 average year back yeah whats 599 meh,"in all honesty, we live in a world where people are not blinking eating a $5 donut (instead of the $0.79 average just a few years back), so yeah, what's $599+? meh.",negative,0.5898691415786743,-1,False
2025-03-06,"I have been using SEs and I am a touch-ID lover, so I'm out.",using s touchid lover,"i have been using ses and i am a touch-id lover, so i'm out.",neutral,0.4648912250995636,0,False
2025-03-06,Came here from Michael Fisher,came michael fisher,came here from michael fisher,neutral,0.9047864079475403,0,False
2025-03-06,"Callin' the iPhone 15 cheap, must be a misunderstanding.",callin iphone cheap must misunderstanding,"callin' the iphone 15 cheap, must be a misunderstanding.",negative,0.6793957352638245,-1,True
2025-03-06,Bring back the mini,bring back mini,bring back the mini,neutral,0.654684841632843,0,False
2025-03-13,Hope at least 1 reviewer would confirm. The C1 modem or the new 16e has bluetooth issues. Audio over bluetooth Stutters when connected to anything. Sad no reviewer would mention that. I am on my 2nd 16e now but no solution. Spend over 3hours sharing logs with apple. It’s a known issue with apple aware and all over the internet.,hope least reviewer would confirm modem new 16e bluetooth issue audio bluetooth stutter connected anything sad reviewer would mention 2nd 16e solution spend 3hours sharing log apple known issue apple aware internet,hope at least 1 reviewer would confirm. the c1 modem or the new 16e has bluetooth issues. audio over bluetooth stutters when connected to anything. sad no reviewer would mention that. i am on my 2nd 16e now but no solution. spend over 3hours sharing logs with apple. it’s a known issue with apple aware and all over the internet.,negative,0.8566217422485352,-1,False
2025-03-06,The 16e launched in Brazil 200 USD more expensive than regular 16,16e launched brazil 200 usd expensive regular,the 16e launched in brazil 200 usd more expensive than regular 16,neutral,0.5348128080368042,0,False
2025-03-06,"I swear companies are somehow liking and feeding off of these negative reviews. Nvidia, Apple, Sammie etc whatever they bring out sucks and they get bashed for it and yet people flock to them in droves. WTF? Is there sth I don't know? Reverse psychology? Are they shorting their own company? Cashing out?",swear company somehow liking feeding negative review nvidia apple sammie etc whatever bring suck get bashed yet people flock drove wtf sth dont know reverse psychology shorting company cashing,"i swear companies are somehow liking and feeding off of these negative reviews. nvidia, apple, sammie etc whatever they bring out sucks and they get bashed for it and yet people flock to them in droves. wtf? is there sth i don't know? reverse psychology? are they shorting their own company? cashing out?",negative,0.8896138668060303,-1,False
,"2:33 just checked online, but i can trade my SE for the 16e and it'll bring the cost down to $499.",233 checked online trade 16e itll bring cost 499,"2:33 just checked online, but i can trade my se for the 16e and it'll bring the cost down to $499.",neutral,0.8380959630012512,0,False
2025-03-06,Apple robbing Apple fanboys in broad daylight.,apple robbing apple fanboys broad daylight,apple robbing apple fanboys in broad daylight.,negative,0.7613842487335205,-1,False
2025-03-06,"Why not use mini iPhone 13 as the budget phone (16 e mini) but with one  the 16e as the Plus model with dual rear lense, and to bring price down, get rid of face ID, and instead have finger print scanner on the side of the phone, and please have massager and faster wireless and charging speed.
Plus please offer more colours too.",use mini iphone budget phone mini one 16e plus model dual rear lense bring price get rid face instead finger print scanner side phone please massager faster wireless charging speed plus please offer colour,"why not use mini iphone 13 as the budget phone (16 e mini) but with one  the 16e as the plus model with dual rear lense, and to bring price down, get rid of face id, and instead have finger print scanner on the side of the phone, and please have massager and faster wireless and charging speed.
plus please offer more colours too.",neutral,0.7354350090026855,0,True
2025-03-06,Apple: We only create good product.. videos.,apple create good product video,apple: we only create good product.. videos.,positive,0.6799582242965698,1,False
2025-03-06,"Some people simply aim to buy the newest cheapest iPhone, because that’s what they can afford.",people simply aim buy newest cheapest iphone thats afford,"some people simply aim to buy the newest cheapest iphone, because that’s what they can afford.",neutral,0.5661094784736633,0,False
2025-03-06,"Finally one camera, but why that camera bump is still there?",finally one camera camera bump still,"finally one camera, but why that camera bump is still there?",neutral,0.7406188249588013,0,False
,"Is it worth to trade with 13 pro max as i only use for general purpose only ? Like calls, WhatsApp and social apps",worth trade pro max use general purpose like call whatsapp social apps,"is it worth to trade with 13 pro max as i only use for general purpose only ? like calls, whatsapp and social apps",neutral,0.8613861203193665,0,False
2025-03-06,"Iphone 16e is an Apple ecosystem primary basic entry who wants to try apple ecosystem with less money relatively .
What do you think ?",iphone 16e apple ecosystem primary basic entry want try apple ecosystem le money relatively think,"iphone 16e is an apple ecosystem primary basic entry who wants to try apple ecosystem with less money relatively .
what do you think ?",neutral,0.6737603545188904,0,False
,You can't suggest it to people but you can give it for free to people using 150£ phones.,cant suggest people give free people using 150 phone,you can't suggest it to people but you can give it for free to people using 150£ phones.,neutral,0.5983026623725891,0,False
2025-03-06,I still love that phone personally,still love phone personally,i still love that phone personally,positive,0.9548761248588562,1,False
2025-03-06,LMAO...my 13 mini just became a premium device again.,lmaomy mini became premium device,lmao...my 13 mini just became a premium device again.,neutral,0.48846155405044556,0,False
2025-03-06,"When creators say ""This is really interesting"" I promise you. That means ""I dont like this"" but in a nice way",creator say really interesting promise mean dont like nice way,"when creators say ""this is really interesting"" i promise you. that means ""i dont like this"" but in a nice way",negative,0.4251510500907898,-1,False
2025-02-25,If they dropped it down to $499 they might have a chance.,dropped 499 might chance,if they dropped it down to $499 they might have a chance.,neutral,0.7607426047325134,0,False
2025-02-25,"this is not a review, this is an ad.",review,"this is not a review, this is an ad.",negative,0.7346593737602234,-1,False
2025-02-25,Tim Cook should employ iJustine.,tim cook employ ijustine,tim cook should employ ijustine.,neutral,0.8550391793251038,0,False
2025-02-25,"Have all the negative points been forgotten? The price and the display, which is no longer up-to-date with a low brightness and refresh rate for the year 2025. And that Magsafe is missing?",negative point forgotten price display longer uptodate low brightness refresh rate year 2025 magsafe missing,"have all the negative points been forgotten? the price and the display, which is no longer up-to-date with a low brightness and refresh rate for the year 2025. and that magsafe is missing?",negative,0.8397210836410522,-1,True
2025-02-25,"i was planning for iphone 16e i end up getting iphone 15 thanks to the apple sales guy he was like sir, buy iphone 15",planning iphone 16e end getting iphone thanks apple sale guy like sir buy iphone,"i was planning for iphone 16e i end up getting iphone 15 thanks to the apple sales guy he was like sir, buy iphone 15",positive,0.614539384841919,1,False
2025-03-06,"seriously ijustine , be honest . do a review . not an advertisement",seriously ijustine honest review advertisement,"seriously ijustine , be honest . do a review . not an advertisement",negative,0.48707911372184753,-1,False
2025-02-25,Almost every review complaint about the price but you didn't. Sadly this is just a ad not review.,almost every review complaint price didnt sadly review,almost every review complaint about the price but you didn't. sadly this is just a ad not review.,negative,0.8605046272277832,-1,False
2025-02-25,"I agree with some other that this was not a review at all. The camera test... that was okay but not okay as a review for the phone.

What we all probably wanna see in a review is...

1 - benchmarks for Wifi, 4G and 5G speeds: 16e vs any other 16. Since this got Apple C1 chip and other iPhone 16 models got Qualcomm.

2 - how's the audio quality for phone calls? Maybe too difficult to measure talk time Wifi/4G.

3 - find an AirTag with 16e vs 16 since 16e don't have UWB. How bad is it to miss out precision find?

4 - how's the low-light (night) photo for 16e compared to SE3 or SE2 and compared to 16?

5 - do some macro photos with some 16 model that got the macro sensor/lens and try to do the same with 16e. How good or bad is 16e at macro photos?

That's five things to test that I believe most of us would love to see in an actual review :)",agree review camera test okay okay review phone probably wan see review benchmark wifi speed 16e since got apple chip iphone model got qualcomm hows audio quality phone call maybe difficult measure talk time wifi4g find airtag 16e since 16e dont uwb bad miss precision find hows lowlight night photo 16e compared se3 se2 compared macro photo model got macro sensorlens try 16e good bad 16e macro photo thats five thing test believe would love see actual review,"i agree with some other that this was not a review at all. the camera test... that was okay but not okay as a review for the phone.

what we all probably wanna see in a review is...

1 - benchmarks for wifi, 4g and 5g speeds: 16e vs any other 16. since this got apple c1 chip and other iphone 16 models got qualcomm.

2 - how's the audio quality for phone calls? maybe too difficult to measure talk time wifi/4g.

3 - find an airtag with 16e vs 16 since 16e don't have uwb. how bad is it to miss out precision find?

4 - how's the low-light (night) photo for 16e compared to se3 or se2 and compared to 16?

5 - do some macro photos with some 16 model that got the macro sensor/lens and try to do the same with 16e. how good or bad is 16e at macro photos?

that's five things to test that i believe most of us would love to see in an actual review :)",negative,0.5483874082565308,-1,False
2025-02-25,The reason I don’t sub to this channel is because it sounds more like a commercial then a review,reason dont sub channel sound like commercial review,the reason i don’t sub to this channel is because it sounds more like a commercial then a review,negative,0.8827373385429382,-1,False
2025-02-25,Great Apple Ad Justine!!,great apple justine,great apple ad justine!!,positive,0.9847315549850464,1,False
2025-03-06,"If there's one tech creator without an ounce of integrity, it's her !",there one tech creator without ounce integrity,"if there's one tech creator without an ounce of integrity, it's her !",negative,0.9155619144439697,-1,False
2025-02-25,"This is not a review, this is an ad",review,"this is not a review, this is an ad",negative,0.6932950615882874,-1,False
2025-03-06,"As a general user of iPhone, I really love iPhone 16e.  It is a premium version of the budget iPhone SE with an upgraded body and specs. The 16e is also an upgraded version of XR!  Hope they will a 64GB choice.  I use only half of the 64GB storage of my current iPhone 12.  With that 64GB storage,  the 16e price might lower to 499$ perhaps.",general user iphone really love iphone 16e premium version budget iphone upgraded body spec 16e also upgraded version hope 64gb choice use half 64gb storage current iphone 64gb storage 16e price might lower 499 perhaps,"as a general user of iphone, i really love iphone 16e.  it is a premium version of the budget iphone se with an upgraded body and specs. the 16e is also an upgraded version of xr!  hope they will a 64gb choice.  i use only half of the 64gb storage of my current iphone 12.  with that 64gb storage,  the 16e price might lower to 499$ perhaps.",positive,0.9783686399459839,1,True
2025-02-25,"3:22 Those photographic styles are not new, they are the same since iPhone 13",322 photographic style new since iphone,"3:22 those photographic styles are not new, they are the same since iphone 13",neutral,0.8379788994789124,0,False
2025-02-25,"2:41 - This bunker and radio tower were from Jurassic Park Fallen Kingdom 2018.
The bunker was the escape route when the volcano was erupting.",241 bunker radio tower jurassic park fallen kingdom 2018 bunker escape route volcano erupting,"2:41 - this bunker and radio tower were from jurassic park fallen kingdom 2018.
the bunker was the escape route when the volcano was erupting.",neutral,0.9359089136123657,0,False
2025-03-06,"This is not a review, it is an ad",review,"this is not a review, it is an ad",negative,0.6884200572967529,-1,False
2025-02-25,"I don't need to see the video,, she already love this phone",dont need see video already love phone,"i don't need to see the video,, she already love this phone",positive,0.5827569365501404,1,False
2025-02-25,Justine is so pretty!,justine pretty,justine is so pretty!,positive,0.9867896437644958,1,False
2025-02-25,she was laughing running away from the megasorass,laughing running away megasorass,she was laughing running away from the megasorass,neutral,0.5470911860466003,0,False
2025-03-06,"Take it from an iphone SE 3rd generation owner, this is not a true value phone for what you are getting at $599.  If the same phone was available at a starting price at $499, then this could have been an outstanding value.",take iphone 3rd generation owner true value phone getting 599 phone available starting price 499 could outstanding value,"take it from an iphone se 3rd generation owner, this is not a true value phone for what you are getting at $599.  if the same phone was available at a starting price at $499, then this could have been an outstanding value.",negative,0.6023294925689697,-1,True
2025-03-06,wtf does she mean by under 600$ ??,wtf mean 600,wtf does she mean by under 600$ ??,negative,0.7609540820121765,-1,False
