date,text,clean_text_analysis,clean_text_sentiment,sentiment_label,sentiment_score,sentiment_value,has_keyword
2025-02-19,"This is not an SE replacement.

Its essentially just a regular Iphone 16 without the ultrawide camera, magsafe, slightly dimmer display, and one less gpu core for $100 less.

I really dont understands apples play here. The whole point of the SE phones was to have a cheap entryway into the apple ecosystem, which is especially important for parents buying their kids phones, grand parents, low income families, emerging markets, etc.

It doesnt need an OLED display, it doesnt need the A18 chip, hell it doesnt even need to be made out of metal. Cutting all of those things I could easily see them bringing it down to $550 which would have been WAYY more attractive.

At $100 less than a basic iphone 16 might as well just spend the extra $100 for the better display/camera system, not to mention people love magsafe.",replacement essentially regular iphone without ultrawide camera magsafe slightly dimmer display one le gpu core 100 le really dont understands apple play whole point phone cheap entryway apple ecosystem especially important parent buying kid phone grand parent low income family emerging market etc doesnt need oled display doesnt need a18 chip hell doesnt even need made metal cutting thing could easily see bringing 550 would wayy attractive 100 le basic iphone might well spend extra 100 better displaycamera system mention people love magsafe,"this is not an se replacement.

its essentially just a regular iphone 16 without the ultrawide camera, magsafe, slightly dimmer display, and one less gpu core for $100 less.

i really dont understands apples play here. the whole point of the se phones was to have a cheap entryway into the apple ecosystem, which is especially important for parents buying their kids phones, grand parents, low income families, emerging markets, etc.

it doesnt need an oled display, it doesnt need the a18 chip, hell it doesnt even need to be made out of metal. cutting all of those things i could easily see them bringing it down to $550 which would have been wayy more attractive.

at $100 less than a basic iphone 16 might as well just spend the extra $100 for the better display/camera system, not to mention people love magsafe.",neutral,0.49458080530166626,0,True
2025-02-19,No? It’s $200 less (600 vs 800). I would not want to cut out all the stuff you mentioned for $50 of savings.,200 le 600 800 would want cut stuff mentioned saving,no? it’s $200 less (600 vs 800). i would not want to cut out all the stuff you mentioned for $50 of savings.,neutral,0.5011599063873291,0,True
2025-02-19,"Permanent 25% sale in exchange for a lot of things that people won’t care about. Seems good to me, and I’m surprised to see this thread is so negative. The 16 was already a decent value (all things considered), and consider that these things will be even cheaper than a 16 once you factor in carrier deals, etc.",permanent sale exchange lot thing people wont care seems good surprised see thread negative already decent value thing considered consider thing even cheaper factor carrier deal etc,"permanent 25% sale in exchange for a lot of things that people won’t care about. seems good to me, and i’m surprised to see this thread is so negative. the 16 was already a decent value (all things considered), and consider that these things will be even cheaper than a 16 once you factor in carrier deals, etc.",negative,0.5560399293899536,-1,True
2025-02-20,It’s 699€. A new iPhone 16 is 819€ from official stores and 750€ if you trust some sketchier ones. I immediately bought the regular 16 yesterday after they announced the price. So not worth it for 120€ saving.,699 new iphone 819 official store 750 trust sketchier one immediately bought regular yesterday announced price worth 120 saving,it’s 699€. a new iphone 16 is 819€ from official stores and 750€ if you trust some sketchier ones. i immediately bought the regular 16 yesterday after they announced the price. so not worth it for 120€ saving.,negative,0.871986448764801,-1,False
2025-02-20,That I agree with,agree,that i agree with,positive,0.6311919689178467,1,False
2025-02-19,"&gt;At $100 less than a basic iphone 16 might as well just spend the extra $100 for the better display/camera system, not to mention people love magsafe.

Perhaps Apple identified a signifant group that is unwilling to spend iPhone 16 money, but who can afford a 16e, something along the lines of the touchscreen Airpod being an affordable entry level, popular amongst young teenagers, but I agree that the price difference seems to be too minor for everything that's cut.

I also have trouble seeing how this doesn't eat into the sales of last gen or second to last gen phones that Apple likes to sell. Are they halting that practice? There seems to much overlapping products competing for the same purchases, with the less expensive end being wholly neglected.",gtat 100 le basic iphone might well spend extra 100 better displaycamera system mention people love magsafe perhaps apple identified signifant group unwilling spend iphone money afford 16e something along line touchscreen airpod affordable entry level popular amongst young teenager agree price difference seems minor everything thats cut also trouble seeing doesnt eat sale last gen second last gen phone apple like sell halting practice seems much overlapping product competing purchase le expensive end wholly neglected,"&gt;at $100 less than a basic iphone 16 might as well just spend the extra $100 for the better display/camera system, not to mention people love magsafe.

perhaps apple identified a signifant group that is unwilling to spend iphone 16 money, but who can afford a 16e, something along the lines of the touchscreen airpod being an affordable entry level, popular amongst young teenagers, but i agree that the price difference seems to be too minor for everything that's cut.

i also have trouble seeing how this doesn't eat into the sales of last gen or second to last gen phones that apple likes to sell. are they halting that practice? there seems to much overlapping products competing for the same purchases, with the less expensive end being wholly neglected.",neutral,0.5879934430122375,0,True
2025-02-20,"Yeah, I think this is basically Apple squeezing the Boomers for while they are still around. They know most Boomers will buy the cheapest phone, and that Boomers are ""locked in"" to their ecosystem, so why not make the cheapest phone as expensive as possible and bleed them for every last cent? 

The message everyone else should take from this is get out of Apple ecosystem while you still can. This is a predatory company that has no respect for its consumers and someday you are going to be the Boomer they cynically squeeze for every last ounce of blood. Chinese are now offering quality phones at reasonable prices. Samsung and Google sadly tend to follow Apple's pricing policies but at least have enough sense of shame that they feel compelled to give you some kind of value in exchange for the cost.",yeah think basically apple squeezing boomer still around know boomer buy cheapest phone boomer locked ecosystem make cheapest phone expensive possible bleed every last cent message everyone else take get apple ecosystem still predatory company respect consumer someday going boomer cynically squeeze every last ounce blood chinese offering quality phone reasonable price samsung google sadly tend follow apple pricing policy least enough sense shame feel compelled give kind value exchange cost,"yeah, i think this is basically apple squeezing the boomers for while they are still around. they know most boomers will buy the cheapest phone, and that boomers are ""locked in"" to their ecosystem, so why not make the cheapest phone as expensive as possible and bleed them for every last cent? 

the message everyone else should take from this is get out of apple ecosystem while you still can. this is a predatory company that has no respect for its consumers and someday you are going to be the boomer they cynically squeeze for every last ounce of blood. chinese are now offering quality phones at reasonable prices. samsung and google sadly tend to follow apple's pricing policies but at least have enough sense of shame that they feel compelled to give you some kind of value in exchange for the cost.",negative,0.7061230540275574,-1,True
2025-02-20,"I agree. I would've liked them to come out with something more in line with the SE2022 using older parts if it meant keeping the prices down. it'd leap the SE 2022 just and still keep the casual user. 

My understanding is, a lot of the reason they even sold the SE in the first place was because they were loosing casual phone users who didn't want to pay big dollars for flag ship phones. Users who paid 30% tariffs on everything they bought through in app purcahses..like candy crush, idk. The 16e will be priced at $1000aud here. A jump from the $700 of the SE2022 which shouldve been like $400aud but I could front up that extra to stay in the apple eco system for convience. Apple are pretty calculating. I can only assume they concluded they didn't need the casual users money..risky move share price wise imo.",agree wouldve liked come something line se2022 using older part meant keeping price itd leap 2022 still keep casual user understanding lot reason even sold first place loosing casual phone user didnt want pay big dollar flag ship phone user paid tariff everything bought app purcahseslike candy crush idk 16e priced 1000aud jump 700 se2022 shouldve like 400aud could front extra stay apple eco system convience apple pretty calculating assume concluded didnt need casual user moneyrisky move share price wise imo,"i agree. i would've liked them to come out with something more in line with the se2022 using older parts if it meant keeping the prices down. it'd leap the se 2022 just and still keep the casual user. 

my understanding is, a lot of the reason they even sold the se in the first place was because they were loosing casual phone users who didn't want to pay big dollars for flag ship phones. users who paid 30% tariffs on everything they bought through in app purcahses..like candy crush, idk. the 16e will be priced at $1000aud here. a jump from the $700 of the se2022 which shouldve been like $400aud but i could front up that extra to stay in the apple eco system for convience. apple are pretty calculating. i can only assume they concluded they didn't need the casual users money..risky move share price wise imo.",neutral,0.6987640857696533,0,False
2025-02-19,ist this expensive?,ist expensive,ist this expensive?,negative,0.6483989357948303,-1,False
2025-02-19,I want one as my company phone. Can‘t stand that SE 3….,want one company phone cant stand,i want one as my company phone. can‘t stand that se 3….,negative,0.8838133811950684,-1,False
2025-02-19,"In denmark its 100€ cheaper than the 16. 

Should have magsafe and be 100$ cheaper. Then i would have order it instant. - dissapointed",denmark 100 cheaper magsafe 100 cheaper would order instant dissapointed,"in denmark its 100€ cheaper than the 16. 

should have magsafe and be 100$ cheaper. then i would have order it instant. - dissapointed",negative,0.7515882253646851,-1,False
2025-02-19,That’s odd… it’s 250€ less than the 16 here in Germany,thats odd 250 le germany,that’s odd… it’s 250€ less than the 16 here in germany,negative,0.5461317896842957,-1,False
2025-02-19,Yeah 250€ difference on apples own website. But only 120€ between other retailers and 16e price from apple.,yeah 250 difference apple website 120 retailer 16e price apple,yeah 250€ difference on apples own website. but only 120€ between other retailers and 16e price from apple.,neutral,0.7876052856445312,0,False
2025-02-19,That’s right but I would guess that the 16e will also go down in price but only time will tell… I‘m still curious why so many people care about magsafe…? Don’t thicker cases have those magnets in them anyway? So I guess you can then just get a case with magnets and have the same functionality just with a slower charging speed or am I overlooking something here?,thats right would guess 16e also price time tell still curious many people care magsafe dont thicker case magnet anyway guess get case magnet functionality slower charging speed overlooking something,that’s right but i would guess that the 16e will also go down in price but only time will tell… i‘m still curious why so many people care about magsafe…? don’t thicker cases have those magnets in them anyway? so i guess you can then just get a case with magnets and have the same functionality just with a slower charging speed or am i overlooking something here?,neutral,0.775453507900238,0,False
2025-02-19,"Yeah i assume the 16e will drop too of course but not for a while. 

I think the magsafe(magnets not speed) was just a feature they removed without a reason. A nail in the coffin. I would love either magsafe or dynamic island.",yeah assume 16e drop course think magsafemagnets speed feature removed without reason nail coffin would love either magsafe dynamic island,"yeah i assume the 16e will drop too of course but not for a while. 

i think the magsafe(magnets not speed) was just a feature they removed without a reason. a nail in the coffin. i would love either magsafe or dynamic island.",negative,0.7586578726768494,-1,True
2025-02-19,"I don’t know… I think I heard somewhere that those magnets need to be really thin so they need to use really powerful magnets which makes them more expensive and integrating them is not that easy. But I have no idea if that’s correct…

Oh yeah I completely missed that it had a normal notch… that’s kind of a bummer… I would totally get a 15 or even better a 14pro over the 16e which is pretty much the same price and has all of those features… including an ultrawide camera…",dont know think heard somewhere magnet need really thin need use really powerful magnet make expensive integrating easy idea thats correct yeah completely missed normal notch thats kind bummer would totally get even better 14pro 16e pretty much price feature including ultrawide camera,"i don’t know… i think i heard somewhere that those magnets need to be really thin so they need to use really powerful magnets which makes them more expensive and integrating them is not that easy. but i have no idea if that’s correct…

oh yeah i completely missed that it had a normal notch… that’s kind of a bummer… i would totally get a 15 or even better a 14pro over the 16e which is pretty much the same price and has all of those features… including an ultrawide camera…",negative,0.603220522403717,-1,False
2025-02-20,Huh? It’s 699€ and you can get the 16 for 820€ right now. Even less if you trust some of the sketchier stores. I literally ordered the 16 yesterday for 820€ from Amazon after they announced the ridiculous price for the 16e.,huh 699 get 820 right even le trust sketchier store literally ordered yesterday 820 amazon announced ridiculous price 16e,huh? it’s 699€ and you can get the 16 for 820€ right now. even less if you trust some of the sketchier stores. i literally ordered the 16 yesterday for 820€ from amazon after they announced the ridiculous price for the 16e.,negative,0.5958995223045349,-1,False
2025-02-20,Yeah I just compared the prices on apple.de but I guess the 16e will also drop in price on third party sites,yeah compared price applede guess 16e also drop price third party site,yeah i just compared the prices on apple.de but i guess the 16e will also drop in price on third party sites,neutral,0.8670063614845276,0,False
2025-02-19,Currently using the 13 should i upgrade to 16e or it's going to be a downgrade?,currently using upgrade 16e going downgrade,currently using the 13 should i upgrade to 16e or it's going to be a downgrade?,neutral,0.9352927803993225,0,False
2025-02-19,"If your 13 is working properly I wouldn't upgrade to this. Some things might be an upgrade, but others seem a wash or a downgrade.

That's before getting into the pricing.",working properly wouldnt upgrade thing might upgrade others seem wash downgrade thats getting pricing,"if your 13 is working properly i wouldn't upgrade to this. some things might be an upgrade, but others seem a wash or a downgrade.

that's before getting into the pricing.",negative,0.691615641117096,-1,False
2025-02-20,"Just update your battery if you don’t need Apple Intelligence, you’ll be fine for a couple of years.",update battery dont need apple intelligence youll fine couple year,"just update your battery if you don’t need apple intelligence, you’ll be fine for a couple of years.",neutral,0.6014620661735535,0,False
2025-02-20,"Seems that the 16e has the same body and screen as the 13. The only new thing you would be getting is the A18 chip, but you would also loose MagSafe and your ultra wide camera (and someone in the thread said you will also loose uwp) so in many ways you will be downgrading too. I would keep the 13.",seems 16e body screen new thing would getting a18 chip would also loose magsafe ultra wide camera someone thread said also loose uwp many way downgrading would keep,"seems that the 16e has the same body and screen as the 13. the only new thing you would be getting is the a18 chip, but you would also loose magsafe and your ultra wide camera (and someone in the thread said you will also loose uwp) so in many ways you will be downgrading too. i would keep the 13.",negative,0.4952136278152466,-1,False
2025-02-20,"New things:  8GB of RAM, new CPU, larger battery, Apple Intelligence, USB C.",new thing 8gb ram new cpu larger battery apple intelligence usb,"new things:  8gb of ram, new cpu, larger battery, apple intelligence, usb c.",positive,0.6027705073356628,1,False
2025-02-20,"If you trade in your 13 you can get up to 300 bucks discount, so in you case it might be worth it.",trade get 300 buck discount case might worth,"if you trade in your 13 you can get up to 300 bucks discount, so in you case it might be worth it.",positive,0.7602859735488892,1,False
2025-02-22,It should surely not be a downgrade. Because iPhone 16e has USB-C and Apple Intelligence. It’s future-proof and modern. iPhones previous to iPhone 15 Pro feel outdated now as they don’t have Apple Intelligence and USB-C.,surely downgrade iphone 16e usbc apple intelligence futureproof modern iphones previous iphone pro feel outdated dont apple intelligence usbc,it should surely not be a downgrade. because iphone 16e has usb-c and apple intelligence. it’s future-proof and modern. iphones previous to iphone 15 pro feel outdated now as they don’t have apple intelligence and usb-c.,positive,0.5623070597648621,1,False
2025-03-04,"I don't know if this argument applies to everyone. I have a 13, I charge via MagSafe, no USB C isn't an issue for me. In fact *losing* the MagSafe would impact me more than I'm currently impacted by needed to connect physically with lightning.

And, having used apple intelligence on my other Apple devices, it's dogshit and provides no meaningful functionality which can't be had on any other phones by just installing the ChatGPT app. In my opinion.",dont know argument applies everyone charge via magsafe usb isnt issue fact losing magsafe would impact currently impacted needed connect physically lightning used apple intelligence apple device dogshit provides meaningful functionality cant phone installing chatgpt app opinion,"i don't know if this argument applies to everyone. i have a 13, i charge via magsafe, no usb c isn't an issue for me. in fact losing the magsafe would impact me more than i'm currently impacted by needed to connect physically with lightning.

and, having used apple intelligence on my other apple devices, it's dogshit and provides no meaningful functionality which can't be had on any other phones by just installing the chatgpt app. in my opinion.",negative,0.6786439418792725,-1,False
2025-02-19,"I was considering upgrading from my 14 Pro to the 16e lmao, but the lack of MagSafe and UWB (Ultra Wideband chip) are dealbreakers for me.",considering upgrading pro 16e lmao lack magsafe uwb ultra wideband chip dealbreakers,"i was considering upgrading from my 14 pro to the 16e lmao, but the lack of magsafe and uwb (ultra wideband chip) are dealbreakers for me.",negative,0.8386473059654236,-1,False
2025-02-19,"Not bothered by the lack of magsafe like some, but I don't understand why wouldn't you just buy the 15? It's the same price but a better phone. Weird.",bothered lack magsafe like dont understand wouldnt buy price better phone weird,"not bothered by the lack of magsafe like some, but i don't understand why wouldn't you just buy the 15? it's the same price but a better phone. weird.",negative,0.6292266249656677,-1,False
2025-02-19,at least in canada it is $100 cheaper than the 15,least canada 100 cheaper,at least in canada it is $100 cheaper than the 15,neutral,0.5189928412437439,0,False
2025-02-19,"£100 diff in the UK if you look on the Apple store, £50 or less via 3rd party. I think that 15 is £50 better, not even talking about ""open box"" options or refurbs that will be cheaper and still better.",100 diff look apple store le via 3rd party think better even talking open box option refurbs cheaper still better,"£100 diff in the uk if you look on the apple store, £50 or less via 3rd party. i think that 15 is £50 better, not even talking about ""open box"" options or refurbs that will be cheaper and still better.",positive,0.6052762866020203,1,False
2025-02-22,It has no apple intelligence.,apple intelligence,it has no apple intelligence.,negative,0.861142098903656,-1,False
2025-02-22,Yea and everyone _really_ cares about that,yea everyone _really_ care,yea and everyone really cares about that,neutral,0.6471402049064636,0,False
2025-02-23,But it is kind of an up to date and future proof feature. I personally won't buy a phone with important features missing.,kind date future proof feature personally wont buy phone important feature missing,but it is kind of an up to date and future proof feature. i personally won't buy a phone with important features missing.,neutral,0.5382139682769775,0,True
2025-02-23,"To each their own. I don't find it important or useful, thus don't see a reason to get 16e. Like I absolutely see Type C as an important feature so nothing below 15 makes sense for me, but subpar Apple intelligence? Nah.",dont find important useful thus dont see reason get 16e like absolutely see type important feature nothing make sense subpar apple intelligence nah,"to each their own. i don't find it important or useful, thus don't see a reason to get 16e. like i absolutely see type c as an important feature so nothing below 15 makes sense for me, but subpar apple intelligence? nah.",negative,0.736396312713623,-1,False
2025-02-19,"At least 200€ too expensive and the missing features have the typical “Apple is bullying you for being poor” vibe.
No magsafe, no dynamic island and no U2 chip: all things that will annoyingly inconvenience the user and clearly show everyone else that you have the inferior model phone",least 200 expensive missing feature typical apple bullying poor vibe magsafe dynamic island chip thing annoyingly inconvenience user clearly show everyone else inferior model phone,"at least 200€ too expensive and the missing features have the typical “apple is bullying you for being poor” vibe.
no magsafe, no dynamic island and no u2 chip: all things that will annoyingly inconvenience the user and clearly show everyone else that you have the inferior model phone",negative,0.9296767115592957,-1,True
2025-02-20,"In a pure Apple to Apple comparison it is a great deal it drops the 2 cameras for a much better single one, +2GB RAM, A15 -&gt; A18, more battery, theoretically better modem, against the iPhone 14 it replaces.",pure apple apple comparison great deal drop camera much better single one 2gb ram a15 a18 battery theoretically better modem iphone replaces,"in a pure apple to apple comparison it is a great deal it drops the 2 cameras for a much better single one, +2gb ram, a15 -&gt; a18, more battery, theoretically better modem, against the iphone 14 it replaces.",positive,0.9125149250030518,1,False
2025-03-10,"Just to clarify, you’re saying the 16e has a better camera than the 16 pro or a different phone?  Sorry if it’s a stupid question. 

Regardless, how would you say the 16e camera compares to the 16 or 16 pro?

And for fun, how does the 16e camera compare to, say, an iPhone 7 camera?  Thx!",clarify youre saying 16e better camera pro different phone sorry stupid question regardless would say 16e camera compare pro fun 16e camera compare say iphone camera thx,"just to clarify, you’re saying the 16e has a better camera than the 16 pro or a different phone?  sorry if it’s a stupid question. 

regardless, how would you say the 16e camera compares to the 16 or 16 pro?

and for fun, how does the 16e camera compare to, say, an iphone 7 camera?  thx!",neutral,0.6611700057983398,0,False
