date,text,clean_text_analysis,clean_text_sentiment,sentiment_label,sentiment_score,sentiment_value,has_keyword
2025-02-25,"It’s like this phone isn’t even designed to be sold as an actual product, just designed to make the more expensive iPhones look like better deals",like phone isnt even designed sold actual product designed make expensive iphones look like better deal,"it’s like this phone isn’t even designed to be sold as an actual product, just designed to make the more expensive iphones look like better deals",negative,0.7405962944030762,-1,False
2025-03-06,Im still on an iPhone 11 Pro Max. It refuses to die on me and still fulfils most of my use cases. Best iPhone I have ever owned.,still iphone pro max refuse die still fulfils use case best iphone ever owned,im still on an iphone 11 pro max. it refuses to die on me and still fulfils most of my use cases. best iphone i have ever owned.,positive,0.9793875217437744,1,False
2025-02-25,All they had to do was not remove magsafe and price it at $499.,remove magsafe price 499,all they had to do was not remove magsafe and price it at $499.,negative,0.580923318862915,-1,False
2025-02-25,I hate higher refresh rate is wild,hate higher refresh rate wild,i hate higher refresh rate is wild,negative,0.9290244579315186,-1,False
2025-02-25,MoustacheKBHD needs to make more appearances,moustachekbhd need make appearance,moustachekbhd needs to make more appearances,neutral,0.7317542433738708,0,False
2025-03-06,"It's old school concession marketing. Go to the movies, small popcorn for $3 or large popcorn $4. You buy the large because you're already spending $3 so why not spend a dollar more. It works in a movie theater cause you don't have any other choices, and it works for Apple consumers, because if you want it to be an Apple product, then you don't have any other choices either.",old school concession marketing movie small popcorn large popcorn buy large youre already spending spend dollar work movie theater cause dont choice work apple consumer want apple product dont choice either,"it's old school concession marketing. go to the movies, small popcorn for $3 or large popcorn $4. you buy the large because you're already spending $3 so why not spend a dollar more. it works in a movie theater cause you don't have any other choices, and it works for apple consumers, because if you want it to be an apple product, then you don't have any other choices either.",neutral,0.6212218999862671,0,False
2025-02-25,"""Nobody ever asks for that."" After Apple Intelligence couldnt be more real.",nobody ever asks apple intelligence couldnt real,"""nobody ever asks for that."" after apple intelligence couldnt be more real.",negative,0.5186686515808105,-1,False
2025-03-06,iPhone 16e is like the small popcorns and small icees at movie theaters that try to make the medium and large options look like better deals,iphone 16e like small popcorn small icees movie theater try make medium large option look like better deal,iphone 16e is like the small popcorns and small icees at movie theaters that try to make the medium and large options look like better deals,neutral,0.6089593768119812,0,False
2025-03-06,this 16e at $599 is just a setup for future price rising of a base iPhone model to $899,16e 599 setup future price rising base iphone model 899,this 16e at $599 is just a setup for future price rising of a base iphone model to $899,neutral,0.7477614879608154,0,False
2025-03-06,DBrand ad was so smooth I almost didn't notice it. More creators need to be doing this... Good on you bruh,dbrand smooth almost didnt notice creator need good bruh,dbrand ad was so smooth i almost didn't notice it. more creators need to be doing this... good on you bruh,positive,0.9508699774742126,1,False
2025-02-25,"1 camera, no MagSafe and $599 for a budget iPhone in 2025 is crazy",camera magsafe 599 budget iphone 2025 crazy,"1 camera, no magsafe and $599 for a budget iphone in 2025 is crazy",neutral,0.45960381627082825,0,True
2025-02-25,iPhone 16 e waste edition?,iphone waste edition,iphone 16 e waste edition?,neutral,0.8471707105636597,0,False
,I wish they would have just released an iPhone 16 Mini instead. I don't get why Apple doesn't believe there's a market for smaller phones.,wish would released iphone mini instead dont get apple doesnt believe there market smaller phone,i wish they would have just released an iphone 16 mini instead. i don't get why apple doesn't believe there's a market for smaller phones.,negative,0.7600037455558777,-1,False
2025-03-06,"I remember when this was for the top of the line flagship phone price.  

Looks like my upgrade cycles will continue to be ever 5-7 years.",remember top line flagship phone price look like upgrade cycle continue ever year,"i remember when this was for the top of the line flagship phone price.  

looks like my upgrade cycles will continue to be ever 5-7 years.",neutral,0.48440733551979065,0,False
2025-03-06,The trajectory of iPhones lately has me wanting to just keep my 13 Pro until it literally dies.,trajectory iphones lately wanting keep pro literally dy,the trajectory of iphones lately has me wanting to just keep my 13 pro until it literally dies.,negative,0.7573243975639343,-1,False
2025-03-06,The default phone with every new business contract. THAT is what this iPhone is for.,default phone every new business contract iphone,the default phone with every new business contract. that is what this iphone is for.,neutral,0.5818473696708679,0,False
2025-03-06,My guess is that in apple’s mind the “e” stands for essentials - the only problem that the essentials are a 600$ price tag,guess apple mind stand essential problem essential 600 price tag,my guess is that in apple’s mind the “e” stands for essentials - the only problem that the essentials are a 600$ price tag,negative,0.5228620767593384,-1,False
2025-03-13,"The people who buy this phone aren’t interested in MagSafe, Dynamic Island and fancy cameras. They just want a stripped down iPhone with long battery life. That’s exactly what the iPhone 16e is. It certainly doesn’t suffer an identity crisis. In fact, this  Zen-like, gimmick free iPhone is probably the one that Steve Jobs would use if he was still with us.",people buy phone arent interested magsafe dynamic island fancy camera want stripped iphone long battery life thats exactly iphone 16e certainly doesnt suffer identity crisis fact zenlike gimmick free iphone probably one steve job would use still,"the people who buy this phone aren’t interested in magsafe, dynamic island and fancy cameras. they just want a stripped down iphone with long battery life. that’s exactly what the iphone 16e is. it certainly doesn’t suffer an identity crisis. in fact, this  zen-like, gimmick free iphone is probably the one that steve jobs would use if he was still with us.",neutral,0.45001018047332764,0,True
2025-02-25,It's very easy to Apple make the 16e more affordable. Just need to raise the prices for the next generations of the regular ones.,easy apple make 16e affordable need raise price next generation regular one,it's very easy to apple make the 16e more affordable. just need to raise the prices for the next generations of the regular ones.,positive,0.603050172328949,1,False
2025-02-25,"Remember when you bought a new thing, and it was better than the old thing? Wild times",remember bought new thing better old thing wild time,"remember when you bought a new thing, and it was better than the old thing? wild times",positive,0.7735288739204407,1,False
2025-02-25,"I lowkey agree with Marques on how this phone is just a sneaky way to increase sales for the regular iPhone 16. Cause there are features here that the iPhone 15 doesn't have (ai, action button) but missing things that the iPhone 15 does have (MagSafe, ultra wide band, dynamic island and double cameras). So for most reasonable buyers who want the best of both worlds, the iPhone 16 is just there to balance all those desires. truly a strange product",lowkey agree marque phone sneaky way increase sale regular iphone cause feature iphone doesnt action button missing thing iphone magsafe ultra wide band dynamic island double camera reasonable buyer want best world iphone balance desire truly strange product,"i lowkey agree with marques on how this phone is just a sneaky way to increase sales for the regular iphone 16. cause there are features here that the iphone 15 doesn't have (ai, action button) but missing things that the iphone 15 does have (magsafe, ultra wide band, dynamic island and double cameras). so for most reasonable buyers who want the best of both worlds, the iphone 16 is just there to balance all those desires. truly a strange product",negative,0.522928774356842,-1,True
,The nods at 1:25,nod 125,the nods at 1:25,neutral,0.8438012003898621,0,False
2025-02-25,We got MKBHD doing theatre before GTA6!,got mkbhd theatre gta6,we got mkbhd doing theatre before gta6!,neutral,0.6699385643005371,0,False
2025-02-25,"this is by FAR the best depiction of this phone. i was tired of hearing mixed views on this phone, when there's objectively only one answer.",far best depiction phone tired hearing mixed view phone there objectively one answer,"this is by far the best depiction of this phone. i was tired of hearing mixed views on this phone, when there's objectively only one answer.",positive,0.8215816020965576,1,False
2025-03-06,"I remember when this was the price of the top-tier flagship phone.  

It appears that my upgrade cycles will continue to occur every 5-7 years.",remember price toptier flagship phone appears upgrade cycle continue occur every year,"i remember when this was the price of the top-tier flagship phone.  

it appears that my upgrade cycles will continue to occur every 5-7 years.",neutral,0.5660701990127563,0,False
2025-02-25,Marques with a thick stache make him look like he’s Steve Harvey’s son,marque thick stache make look like he steve harvey son,marques with a thick stache make him look like he’s steve harvey’s son,neutral,0.5551178455352783,0,False
2025-03-06,"Just traded in my teenage son's iPhone SE 3rd gen for $150 trade in credit. Initially, I thought I would get him a new ""SE,"" but it wasn't released in time for his birthday earlier this month. I ended up getting him an Iphone14 for less than the 16E, and he is happy with it.",traded teenage son iphone 3rd gen 150 trade credit initially thought would get new wasnt released time birthday earlier month ended getting iphone14 le 16e happy,"just traded in my teenage son's iphone se 3rd gen for $150 trade in credit. initially, i thought i would get him a new ""se,"" but it wasn't released in time for his birthday earlier this month. i ended up getting him an iphone14 for less than the 16e, and he is happy with it.",positive,0.5011076331138611,1,False
2025-02-25,Ok i liked the video just after seeing those mustache     0:10,liked video seeing mustache 010,ok i liked the video just after seeing those mustache     0:10,positive,0.7307531833648682,1,False
2025-03-06,01:29 that Head Movement,0129 head movement,01:29 that head movement,neutral,0.7964059710502625,0,False
2025-03-06,"I still firmly believe they should've put it in the body of the 13 Mini to bring back the small iPhone, during my time working for T-Mobile the amount of people who wanted a new Mini was astonishing",still firmly believe shouldve put body mini bring back small iphone time working tmobile amount people wanted new mini astonishing,"i still firmly believe they should've put it in the body of the 13 mini to bring back the small iphone, during my time working for t-mobile the amount of people who wanted a new mini was astonishing",positive,0.5901081562042236,1,False
,That mustache tho,mustache tho,that mustache tho,neutral,0.518777072429657,0,False
2025-03-13,7:21  he remembers those comments from throwing the phone..   7:18,721 remembers comment throwing phone 718,7:21  he remembers those comments from throwing the phone..   7:18,neutral,0.8758652210235596,0,False
2025-03-06,"iPhone XR, Recycled and Updated. ️️",iphone recycled updated,"iphone xr, recycled and updated. ️️",neutral,0.7874501347541809,0,False
,I like how your ad was integrated the video so smoothly,like integrated video smoothly,i like how your ad was integrated the video so smoothly,positive,0.9359453916549683,1,False
2025-02-25,"The saddest thing about this phone is not the single camera, nor the 60HZ, nor even the missing Magsafe.

It's that people exist that'd actually buy it.",saddest thing phone single camera 60hz even missing magsafe people exist thatd actually buy,"the saddest thing about this phone is not the single camera, nor the 60hz, nor even the missing magsafe.

it's that people exist that'd actually buy it.",negative,0.9319039583206177,-1,True
2025-02-25,"Should've named it SE 4, Price should've been $499, should've had magsafe, and they should've made it smaller to stay true to the real SE for people that like smaller phones and I bet u this would've made a big seller",shouldve named price shouldve 499 shouldve magsafe shouldve made smaller stay true real people like smaller phone bet wouldve made big seller,"should've named it se 4, price should've been $499, should've had magsafe, and they should've made it smaller to stay true to the real se for people that like smaller phones and i bet u this would've made a big seller",positive,0.5739370584487915,1,False
2025-03-06,1:28 i also hate high refresh rate got me dying,128 also hate high refresh rate got dying,1:28 i also hate high refresh rate got me dying,negative,0.9420998692512512,-1,False
,"The Best Hook I've seen on any channel in a long time ""robin hood"" LoL",best hook ive seen channel long time robin hood lol,"the best hook i've seen on any channel in a long time ""robin hood"" lol",positive,0.978228747844696,1,False
2025-02-25,MKBHD = Mustache KBHD,mkbhd mustache kbhd,mkbhd = mustache kbhd,neutral,0.8248870372772217,0,False
2025-03-06,The way bro threw it away without flinching  7:18,way bro threw away without flinching 718,the way bro threw it away without flinching  7:18,neutral,0.754443347454071,0,False
2025-03-06,"If anyone has seen the iPhone design team since 2017 can you let me know. They came to work for a day around 3-4 years ago and added a flat edge, it was a really revolutionary day and they haven’t been seen since",anyone seen iphone design team since 2017 let know came work day around year ago added flat edge really revolutionary day havent seen since,"if anyone has seen the iphone design team since 2017 can you let me know. they came to work for a day around 3-4 years ago and added a flat edge, it was a really revolutionary day and they haven’t been seen since",positive,0.7322418689727783,1,False
2025-02-25,Laughing my ass off at the confident head nodding 1:30,laughing as confident head nodding 130,laughing my ass off at the confident head nodding 1:30,positive,0.5635873079299927,1,False
2025-03-06,whoever that mustached guy was…he understands ME!,whoever mustached guy washe understands,whoever that mustached guy was…he understands me!,positive,0.6894519329071045,1,False
2025-02-25,1 camera in 2025 is wild,camera 2025 wild,1 camera in 2025 is wild,neutral,0.5342207551002502,0,False
2025-03-06,7:20 he was holding that laugh so hard,720 holding laugh hard,7:20 he was holding that laugh so hard,positive,0.7104014158248901,1,False
2025-02-25,Looks like Tim Cook didn't cook with this iPhone.,look like tim cook didnt cook iphone,looks like tim cook didn't cook with this iphone.,negative,0.6265310049057007,-1,False
2025-02-25,"Love the skit, please do more in the future!",love skit please future,"love the skit, please do more in the future!",positive,0.9869187474250793,1,False
2025-02-25,We got thick moustache Marques before GTA VI,got thick moustache marque gta,we got thick moustache marques before gta vi,neutral,0.8139227032661438,0,False
2025-02-25,Your honesty is refreshing!,honesty refreshing,your honesty is refreshing!,positive,0.9702855944633484,1,False
2025-03-06,"Have you all considered enterprise customers? I am a manager at a large healthcare company, and we have purchased tens of thousands of iPhone SEs from Apple. They serve as clinical devices to communicate and page providers in the hospital and at clinics. The only requirements we have are that they get extended software updates, long periods of compatibility with the software we use, and are durable and less expensive than the main line. I suspect a lot of businesses will buy these for their workforce.",considered enterprise customer manager large healthcare company purchased ten thousand iphone s apple serve clinical device communicate page provider hospital clinic requirement get extended software update long period compatibility software use durable le expensive main line suspect lot business buy workforce,"have you all considered enterprise customers? i am a manager at a large healthcare company, and we have purchased tens of thousands of iphone ses from apple. they serve as clinical devices to communicate and page providers in the hospital and at clinics. the only requirements we have are that they get extended software updates, long periods of compatibility with the software we use, and are durable and less expensive than the main line. i suspect a lot of businesses will buy these for their workforce.",positive,0.5541277527809143,1,False
2025-02-25,"The 16e fits one category of buyer that isn't as needy on the camera, MagSafe or the screen refresh rate; Corporate buyers. When you are purchasing 100+ devices at a time for fleets, the saving between a 16 or 16e becomes significant. In Australia the 16e comes in cheaper than the iPhone 14 so it allows a large step up in internal performance, extended life on iOS updates and gives warm fuzzies to employees receiving the ""latest"" model. Deep down, I think Apple knows this and the ""e"" is for Enterprise.",16e fit one category buyer isnt needy camera magsafe screen refresh rate corporate buyer purchasing 100 device time fleet saving 16e becomes significant australia 16e come cheaper iphone allows large step internal performance extended life io update give warm fuzzies employee receiving latest model deep think apple know enterprise,"the 16e fits one category of buyer that isn't as needy on the camera, magsafe or the screen refresh rate; corporate buyers. when you are purchasing 100+ devices at a time for fleets, the saving between a 16 or 16e becomes significant. in australia the 16e comes in cheaper than the iphone 14 so it allows a large step up in internal performance, extended life on ios updates and gives warm fuzzies to employees receiving the ""latest"" model. deep down, i think apple knows this and the ""e"" is for enterprise.",positive,0.6368123292922974,1,False
2025-02-25,Nice of Marques's dad to help out with that skit in the beginning,nice marquess dad help skit beginning,nice of marques's dad to help out with that skit in the beginning,positive,0.7555051445960999,1,False
,5:47 They got DOGEd,547 got doged,5:47 they got doged,neutral,0.7939961552619934,0,False
2025-02-25,Mr Brownlee acting before GTA6,brownlee acting gta6,mr brownlee acting before gta6,neutral,0.9101325273513794,0,False
2025-02-25,"I actually enjoyed the Ad experience, normally I’d skip but watching the green line progression was oddly satisfying lol. Well done.",actually enjoyed experience normally skip watching green line progression oddly satisfying lol well done,"i actually enjoyed the ad experience, normally i’d skip but watching the green line progression was oddly satisfying lol. well done.",positive,0.9801871180534363,1,False
2025-02-25,60 Hz refresh rate in 2025 is insane,refresh rate 2025 insane,60 hz refresh rate in 2025 is insane,positive,0.5624592900276184,1,False
2025-02-25,Love the new approach to doing ads - very transparent,love new approach ad transparent,love the new approach to doing ads - very transparent,positive,0.9631693363189697,1,False
2025-03-26,"With that mustache, i really expected Marques to say ""Howdy""",mustache really expected marque say howdy,"with that mustache, i really expected marques to say ""howdy""",neutral,0.5908034443855286,0,False
2025-02-25,“What? Who are you?” finished me  14:33,finished 1433,“what? who are you?” finished me  14:33,neutral,0.9260431528091431,0,False
2025-02-25,Such a classic nostalgic MKBHD review Thank you!,classic nostalgic mkbhd review thank,such a classic nostalgic mkbhd review thank you!,positive,0.9811945557594299,1,False
2025-02-25,"One of the best videos you all have done, hats off MKBHD team",one best video done hat mkbhd team,"one of the best videos you all have done, hats off mkbhd team",positive,0.9839683771133423,1,False
2025-03-06,Just wanted to say marq thanks for ya honest reviews been rocking with ya channel for years!!!,wanted say marq thanks honest review rocking channel year,just wanted to say marq thanks for ya honest reviews been rocking with ya channel for years!!!,positive,0.9709275364875793,1,False
2025-02-25,We got marques acting before gta 6,got marque acting gta,we got marques acting before gta 6,neutral,0.8555492162704468,0,False
2025-03-06,This is not for consumers. Its for companies to issue as work phones.,consumer company issue work phone,this is not for consumers. its for companies to issue as work phones.,negative,0.6298717260360718,-1,False
2025-02-25,The product red was literally my favorite color of all time they neeed to bring that Jawn back,product red literally favorite color time neeed bring jawn back,the product red was literally my favorite color of all time they neeed to bring that jawn back,positive,0.9656065106391907,1,False
2025-03-06,"Bro, that intro......you nailed it.",bro introyou nailed,"bro, that intro......you nailed it.",positive,0.9364756345748901,1,False
2025-02-25,Apple never fails to disappoint,apple never fails disappoint,apple never fails to disappoint,positive,0.8883604407310486,1,False
,"The fact that I've gotten so much YouTube ads about this phone, I'm wondering what's the special? Now I'm watching this guy after watched JerryRig's vid",fact ive gotten much youtube ad phone wondering whats special watching guy watched jerryrigs vid,"the fact that i've gotten so much youtube ads about this phone, i'm wondering what's the special? now i'm watching this guy after watched jerryrig's vid",neutral,0.5817300081253052,0,False
2025-02-25,"AT&T has a good deal on the 16e right now where with no trade-in, you get the phone for like $6/month for 36 months. That’s just over $200, which is significantly better than $600. Not sponsored, just saw the deal and went for it for my mom. She has an iPhone 11 so that was a no-brainer deal and she just pre-ordered the 16e to upgrade to. It’s good enough for what she uses and is a big upgrade over her current 11. It’s certain situations like that which make sense for the 16e.",att good deal 16e right tradein get phone like 6month month thats 200 significantly better 600 sponsored saw deal went mom iphone nobrainer deal preordered 16e upgrade good enough us big upgrade current certain situation like make sense 16e,"at&t has a good deal on the 16e right now where with no trade-in, you get the phone for like $6/month for 36 months. that’s just over $200, which is significantly better than $600. not sponsored, just saw the deal and went for it for my mom. she has an iphone 11 so that was a no-brainer deal and she just pre-ordered the 16e to upgrade to. it’s good enough for what she uses and is a big upgrade over her current 11. it’s certain situations like that which make sense for the 16e.",positive,0.8581017851829529,1,False
2025-02-25,appreciate the obvious indicator for the ad - feels more honest than the typical youtube ad,appreciate obvious indicator feel honest typical youtube,appreciate the obvious indicator for the ad - feels more honest than the typical youtube ad,positive,0.8372501134872437,1,False
2025-03-06,the aggressive head nods,aggressive head nod,the aggressive head nods,neutral,0.7911378145217896,0,False
2025-03-06,I love Marques starting with a skit he should do that more.,love marque starting skit,i love marques starting with a skit he should do that more.,positive,0.9712273478507996,1,False
2025-03-06,"1. The iPhone 16e should be priced between $399 and $449, with a maximum of $499.
 2. They should not have removed the UW chip and MagSafe, as it impacts the Apple ecosystem.
 3. The camera should be the same as the base iPhone 16, ideally with a 1X cinematic mode if possible.",iphone 16e priced 399 449 maximum 499 removed chip magsafe impact apple ecosystem camera base iphone ideally cinematic mode possible,"1. the iphone 16e should be priced between $399 and $449, with a maximum of $499.
 2. they should not have removed the uw chip and magsafe, as it impacts the apple ecosystem.
 3. the camera should be the same as the base iphone 16, ideally with a 1x cinematic mode if possible.",neutral,0.760450541973114,0,True
2025-02-25,"i like the 'ad' setup, letting people know that the ad started.",like setup letting people know started,"i like the 'ad' setup, letting people know that the ad started.",positive,0.7580147385597229,1,False
2025-03-13,"I am glad I found this video, I almost change my 14 for this phone. I didn’t notice about the camera thank you.",glad found video almost change phone didnt notice camera thank,"i am glad i found this video, i almost change my 14 for this phone. i didn’t notice about the camera thank you.",positive,0.9466636180877686,1,False
2025-02-25,(Not Boring) Weather is the app at 11:14 for everyone wondering.,boring weather app 1114 everyone wondering,(not boring) weather is the app at 11:14 for everyone wondering.,neutral,0.5948437452316284,0,False
