date,text,clean_text_analysis,clean_text_sentiment,sentiment_label,sentiment_score,sentiment_value,has_keyword
2025-02-28,"This is for people who wanted a normal 13 or 14 six months ago, this is the replacement. It sucks they killed the sub 500 iPhone though.",people wanted normal six month ago replacement suck killed sub 500 iphone though,"this is for people who wanted a normal 13 or 14 six months ago, this is the replacement. it sucks they killed the sub 500 iphone though.",negative,0.8486466407775879,-1,False
2025-02-27,It’s a great phone. It’s just too expensive.,great phone expensive,it’s a great phone. it’s just too expensive.,positive,0.6971268057823181,1,False
2025-02-27,"The battery life is something that has received near universal praise, so that’s really cool to see. The price just sucks. Maybe with deals that some places are certain to have it’ll be a good bargain.",battery life something received near universal praise thats really cool see price suck maybe deal place certain itll good bargain,"the battery life is something that has received near universal praise, so that’s really cool to see. the price just sucks. maybe with deals that some places are certain to have it’ll be a good bargain.",positive,0.7685196995735168,1,False
2025-02-28,"Yeah it’s only $71 ($1.99 for 36 months) through ATT, with no trade-in perfect phone for my mom IMO. Though apparently it’s the same price for the iPhone 15 currently as well…",yeah 199 month att tradein perfect phone mom imo though apparently price iphone currently well,"yeah it’s only $71 ($1.99 for 36 months) through att, with no trade-in perfect phone for my mom imo. though apparently it’s the same price for the iphone 15 currently as well…",positive,0.5905055999755859,1,False
2025-02-28,"Not according to Toms Guide though

[https://www.tomsguide.com/phones/iphones/iphone-16e-battery-life](https://www.tomsguide.com/phones/iphones/iphone-16e-battery-life)",according tom guide though,"not according to toms guide though

[",neutral,0.758084774017334,0,False
2025-03-03,30 minutes more than the 16? What’s not to like.,minute whats like,30 minutes more than the 16? what’s not to like.,positive,0.673460066318512,1,False
2025-02-28,"Received praise from whom, paid reviewers on yt and elsewhere? It's 2025, time to stop believing everything you read and see online",received praise paid reviewer elsewhere 2025 time stop believing everything read see online,"received praise from whom, paid reviewers on yt and elsewhere? it's 2025, time to stop believing everything you read and see online",negative,0.5169397592544556,-1,False
2025-03-01,Battery at the cost of having a 60hz screen,battery cost 60hz screen,battery at the cost of having a 60hz screen,neutral,0.6604153513908386,0,False
2025-02-28,"There are some killer carrier deals though. On T-Mobile, it's free to upgrade from iPhone 13 even on older plans, at least if you do it at Costco.",killer carrier deal though tmobile free upgrade iphone even older plan least costco,"there are some killer carrier deals though. on t-mobile, it's free to upgrade from iphone 13 even on older plans, at least if you do it at costco.",positive,0.921699583530426,1,False
2025-02-28,Then It's not a great phone.,great phone,then it's not a great phone.,negative,0.8359299302101135,-1,False
2025-02-28,For 100 USD/Euros less it would be just a great phone.,100 usdeuros le would great phone,for 100 usd/euros less it would be just a great phone.,positive,0.8794134855270386,1,False
2025-02-28,I love the way it looks. So simple!,love way look simple,i love the way it looks. so simple!,positive,0.9808713793754578,1,False
2025-02-28,"Me too! It’s been a while since I’ve felt like a new iPhone looked good. Now if only it was smaller, I’d honestly buy it in a heartbeat, even at that price",since ive felt like new iphone looked good smaller honestly buy heartbeat even price,"me too! it’s been a while since i’ve felt like a new iphone looked good. now if only it was smaller, i’d honestly buy it in a heartbeat, even at that price",positive,0.9331880807876587,1,False
2025-03-02,reminds me of the 4/4s models,reminds 44s model,reminds me of the 4/4s models,neutral,0.7842875719070435,0,False
2025-02-27,"The SE has always been an “eh, it’s alright” product line. It was just priced attractively, and fairly, which made it feel less so.",always alright product line priced attractively fairly made feel le,"the se has always been an “eh, it’s alright” product line. it was just priced attractively, and fairly, which made it feel less so.",negative,0.565198540687561,-1,False
2025-03-02,"I bought one.  Got delivered on Friday.  It is an upgrade from an XS that that had both the speakers go bad.  I am happy with the purchase.  I like that it is brand new with a brand new battery and future-proof.  I was really hoping that it was going to be $499 and was very disappointed when I woke up in the morning and saw that it was $599.  I had to grapple with the price increase, but decided it was still a good value for my needs.  I think Apple priced it well, if it was less, it would take away sales from the other models.  I this the big disservice is that the price rumors were wrong, so everyone was expecting it to cost less.",bought one got delivered friday upgrade speaker bad happy purchase like brand new brand new battery futureproof really hoping going 499 disappointed woke morning saw 599 grapple price increase decided still good value need think apple priced well le would take away sale model big disservice price rumor wrong everyone expecting cost le,"i bought one.  got delivered on friday.  it is an upgrade from an xs that that had both the speakers go bad.  i am happy with the purchase.  i like that it is brand new with a brand new battery and future-proof.  i was really hoping that it was going to be $499 and was very disappointed when i woke up in the morning and saw that it was $599.  i had to grapple with the price increase, but decided it was still a good value for my needs.  i think apple priced it well, if it was less, it would take away sales from the other models.  i this the big disservice is that the price rumors were wrong, so everyone was expecting it to cost less.",positive,0.9242950677871704,1,True
2025-03-21,"Hello, can i ask you something? I see that often people find apple products expensive in the US. I believe you are from there. So here is my question, why do you think the iphone is expensive ? If you gain minimal weight, you only need to work 2 weeks to afford a base model, am i right?

Please forgive me if my english is bad, is not my first language.",hello ask something see often people find apple product expensive believe question think iphone expensive gain minimal weight need work week afford base model right please forgive english bad first language,"hello, can i ask you something? i see that often people find apple products expensive in the us. i believe you are from there. so here is my question, why do you think the iphone is expensive ? if you gain minimal weight, you only need to work 2 weeks to afford a base model, am i right?

please forgive me if my english is bad, is not my first language.",neutral,0.6787369847297668,0,False
2025-03-26,"Everything is expensive in the US. Working minimum wage doesn’t even afford you a house or apartment to rent. With the cost of food, car, insurance, etc- it’s expensive. The cost of living is much higher than the minimum wage, it doesn’t make financial sense.",everything expensive working minimum wage doesnt even afford house apartment rent cost food car insurance etc expensive cost living much higher minimum wage doesnt make financial sense,"everything is expensive in the us. working minimum wage doesn’t even afford you a house or apartment to rent. with the cost of food, car, insurance, etc- it’s expensive. the cost of living is much higher than the minimum wage, it doesn’t make financial sense.",negative,0.8836363554000854,-1,False
2025-03-26,"In here is the same, pretty much impossible to live with minimum wage. It's just that in my country we need 4 to 5 of minmum wage work to buy a recent iphone. That's why i never understand people thinking that in the US is too expensive. By the way, i'm from Brazil.",pretty much impossible live minimum wage country need minmum wage work buy recent iphone thats never understand people thinking expensive way brazil,"in here is the same, pretty much impossible to live with minimum wage. it's just that in my country we need 4 to 5 of minmum wage work to buy a recent iphone. that's why i never understand people thinking that in the us is too expensive. by the way, i'm from brazil.",negative,0.7914556860923767,-1,False
2025-03-09,How’s the battery?,hows battery,how’s the battery?,neutral,0.8969982862472534,0,False
2025-03-11,It's great.  Pretty hard to beat.,great pretty hard beat,it's great.  pretty hard to beat.,positive,0.976969838142395,1,False
2025-02-28,"$400-500 is acceptable

$600 im keeping my iPhone 11",400500 acceptable 600 keeping iphone,"$400-500 is acceptable

$600 im keeping my iphone 11",neutral,0.5544177889823914,0,False
2025-02-28,Haha same …,haha,haha same …,neutral,0.5425728559494019,0,False
2025-03-03,16 e is actually a huge upgrade from the 11 lol.,actually huge upgrade lol,16 e is actually a huge upgrade from the 11 lol.,positive,0.9527314305305481,1,False
2025-03-04,"So is the 15 Pro, which can now be bought for $600 as well through refurbished/renewed devices. I understand getting the 16e for free with a carrier deal etc. sounds great, but only somebody with brain damage is going to buy it for $600. 60Hz, low brigtness screen, neutered camera because of a much smaller sensor and also missing sensor shift stabilization, no magsafe, ancient wireless charging speed and no UWB. Asking $600 for this downgrade is a scam, no matter how large battery they put in it.",pro bought 600 well refurbishedrenewed device understand getting 16e free carrier deal etc sound great somebody brain damage going buy 600 60hz low brigtness screen neutered camera much smaller sensor also missing sensor shift stabilization magsafe ancient wireless charging speed uwb asking 600 downgrade scam matter large battery put,"so is the 15 pro, which can now be bought for $600 as well through refurbished/renewed devices. i understand getting the 16e for free with a carrier deal etc. sounds great, but only somebody with brain damage is going to buy it for $600. 60hz, low brigtness screen, neutered camera because of a much smaller sensor and also missing sensor shift stabilization, no magsafe, ancient wireless charging speed and no uwb. asking $600 for this downgrade is a scam, no matter how large battery they put in it.",negative,0.5471356511116028,-1,True
2025-03-11,"I know for you that comparison works for you, but for A LOT of consumers, comparing a used product with a brand new one with brand new battery is apples and oranges.",know comparison work lot consumer comparing used product brand new one brand new battery apple orange,"i know for you that comparison works for you, but for a lot of consumers, comparing a used product with a brand new one with brand new battery is apples and oranges.",neutral,0.6273254156112671,0,False
2025-03-11,"That would be true if refurbished phones didn’t have brand new batteries and didn’t use official Apple parts, which they do. I’m aware that some people want a brand new phone, and in that regard it’s still a much better deal to buy a new iPhone 15, where the only thing missing from the 16e is Apple Intelligence, which is useless anyway (speaking from experience from my 15PM). If I handed somebody both a new 16e and a refurbished 15 Pro out of their boxes, 95% of users wouldn’t be able to tell a difference in their condition. But I have to pay respect to Apple for having such customers, who just walk into a store and ask for the newest cheapest model and hand out $600 with zero research. I know a few people who did that.",would true refurbished phone didnt brand new battery didnt use official apple part aware people want brand new phone regard still much better deal buy new iphone thing missing 16e apple intelligence useless anyway speaking experience 15pm handed somebody new 16e refurbished pro box user wouldnt able tell difference condition pay respect apple customer walk store ask newest cheapest model hand 600 zero research know people,"that would be true if refurbished phones didn’t have brand new batteries and didn’t use official apple parts, which they do. i’m aware that some people want a brand new phone, and in that regard it’s still a much better deal to buy a new iphone 15, where the only thing missing from the 16e is apple intelligence, which is useless anyway (speaking from experience from my 15pm). if i handed somebody both a new 16e and a refurbished 15 pro out of their boxes, 95% of users wouldn’t be able to tell a difference in their condition. but i have to pay respect to apple for having such customers, who just walk into a store and ask for the newest cheapest model and hand out $600 with zero research. i know a few people who did that.",neutral,0.6227772831916809,0,True
2025-03-04,"I have been pricing the carrier deals, and I’m not impressed so far.  I’d rather finance it and just use a monthly card at this point!  Has anybody done this?",pricing carrier deal impressed far rather finance use monthly card point anybody done,"i have been pricing the carrier deals, and i’m not impressed so far.  i’d rather finance it and just use a monthly card at this point!  has anybody done this?",negative,0.9145030975341797,-1,False
2025-02-28,I'm amazed I have had my Mini for so long. Battery at 78 but it's not a problem for me.,amazed mini long battery problem,i'm amazed i have had my mini for so long. battery at 78 but it's not a problem for me.,positive,0.6362569332122803,1,False
2025-03-04,Which ios version are you running?,io version running,which ios version are you running?,neutral,0.9445571303367615,0,False
2025-03-04,Most recent. 18.3.1 or whatever.,recent 1831 whatever,most recent. 18.3.1 or whatever.,neutral,0.9129552245140076,0,False
2025-03-07,Really? How well does it run??,really well run,really? how well does it run??,neutral,0.6772854924201965,0,False
2025-03-07,Zero performance problems besides the battery wearing down. I keep it plugged in most of the time. Battery life is maybe 4-6 hours using it unplugged.,zero performance problem besides battery wearing keep plugged time battery life maybe hour using unplugged,zero performance problems besides the battery wearing down. i keep it plugged in most of the time. battery life is maybe 4-6 hours using it unplugged.,neutral,0.5082204937934875,0,False
2025-02-27,It’s the phone designed to look cheap compared to a $1100 17Pro.,phone designed look cheap compared 1100 17pro,it’s the phone designed to look cheap compared to a $1100 17pro.,negative,0.5280226469039917,-1,True
2025-02-28,"If the iPhone 16e had a larger screen, it would seem like a good value compared to the iPhone 16 Pro Max. However, with its smaller screen, it inevitably gets compared to budget iPhones, and it's hard not to conclude that it's overpriced for the features it lacks.",iphone 16e larger screen would seem like good value compared iphone pro max however smaller screen inevitably get compared budget iphones hard conclude overpriced feature lack,"if the iphone 16e had a larger screen, it would seem like a good value compared to the iphone 16 pro max. however, with its smaller screen, it inevitably gets compared to budget iphones, and it's hard not to conclude that it's overpriced for the features it lacks.",neutral,0.513866662979126,0,True
2025-02-28,"It's not even a small screen; it's the same size as the 16 and not much smaller than the 16 Pro, which is baffling IMO. Would've been nice if it was 5.8"" or had a mini 5.4"" size.",even small screen size much smaller pro baffling imo wouldve nice mini size,"it's not even a small screen; it's the same size as the 16 and not much smaller than the 16 pro, which is baffling imo. would've been nice if it was 5.8"" or had a mini 5.4"" size.",negative,0.6970613598823547,-1,False
2025-02-28,At this price I'll just stick with my SE3. It still works perfectly fine.,price ill stick se3 still work perfectly fine,at this price i'll just stick with my se3. it still works perfectly fine.,positive,0.6236860752105713,1,False
2025-03-04,"I’m still on my little SE2, but it can’t take any more updates &amp; is getting a bit dicey.  I’m on 18.3 now.",still little se2 cant take update amp getting bit dicey 183,"i’m still on my little se2, but it can’t take any more updates &amp; is getting a bit dicey.  i’m on 18.3 now.",negative,0.6882814764976501,-1,False
2025-03-18,just installed 18.3.2 on my SE2 this morning.  Seems to be running fine.,installed 1832 se2 morning seems running fine,just installed 18.3.2 on my se2 this morning.  seems to be running fine.,positive,0.7095000743865967,1,False
2025-02-28,"SE2020 here 
And damn that phone looks clean AF 
But really wondering between 16e and 15pro hmm hmmm",se2020 damn phone look clean really wondering 16e 15pro hmm hmmm,"se2020 here 
and damn that phone looks clean af 
but really wondering between 16e and 15pro hmm hmmm",positive,0.7288190722465515,1,False
2025-03-01,I still have an 8plus. This looks good enough for me lol,still 8plus look good enough lol,i still have an 8plus. this looks good enough for me lol,positive,0.8439071774482727,1,False
2025-02-28,This was the same problem with the iPad 10. They need to lower the price and then it would be worth it. $449 for a base iPad and $599 for a base iPhone is crazy,problem ipad need lower price would worth 449 base ipad 599 base iphone crazy,this was the same problem with the ipad 10. they need to lower the price and then it would be worth it. $449 for a base ipad and $599 for a base iphone is crazy,negative,0.4598558843135834,-1,False
2025-02-28,The base iPad is now $349 USD,base ipad 349 usd,the base ipad is now $349 usd,neutral,0.8443830609321594,0,False
2025-02-28,"everything has gotten expensive recently. I guess except labor? Like hey! Prices are up, costs are tough! 50% increase! But salaries and wages? Oh, we'll give you 6%.",everything gotten expensive recently guess except labor like hey price cost tough increase salary wage well give,"everything has gotten expensive recently. i guess except labor? like hey! prices are up, costs are tough! 50% increase! but salaries and wages? oh, we'll give you 6%.",negative,0.8679357767105103,-1,False
2025-03-01,Chinese minimum wage has increased by something like 250% over the last decade. That’s why things are expensive.,chinese minimum wage increased something like 250 last decade thats thing expensive,chinese minimum wage has increased by something like 250% over the last decade. that’s why things are expensive.,negative,0.6639288067817688,-1,False
2025-03-20,**good.** the workers deserve it.,good worker deserve,good. the workers deserve it.,positive,0.8783575296401978,1,False
2025-03-24,I don’t disagree with that,dont disagree,i don’t disagree with that,neutral,0.8031300902366638,0,False
2025-02-28,Ehh my dad paid the equivalent of $8k for a pc back in the 80’s. $449 seems cheap to me.,ehh dad paid equivalent back 80 449 seems cheap,ehh my dad paid the equivalent of $8k for a pc back in the 80’s. $449 seems cheap to me.,neutral,0.7413029074668884,0,True
2025-02-28,"Yeah we'll my dad paid 10c for a loaf of bread in the 70s, $449 seems expensive to me.",yeah well dad paid 10c loaf bread 70 449 seems expensive,"yeah we'll my dad paid 10c for a loaf of bread in the 70s, $449 seems expensive to me.",neutral,0.5015332698822021,0,False
2025-02-27,I just. Want to know if it matches battery life of 14 plus,want know match battery life plus,i just. want to know if it matches battery life of 14 plus,neutral,0.6539468169212341,0,False
2025-02-28,"Based on my very limited and quick research, the 14 plus gets approx 11:57 of battery, whereas the 16e gets 12:41. So, it exceeds the 14 plus battery life.",based limited quick research plus get approx 1157 battery whereas 16e get 1241 exceeds plus battery life,"based on my very limited and quick research, the 14 plus gets approx 11:57 of battery, whereas the 16e gets 12:41. so, it exceeds the 14 plus battery life.",neutral,0.7855579257011414,0,True
2025-02-28,Awesome. I am going to get it then as I am not required to pay much for this upgrade,awesome going get required pay much upgrade,awesome. i am going to get it then as i am not required to pay much for this upgrade,positive,0.9569931030273438,1,False
2025-03-03,"It would be a downgrade in terms of camera (no ultra wide), display size, no MagSafe, no UWB chip. 
But the ram and the chip is nice though.",would downgrade term camera ultra wide display size magsafe uwb chip ram chip nice though,"it would be a downgrade in terms of camera (no ultra wide), display size, no magsafe, no uwb chip. 
but the ram and the chip is nice though.",negative,0.6509074568748474,-1,False
2025-03-01,"I just traded my 13 in for this one yesterday and because of deal they had it's only going to $4 a month. For that price, I can't really complain. I paid more for my 13 than this one and it's running a lot more smoothly. Hoping that the battery doesn't suck as my 13's battery was awful, it's supposed to be okay with the right wattage block that goes into the wall. We'll see how it goes. It's much more affordable than the other 16's that just came out as well",traded one yesterday deal going month price cant really complain paid one running lot smoothly hoping battery doesnt suck 13 battery awful supposed okay right wattage block go wall well see go much affordable 16 came well,"i just traded my 13 in for this one yesterday and because of deal they had it's only going to $4 a month. for that price, i can't really complain. i paid more for my 13 than this one and it's running a lot more smoothly. hoping that the battery doesn't suck as my 13's battery was awful, it's supposed to be okay with the right wattage block that goes into the wall. we'll see how it goes. it's much more affordable than the other 16's that just came out as well",positive,0.8522188067436218,1,False
2025-03-09,How is the battery on your 16e ?,battery 16e,how is the battery on your 16e ?,neutral,0.8824865221977234,0,False
2025-03-09,"It's currently much better than my 13! We will see as time goes on, but my 13 was dying in the middle of the day. With the 16 I'm barely charging my phone now, maybe once a day or every other day! And it charges super fast!",currently much better see time go dying middle day barely charging phone maybe day every day charge super fast,"it's currently much better than my 13! we will see as time goes on, but my 13 was dying in the middle of the day. with the 16 i'm barely charging my phone now, maybe once a day or every other day! and it charges super fast!",positive,0.9311219453811646,1,False
2025-03-11,"I have the 13 now and am thinking of buying the 16e as well. The 13 battery life has been awful, I agree!",thinking buying 16e well battery life awful agree,"i have the 13 now and am thinking of buying the 16e as well. the 13 battery life has been awful, i agree!",negative,0.7777462601661682,-1,False
2025-03-01,TOOOOOOO FKG BIG!,tooooooo fkg big,tooooooo fkg big!,positive,0.4057185649871826,1,False
2025-03-03,"In the UK you can get a 14 Pro Max for cheaper, granted you won’t get ‘Apple intelligence’ (stop laughing) and it’s not supported for as long but even if you throw in the price of a potential battery replacement it seems no contest to me.",get pro max cheaper granted wont get apple intelligence stop laughing supported long even throw price potential battery replacement seems contest,"in the uk you can get a 14 pro max for cheaper, granted you won’t get ‘apple intelligence’ (stop laughing) and it’s not supported for as long but even if you throw in the price of a potential battery replacement it seems no contest to me.",neutral,0.4750243127346039,0,False
2025-03-05,"I used iphone 11 for almost 5 years and it's still working fine but low battery health. 

I was deciding whether I should replace my battery or get a new iphone and seemed like 16E wasn't a bad choice for me. So I bought it yesterday. 

For people like me who have old iphone and don't wanna pay $1000 for 16 pro, it's not a bad upgrade for $600 haha.  At this point, it's all self-satisfaction.",used iphone almost year still working fine low battery health deciding whether replace battery get new iphone seemed like 16e wasnt bad choice bought yesterday people like old iphone dont wan pay 1000 pro bad upgrade 600 haha point selfsatisfaction,"i used iphone 11 for almost 5 years and it's still working fine but low battery health. 

i was deciding whether i should replace my battery or get a new iphone and seemed like 16e wasn't a bad choice for me. so i bought it yesterday. 

for people like me who have old iphone and don't wanna pay $1000 for 16 pro, it's not a bad upgrade for $600 haha.  at this point, it's all self-satisfaction.",positive,0.6038998961448669,1,False
2025-03-18,"With all the iPhone deals available 16e is actually priced at $350-400 in most cases. Straight talk, Verizon prepaid deal. You just have to wait 2 months to get it unlocked. What’s not to like?",iphone deal available 16e actually priced 350400 case straight talk verizon prepaid deal wait month get unlocked whats like,"with all the iphone deals available 16e is actually priced at $350-400 in most cases. straight talk, verizon prepaid deal. you just have to wait 2 months to get it unlocked. what’s not to like?",positive,0.6338253617286682,1,False
