date,text
2024-12-14,"Do you want stereo sound? Do you like old rock classics? Pink Floyd, Led Zeppelin, the Beatles? I’m so pissed. I had a 12 with AirPods 3 no stereo. My AirPods 3 have stereo on my iPad mini 6 with all music services. 

My wife is rolling on a 13 with my old AirPods 1 SHE HAS STEREO. I can’t stand the way pros feel in my ear.

So finally I upgraded to iPhone 16 with AirPods 4 and a free trial to Apple Music. 
Listened to Dark Side of the Moon with Apple Music De Dolby Atmos • Al Hi-Res Lossless…WTF NO STEREO!!!  I’m so pissed their flagship phone with their latest AirPods and no stereo. They are intentionally crippling their device on their own music player. Rant over. ***steps off soapbox***"
2024-12-14,The 4s. These silicon tips are not worth any kind of sound quality. Simplify awful.
2024-12-14,2’s
2024-12-14,Pro 2 if you’re comfortable with silicone or AirPods Gen 4 ANC
2024-12-14,Costco has the 2 pro for 200 dollars and comes with 2 years apple care for free.
2024-12-14,"I’d go with the Pro 2, I didn’t even know about them until I got them for Xmas the other year, I was surprised by how they felt and sounded! 

It’s worth the extra money. 🤩 I love the NC option and the transparency options 👍🏼"
2024-12-14,"Depends on whether or not you like the silicone tips. I find them much more comfortable than the plastic, so I’d say Pro 2."
2024-12-14,Pro 2 since they are better and almost always on sale  for less than $180
2024-12-14,Could’ve got the Pros for $160. Trades in my old ones and got another $35 off
2024-12-14,Go try them on. Whichever fit your ears best is the one.
2024-12-14,Bellsprout or angry alien. Simple choice.
2024-12-14,4
2024-12-14,Definitely the Pros. Amazon has them on sale for the holidays so now’s a good time to get them.
2024-12-14,"APP2, _definitely_. MSRP sucks but at sale price it's a way better deal."
2024-12-14,i got both. airpods 4 i use out and about/work and pros 2 i use in my own time or to sleep. pros 2 probably more quality but the 4s with ANC are valid
2024-12-14,I went for pro 2 on Black Friday
2024-12-14,Pro 2 they are also about the same price as the AirPod 4 ANC right now
2024-12-14,I love my PRO 2
2024-12-14,"I have both and after 2 years of using the Pro 2 I’m liking the AirPods 4 with ANC more and more each day, sound quality sounds the same to me and the ANC works really good. I find them more comfortable after a couple of hours of use. The only thing I miss is the slide to adjust volume feature."
2024-12-14,"Go with the 4's if you don't like the rubber tips, go with the Pro 2's if you like the rubber tips."
2024-12-14,Pro 2!!! FTW
2024-12-14,"I personally chose the AirPods 4 with ANC.

I used a pair of 1st-gen AirPods Pro before this. Even though the ANC was great, I didn’t like having to use the silicone tips because they were uncomfortable in my ears.

I can tolerate the AirPods 4 with ANC much more. The ANC is extremely impressive given that the earbuds don’t have silicone tips. Adaptive mode (combines Transparency and ANC) works amazingly, especially when combined with Conversation Awareness on. I don’t have to take off my headphones just to talk to someone or hear what’s going on around me. The audio quality is great for what I need.

I don’t need the extra perks that come with the AirPods Pro 2."
2024-12-14,Pro 2
2024-12-14,Depends on what you like - I have the pros with the comply foam tips and I’ll never use anything else. My husband hates anything in-ear so he has the AirPods 4 and loves them.
2024-12-14,Pro 2s if u have money
2024-12-14,Wait for new version
2024-12-14,i’ve had both. the pros 2 are much more comfortable. the ones on the left would hurt my ears.
2024-12-14,"Used the 4s for a week, fit horribly, haven't tried the Pro 2s but they're guaranteed to fit in any ear well."
2024-12-14,Combine them AirPod 6
2024-12-14,Pro 2 and buy comply foam tips.
2024-12-14,AirPods Pro Max. Best Buy has the lightning version on sale right now
2024-12-14,"Both are good - if you like the format of regular AirPods more than pro go with 4 - if you like pro format go with pros. 

To be honest even with 4s being newer the chip being used is the same so it’s not like the AirPod pro 2s are old they use both the same tech"
2024-12-14,none of these. So cheap on hardware.
2024-12-14,Pro 2... ofcourse
2024-12-14,"Neither, basic pods at Walmart sound better."
2024-12-14,"Have both , pro 2 is good in terms of sound and ANC. 4 is compact , no tips , okayish ANC if you get the ANC version ."
2024-12-14,I got the AirPod 4s upgrading from Gen 2 AirPods. And I love them. I’ve tried my girlfriends pro 2s I don’t like how they fit and fall out of my ears
2024-12-14,"depends on what ur looking for! (i hate to be that person so imma make it rlly easy)

the most important:

do you want rubber tips?

if earbuds tend to fall out of your ear a lot, id go with the pro 2 since the silicone/rubber tip goes into your ear and prevents sliding. the airpods 4 are better shaped than the 1st gen airpods and they sit more comofortably in your ear but they can fall out if you're someone like me

i recommned the pro 2's:

i've had the gen 1 pros for like 3 years and i love them, batterys pretty decent, sound quality is great, noise cancellation is pristine, transparency mode is crisp, etc

  
also, the airpods 4 r more prone to getting dirty from earwax since nothing is protecting them, my airpods pro r super clean and i never clean them properly. not a single bit of earwax has obstructed the speaker"
2024-12-14,AirPods 4 didn’t fit well in my ears. It’s bigger than the original AirPods. I went with AirPods Pro 2 instead and have no regrets. The sound quality is really good in pro model.
2024-12-14,"Pro 2, for $150 it’s not even close"
2024-12-14,"Just got my Pro 2’s delivered yesterday after buying them on Amazon during Black Friday. For what it can do, I’d say get them. The silicone ear tips weren’t the best so I got a set of memory foam tips off Amazon that work great. 👍"
2024-12-14,"The AirPods 4 looks incredibly similar to the 3rd gen AirPods.. and let me tell you that was the worst purchase of my life. The 4th and 3rd look like they have the same shape in this photo, the 3rd gen’s would not stay in my ear for shit, fucking fly out of my ear, so unless you have enough earwax to act as an adhesive to the airpod then I highly reccomend you opt for the AirPods Pro 2.  Not to mention since the airpod fit so goddamn horribly in my ear, the sound quality was like I was listening to the music from the inside of a microwave. So I wouldn’t be surprised if this was also be the case for the 4’s, and all the whatever new fancy qualities it offers, they’re probably also compromised due to just how poorly they are designed. Those AirPods really pissed me the fuck off, and I bought em back when they were 200 something dollars.. never returned something faster. GET THE AIRPODS PRO 2 WHAT ARE YOU WAITING FOR!!!!"
2024-12-14,I prefer the AirPods 4 since I hate the silicon tip kind.
2024-12-14,"AirPod Pro 2’s have stem volume control, AirPod 4’s don’t (I learnt this the hard way) if it matters to you. I preferred the 2 Pros"
2024-12-14,Pro 2 is the best
2024-12-14,Pro
2024-12-14,Question as old as time. Prooooos before hooooes duuuuude
2024-12-14,"Buy either model, but sure you get the AirPods 4 with ANC."
2024-12-14,It’s one of those times when the price difference is not even that huge while the quality is absolutely on another level for all aspects there are so go with pro 2’s
2024-12-14,"I chose AirPods 4 ANC, not the price problem, but I went to an Apple Store and tried them both out.  

Both sounded amazing, but I hated the feeling of the earbuds in my ear canal.

I recommend trying them both out, and if you don’t mind the earbuds then get the AirPods Pro 2"
2024-12-14,"bought the pros 2 recently and they are amazing, have had the pros 1 since released and always liked them, but at this point they are a bit old and due for an upgrade so i got the pros 2 when i bought my new 16 pro max and they are insane, they’re so comfortable compared to the normal airpods imo and honestly, the ANC is actually kinda ridiculous, i was at a race track and wanted to zone out for a little when i was eating, so i put them in thinking they would get rid of a little noise, and i genuinely took them out again to see if there was a crash and the racing had stopped because of how good the ANC is, i literally couldn’t hear a thing. i’m not usually one to harp on about the quality of products but the pros 2 are actually insanely good, i can’t speak on the longevity but the sound quality, ANC and comfortability make these perfect for me"
2024-12-14,Go for pro 2. I promise you. Huge huge difference
2024-12-14,"Noise cancellation works best with a complete seal of your ears, (whether as in-ear silicone plugs or full over-ear cans for example).
You want the best that apple offers? Go Pro2.

AirPods 4 don’t have silicone tips, and being an ear bud without a full seal, means noise cancellation won’t be as good. 
The side effect of this is you’ll hear more of the outside world while using them.

Why is this a good thing?
Some people are allergic to silicone, or find that the full seal is uncomfortable or irritating to be able to use the Pro2s for long.

So,
for most, go Pro2.
For those that take exception to silicone, go Pod4."
2024-12-14,Mods can we just pin this thread?
2024-12-14,What airpods 4 you want to buy? With noise cancellation or without?
2024-12-14,AirPods 4
2024-12-14,Definitely the Pro 2s
2024-12-14,The Pro 2 if you want the better sound quality
2024-12-14,"Pro 2 were cheaper ($153) than AirPods 4 anc on Black Friday, double whammy worth it"
2024-12-14,Anytime it’s AirPods Pro 2!!!
2024-12-14,"If you don’t like the gel tips like me, get the 4’s. I’ve been using gen 2’s for years and these made me finally get an upgrade"
2024-12-14,"I’ve tried both, and for me, the AirPods Pro 2 just feel better with the fit and sound quality, especially with the silicone tips. The AirPods 4 are not bad..but if you’re used to the Pro 2, you might miss that comfy fit."
2024-12-14,I have the AP 4 with ANC and they work amazing for me. Driving my moped with noise cancelling on i couldn’t even hear the engine under me while revving. They also fit really good in my ears and have never fallen out and i’ve been using them for like 3 months. I really like them but can’t speak much about the APP2s
2024-12-14,You like in ear or not? That’s basically what the big deciding factor is when it comes to the pro.
2024-12-14,"Had the Pro 2 until I’ve lost them. Went desperately to the store to buy a new pair and the clerk told me to buy the new Airpods 4 which are better. I listened to him and regretted it very deeply. Couldn’t return it because of Apple policy because I opened it. 


Buy the Pro 4."
2024-12-14,Pro2
2024-12-14,Wait 4 months and get AirPods Pro 3?
2024-12-14,Why don’t they just make one model with the silicone tips? The regular ones without the tips are useless.
2024-12-14,I have AP3 and went APP2 over the AP4 with NC when the Pro were £179 on sale.
2024-12-14,"Pro 2, definitely. Or wait a year for the pro 3"
2024-12-14,"I think the most important distinction for this choice is how they fit. I would say AP4s because in ear headphones are super uncomfortable to me and any long use will make me feel like I need to get my ears clean. Plus I can never get them in any size tip to fit snugly in my ear without a hook. 

The regular AirPods have never had an issue with fit or staying in for me. The thing is that everyone’s ears are different, and the fit of your headphones will actually even have a big effect on the way they sound. 

If you have an Apple Store anywhere that you can get to, I would highly recommend you go and try them out in store before buying either pair. Yes they have a bunch of pairs of all three models that are for trying out, and yes they are very well and thoroughly cleaned."
2024-12-14,You can get 3rd party tips for the AirPod 4s.  I’m thinking of trying some…
2024-12-14,"Get the pros, but also buy a warranty and exchange them for a gift card right before it expires. Tell them the battery is degraded. Which it will be. Works every time. New pair every 2 years. Idk why more people dont do this. Warranties make money off people forgetting about them."
2024-12-14,"I find the not-Pros fall out of my ears all the time, and I can never get a good seal.

IMO, if you are fine with the silicone tips, that's your answer; pro by default, unless you don't like silicone."
2024-12-14,I have the pros 2 they are the best decision I’ve ever made the noise cancellation and sound quality are just one of the many great things they come with they also charge fast have more battery life and better ways to track them when you lose them.
2024-12-14,4th Gen ANC
2024-12-14,"Just wait for the pros 3, they coming out soon"
2024-12-14,"I would say wait till the next AirPods Pro, which are AirPods Pro three or even bypassed them altogether and get its phones and devices that are using nearer Link, which is way way better than any Bluetooth device"
2024-12-14,Pro 2 still more advanced
2024-12-14,"Pro 2

Much much better in every way and it’s been on a great sale!"
2024-12-14,Pro2 - great sound and they don’t fall out of your ears like the AirPod 4’s did for me. You won’t be disappointed.
2024-12-14,Pro 2 trust me bro
2024-12-14,Pro 2 for SUUUURE. No other AirPods can compare.
2024-12-14,"If you like silicone tips, there’s no reason to consider the 4. If you dislike themd, the 4 are comfortable, has good ANC and great sound."
2024-12-14,Neither Get the Beats Fit Pros.
2024-12-14,"Just to share my experience, I have both because the AP4 are much more comfortable to me while sounding great and have good ANC.

When I go out I take the APP2 because the ANC is superior and for the loud noise reduction feature.

If I could only have one I would choose APP2 because when I need those features I really need them, but it’s very nice to have the AP4 for around the house and in the home office. I use them both enough to justify it but others may not."
2024-12-14,"I'd recommend just getting the AirPods Pro 2 for various reasons. I've never really liked the larger charging case of the Pros and usually preferred the simpler look of regular AirPods but recently have found the ANC (mainly for work and commute) to be pretty effective. I also find that the tips with the Pros make it so that they don't fall out of the ear as easily and actually make it easier to simply clean with a Q-tip as the Airpods themselves aren't making direct contact with your ears.

I also have been using a pair of fully functional Airpods 2nd Gen that I purchased years ago for $89.99 which have served me well through undergrad and beyond. I find regular AirPods in general to be slightly more comfortable, not by a significant margin, at the cost of slightly more difficult cleaning and falling out more often.

For a slightly higher price, I think that they're worth the investment in the long run. I got my Pro 2s from Costco on sale for $179.99 a few weeks ago with about 51 months of AppleCare included."
2024-12-14,short answer: definitely pro 2
2024-12-14,"Personally, I like the AirPods Pro 2. The AirPods 4 were designed for people who didn’t like the pro two because of the silicone. I absolutely think the silicone makes them fit much better and I would not buy the AirPods 4 specifically for that reason for me. The good thing about the AP4 is that it has the same exact chipset as the APP2 and same features so you’re not giving up anything in that respect."
2024-12-14,Pro 2. I just returned my AirPods 4
2024-12-14,"Just got the APP2 today since my older pro ones were dying, absolute blast experiencing good ANC again and the icing on the cake for me was the conversational awareness feature, literally so intuitive. Go for the Pro2, you’ll love the volume controls, too!"
2024-12-14,I have heard the Pro 2’a are AMAZING
2024-12-14,Whichever is more comfortable for you. I like the open ear design for comfort but silicone (comply foam) for better sound and noise protection on my jobsite
2024-12-14,"I loved the originals but those were discontinued with the releases of the 4’s & were the only ones from Apple that felt good in my ears.  

I feel like they were the most popular - I wonder why Apple killed them off?"
2024-12-14,Pro 2 are so godly
2024-12-14,I have the standard earbuds that come with the iPhone and they suck. They hurt my ears a lot. Planning on going for the 2s simply for the silicone tip and ANC.
2024-12-14,"Pros 2, I've had a pair since 2022, they've been through war, and they still work marvelously. Battery ain't the same of course, but still last a good almost full 3 hours with ANC on. And still charges very fast in the case. And once they die I'll just buy a new pair, or maybe wait for air pods pro 3."
2024-12-14,I got the 4’s because I absolutely hate the way those little rubber things feel on the pro 2’s
2024-12-14,Neither
2024-12-14,My Pro 2s started squeeking after I slept on it. They also now squeek when i turn noise cancellation on
2024-12-15,Both are amazing
2024-12-15,Basically the same just without the silicone tips lol
2024-12-15,Max 😃
2024-12-15,"I prefer the Pro 2s, but I can never get the regular airpods to rest in my ears well..."
2024-12-15,"I recently got the AirPods Pro 2. I believe they are more expensive, but they are really very good. Just be aware that you need iOS 17 or later to support their full functionality. I found out the hard way that my iPhone8 was too old to be properly compatible with my new AirPods, because the older phone doesn’t support iOS 17 or later, apparently. I’m sure the vast majority of people who decide to get the super cool and expensive AirPods Pro 2 will have fairly new iPhone models, so won’t have this problem that I’ve had. I’ve had to get a new iPhone just so I can enjoy the full range of groovy features on my new headphones."
2024-12-15,"I love my airpods pro 2 tbh it’s not that different from the og ones but noise cancelling is soo good on them by a landslide.. 

if you’re sensitive/don’t like the feeling/ or are allergic to the silicone tips maybe get the airpods4
but otherwise, airpods pro 2 are the way to go"
2024-12-15,"definitely airpods 4, pro 2 falls out way too easy due to silicone tips"
2024-12-15,"Pro 2. It may be the best purchase I’ve ever made. The quality is incredible. The build quality is incredible too: I literally had my AirPods Pro 2s in my pants pockets in the wash AND dryer, and they worked fine when I got them out. Unreal."
2024-12-15,P2 if they fit your ears and if not stick to the 4s
2024-12-15,Pro 2's by far.
2024-12-15,"Just get pro 2 dude, the sound quality and ANC with the eartips can’t be beaten by airpods 4"
2024-12-15,"If you still have the charging case and one of your airpods, you can go to the Apple store and get a replacement for the missing earpod cheaper than either of these options."
2024-12-15,Pro 2 is immediately better
2024-12-15,AirPods Pro 2
2024-12-15,Take the pro 2 it has better sound quality and comes with better noise control
2024-12-15,Honestly ever since I’ve gotten the AP2 my ears have been so waxy but like a watery waxy feeling. I never had this problem with any other headphones even the OG AP
2024-12-15,"Everyone says Pro 2 is bang for buck
4 has less features even though they are newer and hence less price tag.

Pro 2 is a successful model, so Apple did not make any SKU that outperforms it.

I was an avid user of Gen2 Airpods, just 2 days ago bought the Pro 2 myself.

Worth it."
2024-12-15,4 cuz theyre 2x better than the 2s /s
2024-12-15,"Take 4s only if you have problems with silicone tips, I hate those, and I am pretty satisfied with 4s, but 4s are inferior in many ways, including sound quality."
2024-12-15,"Pro 2 Are better than 4, if you are already used to it better stay with it 👍"
2024-12-15,Pro 2 the 4s are budget while the pro 2 are more studio quality. I have had every AirPods besides the 4s and have definitely preferred the pro 2s
2024-12-15,"Pro2 will fuck your audition, ear canals need to breath so 4s are a better choice."
2024-12-15,"I have the pro 2s and oh my god I don’t think the AirPod 4s can come even close to the quality of sound, the features and the silicone tip comfort that the pro 2s have, I’d say go for the pro 2s"
2024-12-15,Personally I hate the clogged feeling of silicone tip earbuds. I'll take the non silicone ones all day.
2024-12-15,"Tips or no tips, that answers your question."
2024-12-15,Pros all the way
2024-12-15,AirPod 4 with ANC are really great. I was skeptical at first but like them a lot.
2024-12-15,"im a big fan of my airpods pro 2, silicone tips never fit my ears right so i opted for memory foam tips from amazon! way better fitted"
2024-12-15,Always pro
2024-12-15,"Once you use pro, I don’t think you can go back. I started with AirPods Gen 2 and shifted to pro 1 and now pro 2"
2024-12-15,"I know you’re asking about AirPod 4 vs pro2
But it reads like you lost one AirPod pro 2 bud and are now considering buying a whole new set. 
You can (or used to be able) to get a replacement for a single bud.  So just go get that replaced."
2024-12-15,"Pro 2. Although I don’t like how when you use only one of them, the noise control is always set to transparency. The pro 1 you could use only one and set noise control to off. You can’t do that with pro 2s"
2024-12-15,"It all depends if you like the tips or not, you won't be able to tell the difference in sound while wearing them regularly."
2024-12-15,Pro 2 is the best👌🏻👴🏼
2024-12-15,No
2024-12-15,"I have both, the 4's ANC is decent - surprising given the lack of silicone tips, but the Pro 2's ANC is miles ahead, with better sound quality as well (possibly due to the seal it creates.)"
2024-12-15,PRO 2
2024-12-15,"I personally HATE AirPods Pro’s.  They have great sound but they refuse to stay in my ears.  I’ve tried all the tips that come with them and even bought several different 3rd party tips, and never with any luck. 

My AirPod Pros are essentially backup AirPods should my AirPod 3 or AirPod 4’s run out of battery."
2024-12-15,Pro is better sound quality but they always hurt my ears so I stopped using them. In hindsight I’d get the 4’s.
2024-12-15,"I got the AP4 because the silicone tips fall out of my ears almost immediately. The seal on the AP4 isn’t great, but it was a great upgrade from my first gen ones. If you know silicone tips work with your ears, just go for those"
2024-12-15,"Not sure if anyone else commented about this but if you lost one of your airpods pro 2, cant you just get a replacement?"
2024-12-16,"Just got mine from Walmart because Amazon was sold out, temporarily. $154 plus tax.  Amazon currently has them for 179, which is still fair.  I deliberated between the pro 2 and the 4 since I e always liked the fit of AirPods 2 …was concerned about in-ear comfort, but they’re great. Better noise cancelling, I can use wireless charging ( currently using my watch charger), and it has that neat hearing test — my hearing is pretty good so there were only minimal adjustments, but I thought it was interesting. Only think I had to get used to was to turn off noise cancelling if on the phone — it sounds weird when I’m speaking if I don’t.  I’m quite pleased with the sound quality, fit, and noise suppression. I’m wearing them near but not into the ear canal and they haven’t fallen out. If you font need them right away you might want to wait until after Christmas when prices may blip back down."
2024-12-16,"The AirPods 4 with anc are almost as expensive as the pro 2 on sale, so I’d say just go with the pro 2 when you find a good price."
2024-12-16,I have both the noise canceling is better on the pros but the fit is better of the 4s.
2024-12-16,"The AirPods Pro because they’ll stay in your ear better and more securely. 
Regular AirPods and the wired ones slide out so easily."
2024-12-16,Which is cheaper?
2024-12-16,"Neither, buy OnePlus buds 3 (or 3 pro if you wanna splurge) and be happier. (Semi) Kidding aside, except fir the rare cases if not tolerating the silicone tips, pro are muchly better than regular"
2024-12-16,AirPods Pro 2 I have had all 3 versions original AirPods Pro AirPods Pro 2 lighting now AirPods Pro 2 usb-c
2024-12-16,Sony and airpods ste the best for me. Linkbuds are my fav
2024-12-16,"Pro 2, it’s night and day."
2024-12-16,Airpods pro 2. Get them at costco if possible. It’s like $200
2024-12-16,if you bring your original Pro 2’s case and remaining pod you can buy the missing pod instead of a whole new set.
2024-12-16,airpods 4 without noise cancellation $129 with noise cancellation it’s $179 then airpods 2 has the noise cancellation n ear tips but can also track them idk ab that airpod 4s
2024-12-16,"I see people suggesting Pro. I have both and use them for different cases. 
AirPods pro2: commuting, listening music as it’s the best in ANC and sound quality. 
AirPods 4: watching movies and taking calls as the mic is upgraded as wearing buds for longer time cause ear pain and creates room for bacterial growth. AirPods 4 without buds just sits nicely in your ear and you can wear it for longer duration."
