date,text
2024-05-09,"If it’s only gonna be used on an Apple device, then yes, absolutely. My AirPods are without a doubt my favorite device. They are complete dog shit though when it comes to pairing it with anything else. I can never get a stable connection."
2024-05-09,"Yes!

I ended up buying mine randomly off some dude in Oakland who was selling a bunch of Apple Watches and AirPods out of his van… You can’t beat $50 for brand new AirPod Pro 2 still in the plastic wrap! It made me wish I bought them legitimately SOONER!!! If I would have known how great they are I would have bought them for full price right when they came out."
2024-05-18,Every penny
2024-08-23,Air pods 2nd gen got good base ?
2024-10-13,Don’t pay 250 for them. You can get used or refurbished for half the price
2024-10-21,A definitive YES.  The Air Pod Pro 2's are incredible with the clarity of the no background noise when Noise Cancellation is enabled and the full range that they can produce. Absolutely a significant upgrade from the Air Pod Pro's. Better fit than the Air Pod Pro's. No distortion when the BASS is se to the max.  Overall are fantastic.
2025-03-22,I just want to see the feedback but idk how
2025-03-22,So new to this
2024-05-05,you might as well get a pair of Bose Quiet comfort buds for the noise cancellation and audio quality is about the same in my opinion
2024-05-05,"The tips are made from the same material. The only difference is that they now also include an xs size. You can purchase after market/third party ear tips made from different materials and are offered in even more sizes HOWEVER I doubt they would change your experience with them positively since what causes your problem (sweat and wax buildup) are from having ear tips in the first place.

I have recently ordered a few tips from Comply that are made of foam that apparently offer a better seal which improve sound quality and potentially comfort as they mould to your ear and a few more tips from a brand I can’t remember that are a combination of foam and silicone like the apple ones that would offer better longevity than the foam tips mentioned above. They can be a little pricey for what they are but I’m hoping they bring a lot of value as I use my airpods a lot. I’ve got the 2nd gen non type C and honestly sq may be a little better than the og’s but when you’re out and about and being active I can’t really tell. I haven’t gotten to try any of the tips yet if you’re interested in what I think send me a message in about 4 weeks cause I’m overseas and haven’t tried them yet."
2024-05-05,"Nah.  Not loud enough , the mic is trash ."
2024-05-05,Search this sub for “worth it” and you’ll get literally dozens of posts answering this exact question
2024-05-06,Airpods are never worth it..  theres so much better stuff out there
2024-05-05,"No.
Overpriced battery powered nonsense with a half eaten apple printed on it is not worth it.

A pair of 30 euro Chifis sounds better that apples mess they call headphones."
2024-05-05,Naa
2024-05-05,"If you pay full price, then no. I bought them on eBay for $100. Pay more than that and you’ll feel scammed."
2024-05-05,Nope.
2024-05-06,Are the Pro Gen 2 worth picking up with the Gen 3 coming out in a few months?
2024-05-05,Is it enough for airplanes?
2024-06-29,"Am I losing my mind? I just got these exclusively for the ANC that everyone is talking about and they cancel out about as much noise, with ANC on, as my 1s do without it on. Very disappointed and returning them."
2024-05-05,I did not like one but love 2
2024-05-06,Yes!! The tracking is quite a bit better!
2024-05-05,Suggest to your partner to look into getting tested for Sleep apnea.
2024-05-05,Isn’t a simple ear plug cheaper?
2024-05-05,You used them during the concert?
2024-08-26,"Thank you so much for saying this: I have been using earplugs and I don’t get any help from it, so this is a phenomenal tip!!!!!"
2024-05-06,The Pro 3s arnt due until 2025 I believe
2024-05-05,Just go to the Apple Store and they’ll test and replace them. Apple’s very good like that.
2024-05-05,Mine have crackled since day 1!  Apple support not helpful yet.
2024-05-05,Deff don’t break easy
2024-05-06,"Are you sure yours are original? My pro 2 are excellent at sound quality, noise cancelling and also microphone is clear and crisp.
Note that fakes also have these features"
2024-05-05,The airpods sound better if you check online for the frequency response graph. If u can't tell the difference means there's smth wrong
2024-05-07,"Lol Pro Gen 3 isn't even coming out this year, let alone few months"
2024-05-05,"Did a fair bit of plane travelling in the month of March, flew 4 different times, two connecting flights and honestly the AirPods Pro 2 were a god send. Came off the plane not feeling as fatigued as normal, whether that was simply down to less noise, more peace and quiet, I’ll let anyone else be the judge but personally it felt that way to me."
2024-05-06,"Yes, for short flights. Not really for long flights.

NYC <-> LA is absolutely perfect but anything longer you're gonna have to sit and wait until the APP2 are charged. You'll find the noise cancellation equal to the Sony XM4's (my only point of reference)."
2024-05-06,"There pretty good if your also playing music i personally use airpods max which are literally insanely good for plane travels.

If you travel alot id probably recommend that investment"
2024-05-06,I work in a fairly loud factory and I have had people screaming at me and couldn’t hear them (please don’t use around dangerous machines).
2024-05-05,Mine ran out of battery 3/4 way through the 3.5 hour flight
2024-05-06,Very much yes
2024-05-06,"The NC yes, but if you are prone to ear suck, the pressure feeling after long periods of use, airpods have been pretty bad for that in my experience, especially on planes."
2024-05-06,"I have both APP2 and Sony XM3, and tbh, you’re better off, like WAY better off with headphones"
2024-05-06,Most definitely yes sir very much so
2024-05-07,"My noise cancelling cancelled out the fire alarm in my school, which is criminally loud, so noise cancelling is great 👍"
2024-05-09,"Tbh, I can’t hear a damn thang with no sound playing and just the earbuds in! 

My girlfriend tries talking to me when I’m doing chores and pausing my music usually doesn’t work, I have to pull them out my ears to hear what she’s saying"
2024-07-04,"the 2's are waaay better than the 1's, at least that was my xp"
2024-05-05,How?
2024-05-06,idkw but i giggled at this
2024-05-05,"He definitely has it. He is a US Vet that acquired it while on active duty. He should have a CPAP machine but refuses to have one stating, “ I will not feel suffocated with something on my face while I sleep”. I totally get it! I guess that means I suffer…oh well! 🤷🏻‍♀️"
2024-05-06,"I’m a fan of white/brown noise. So although cheaper, I need to hear something- just don’t the snoring 😆"
2024-05-05,Saved some possible ear damage I guess
2024-05-05,"they’re better than most concert earplugs, you can still hear everything with a really good sound dynamic, just without destryoing-your-hearing levels of noise"
2024-11-07,Já estamos em Novembro! vc mentiu pra nós! O purgatório te espera!
2024-05-05,"I have mine since december 2022 i bought a plastic protection case for ~10 dollars , they fell once in it and the case cracked inside.The battery life is trash after 1,5 years   and they sound  quieter.
Some how even xiaomi earbuds that I got in 2017 that even fell in water are louder and better battery life."
2024-05-09,Good to know! I’ll pick some up then soon.
2024-05-06,Love the noise cancellation on my XM4s. My go to pair for air travel.
2024-05-06,charging is pretty quick though - using them always on flights up to 13h - they only need to go in the box for charging once i think
2024-05-06,"Is there some trick to the noise cancelling? I have xm4’s and the APP2 are not comparable in noise cancelling. I can still hear different noises, simple things like moving my have along a desk it sounds like the noise cancel is “letting” that noise through electronically. And yes I have noise cancelling fully turned on but it still happens. When I put the xm4’s on I’m completely isolated."
2024-05-06,did you have them charged previously? mine last atleast 5 hours
2024-05-06,I had REALLY bad thumping with the 1s and I don’t think the audio quality was as good. The thumping while walking was the dealbreaker tho. It was overbearing.
2024-05-05,"Dang, well I can understand that. 

I use nasal cpap mask that cover my nose and doesn’t fee suffacoted but my friend and dad said that they don’t want to use it for the same reason 😂"
2024-05-05,"Tell him sleep apnea causes dementia. And the quality of sleep with a machine is sooo much better. You can get masks that only cover the nose, which helps mitigate the clunkiness."
2024-05-05,"The nasal pillows don’t suffocate at all, it’s pretty comfortable tbh… just get him to get a proper cpap trial, it’ll be worth it"
2024-05-06,"Lol this is exactly the opposite of what the CPAP machine does 😂 without it = person doesn’t breathe, with it = person can breathe. 

Well, if it helps anyhow: my wife uses a CPAP mask that is very small, only covers her nose. Maybe showing this helps convincing him to try. 

Also, her sleep improved 1000% after starting using it. Before the CPAP she had constant headaches and always felt tired because she was barely sleeping since the apnea woke her up during the night multiple times (without her noticing)."
2024-05-05,Divorce?
2024-05-06,"Was he diagnosed with minor, moderate, or severe sleep apnea? If it’s minor, he could use a prescribed sleep apnea mouth guard."
2024-09-12,Sleeep apena is real bad i thought the same until i woke up feeling super refreshed.
2024-05-06,"This is 1000% a good use of their ANC!

I was a huge advocate for standard noise filtering earplugs but with the APP2’s, it’s a no brainer"
2024-05-05,I dropped mine without a case about a hundred times and they work perfectly fine.
2024-05-06,Nah
2024-05-06,If the microphone and transparency mode was just as good as APP2 it would be my choice for travel!
2024-05-06,"I’m not sure, have you accidentally turned on Adaptive instead of Noise Cancellation. 

Have you done the ear tip fit test?

I also use my APP2 in the office when taking meetings when it’s too loud and cancels everyone around me talking."
2024-05-06,It's probably just me using it before flight
2024-05-06,"Mine which are only 1 day old only lasts 100% to 20% in 2 hours. Mixed use but mostly just ANC on and nothing playing.
Other than all that crazy amount of white noise in the background"
2024-05-06,"I also have this and somehow nobody else does. I've owned the sony WF 1000XM3s and could only use them while sitting still, anything else would overpower what I'm listening to and be extremely uncomfortable while reviews always talk about running with earpods. The app2 are significantly better but I still can't run with them."
2024-11-07,eles preferem ter infarto. não se sentir decansados... faz parte.
2024-05-06,AirPods are cheaper🤣
2024-05-06,"I would be scared to lose them, somehow none of the tips fit perfectly for me and I have to adjust every few minutes to make sure they still sit stable in the ear"
2024-05-06,Yea dude must be smashing his lmfao
2024-05-06,They are?
2024-05-07,They make sports clips for them that loop around your ear so they don’t pop out as well as they also have neckbands that prevent them from getting lost easily. Definitely worth it for special occasions or if you’re working in risky areas where you could drop and lose them!
2024-12-13,"Pro 2, better sound quality and anc and the silicone tips with various sizes help to better fit in your ear"
2024-12-13,"Pro 2, trust me it’s worth the money"
2024-12-13,I hated the way the Pro 2s felt in my ear.  I rarely ever used them.  Recently purchased AirPod 4s with ANC and I am in love with them. Granted the noise cancelling is not as good as the 2s however my ears certainly appreciate the comfort of these over the 2s
2024-12-13,"Pro 2, bought the 4 and returned them."
2024-12-13,"You either like silicone ear tips or you don’t! 
Me personally I have AirPod three and if I were to buy new ones, I would buy AirPod four with ANC. I can wear them longer and I don’t feel them in my ears. Wear silicone tips almost feel like over ear headphones and you will get more moisture or discomfort, wearing them long-term"
2024-12-13,"Get the 4. I have both and in my opinion, the 4 is just as good. Plus i find it so much more comfortable than the pro 2. The noise cancelling really surprised me too. I’d say it’s as good as the pro 2 also."
2024-12-13,I'll give the same answer I always give when someone asks this question. Buy both try them out and return the ones you like less.
2024-12-13,"To me, it 100% came down to how they feel in my ears. I personally do not like the feeling of silicone tips fully in my ear. I feel stuffed and don’t find it comfortable.

So I upgraded from the AirPods Gen 3 to the Gen 4 with ANC about a month ago. The fit is generally the same, although I sometimes feel the right one is jiggling loose (although neither have ever fallen out). 

I’m very happy with the ANC. With the previous generations, listening on an airplane was nearly impossible. I didn’t like it. So I used Sony 1000XM4’s on flights. But with these, I can comfortably listen to a movie, podcast, or music on a plane. It does great to drown out the loud “hum”. As others have said I’d say it has 70-80% of the noise canceling you’d expect from the pro’s which for me is definitely good enough."
2024-12-13,"AP4 ANC sound quality blew me away, coming from AP2. They fit perfect for me, and ANC is pretty good in a office setting."
2024-12-14,"I have Pro 2, my gf AirPods 4.

The sound is the same, AirPods 4 are big and fall from my ear if do much movement 

Pro 2 noise cancellation is MAGIC, and the volume command is something I love"
2024-12-13,"For me I have the ANC 4 and I love them, the noise canceling isn't overkill but it def enough for school and city use. They have great bass and sound quality. However Silicone tips don't work in my ears so it's a no-brainer for me personally!"
2024-12-13,"4 with anc, if you would rather have no silicone tips"
2024-12-13,I just got the 4 anc and it’s great. I don’t know that I would enjoy the way pro 2 would fit in my ear. Kind of sensitive to that thing. Just my two cents.
2024-12-13,"I didn’t like the silicone tips and it would always fall off my ear when I ran so I went with the 4 now and they feel good
On ears"
2024-12-13,"If the pros two are comfortable for you, they are much better value. That being said I have tried both and the pros two are so uncomfortable to me. Specifically, I do like my AirPods 4 with ANC more simply because they are comfortable for me."
2024-12-13,"I love the 2’s, the 4’s don’t stay in my ear. A lot of people have the opposite experience"
2024-12-14,"If you plan on using ANC while sleeping on your side, then AirPods4. If you don’t have this exact reason, then get AirPods Pro 2"
2024-12-14,Pro 2.
2024-12-14,Personally I like both styles but the pro 2 is more for your money and will have more/better working features.. depends on what you want tho.. do you want a silicone ear piece in your ear or do you want to sacrifice sound quality to be rid of that experience?? Do you like noise cancelling and auto detect conversation and such working at its best?? If so pro 2… do you not care about those things and just want something that won’t fall out your ears easy and don’t want to spend pro2 money??? If so the 4s (keep in mind idek the price difference anymore so it’s really just what you personally like and want feature wise.. for a starter I’d go with the pro 2s just to have a better sound quality experience and get the 4s or any other gen of those AirPods later on when you don’t want to deal with the ear piece actually plugging your ear with silicone and then switch between the 2
2024-12-15,"The AirPods Pros 2 are so much better in every way sound quality, Comfort, style, tracking for the case including the AirPods"
2024-12-15,"The Pro 2 might just be the best tech purchase I've ever made, period. Worth every penny."
2024-12-15,"i don’t understand why everyone is just saying pros 2, it completely depends on if you like hard tip earbuds or soft tip. the airpods 4 are great for me because i’ve never liked the way the pros fit in my ears with the silicone"
2024-12-15,4 is trash. Go for the 2.
2024-12-15,"i can’t do the silicone ear buds. they always pop out. my 2’s have stayed in my ear through some fuckin wild shit, including tumbling down a mountain on skis at 35mph while tearing my ACL."
2024-12-13,APP2!
2024-12-13,Pro 2. Watched a movie on a flight. I legit thought I had surround sound
2024-12-13,"I’ve been stuck debating this exact thing for at least the last 2/3 weeks…

Yesterday I came home with Pro 2’s, I can’t say which is better as I’ve never experienced 4’s but I have zero regrets for these pro’s. 

Same price as the 4’s/ANC but with more features, it’s a no brainer really."
2024-12-13,Pro 2 for sure
2024-12-14,I have pro 2 and it’s the best tech I own
2024-12-14,Pro 2’s. The only reason I’d ever recommend regular AirPods over the Pro’s is if you just can’t stand your ears sealed with the silicone tips. It bothers some people. I think the silicone is way more comfortable than just plastic in my ear like the regular ones but to each their own. If you don’t like the tips on the Pros there are tons of aftermarket options that are made from different materials. The ANC on the Pro’s is amazing.
2024-12-14,Buy the pro 2
2024-12-14,AirPod pros 2 ofcourse there amazing!! The surround sound and noise cancellation work really good
2024-12-13,Airpods 4 with Anc is awesome. I tried pro 2 but the bass and woofers hits different on 4 with Anc
2024-12-13,Yes.
2024-12-13,"The ANC on the 4s is not that strong, when I am on the bus I can still understand half of the stuff the annoying kids are screaming about"
2024-12-13,"You’re comparing AirPods Gen4 with AirPods PRO Gen2.

The initial all plastic AirPods are on their 4th gen just released, the AirPods Pro are the silicon tips and had a first gen and are still on their 2nd gen since September 2022.

The Pro’s with the silicon tips have the haptic stem. The Pro 2s you can raise/lower volume with the haptic stem. The regular 4s I think still use tapping the side which would kind of irritate my ears before I had the Pros. 

The Pros are the higher end line and the Pro 2s are nice headphones. I just upgraded from Pro’s to Pro 2s and I’m happy. I prefer the silicon over the hard pod."
2024-12-13,Doesn't apple still sell single replacements for pro 2s?
2024-12-13,I just upgraded from gen 3 to Pro 2 Thanksgiving week. I was skeptical before I made the purchase because I don't really like snug fit in ear headphones w/ silicone tips. After I get used to the feeling of having them in I cant tell I even have them in. All the features work great for how I use them too so I'd highly recommend giving the Pro 2s a shot.
2024-12-13,Depends really if you will like the ear tips I have the pros but I prefer not using the tips so I still use my AirPods gen2 over the pros just for comfort I might upgrade those to gen4
2024-12-13,"I’ve never tried the pod 4 but it’s been roughly 2 years and my pros have almost completely bit the dust. The case holds very little charge, and the pods themselves have lost a lot of their good sound quality (heavy bass? Forget it.) Maybe it’s wrong to be disappointed, I just didn’t expect something so expensive to not last longer when handled with care.


I don’t know if this alters your decision, especially since I don’t know the life expectancy of the 4, but it feels wrong for me to order another pair of Pros knowing that I’m paying the same amount I did years ago."
2024-12-13,"Some ppl have the 4 fit better. For some the Pro 2 fit better. You have to try it for yourself.

Buy the one that fits your ear well, and if both fit equally well, get the Pro 2."
2024-12-13,I have pro 2 and airpods 4 on the way. Got Pro 2 on amazon for 120$ on sale. Well worth the money
2024-12-13,"I’n holding out for the Pro 3rd Gen, hopefully later in 2025. My 1st Gen Pro’s are awful now, bass has blown, any track with a hint of reverb sounds like it’s being played on vinyl down a phone line in the 50s."
2024-12-13,Bought the 4 pro since I didn't want in ear. Returned it and got the pro 2 for the extra hour of battery life and like it more. The tips don't bother me as much as I expected and I can still hear my surroundings.
2024-12-13,Any major difference between gen 1 and gen2 pro 2s?  Is it worth the extra money for the gen 2?
2024-12-13,One of my friends just got the 4 and exchanged their pro 2 and they said that they regretted it. I forgot the reasons but all I know is that they wanted their pro 2 back and wanted to return the 4 😭
2024-12-13,Noise cancellation will mess up eventually
2024-12-13,Wearing headphones with silicon tips makes me my ears hurt because of the air pressure lol. It’s such a weird feeling. So I like the AirPods 4s with ANC.
2024-12-13,"it’s what I’ll get from santa until two more weeks., on christmas night -hannah. with the phone it plugs."
2024-12-13,Completely different fit
2024-12-13,I can’t stand silicone in my ear so I went with the 4 ANC. The noise canceling is extremely impressive and on par with some seal type I have.
2024-12-13,"Two different products for two different uses. 

Do you need full anc and want to be able to block out the world? Then pro

Do you prefer not to have that stuffy feeling of something in your ear and just want to silence light sounds and dim the rest on occasion but still be able to keep them in and talk without turning on pass through mode then pods 4.

I generally prefer the open style for day to day but use pro for flying."
2024-12-13,"I have both and prefer AirPods 4, much more comfortable to my ears, didn’t fall any single time while the pro 2 keeps falling, no matter the size of tips (I tried all the sizes). If you have big ears AirPods 4 will fit better"
2024-12-13,4 is basically the pro 2 but without silicone tips so id say its just up to if you want to save some money
2024-12-13,"I went from Pro1’s to 4 ANC and I found the 4’s more comfortable and better ANC than the Pro1’s I didn’t upgrade to Pro2’s because of uncomfortable silicone tips, but if you don’t care about silicone tips you should be fine"
2024-12-13,"I have both.  I prefer the 4's for comfort.  That said, there is better sound out of the Pro 2's, but after a while, the silicone in the ear annoys me."
2024-12-13,"I took the 4 and totally love them, ANC was crazy when I tried it outside.

I dont know why people here saying they dont stay in ears lol. I already tried and cant stand the feeling of the intra-tips."
2024-12-13,Buy the 4s with ANC and just return them if you don’t like them
2024-12-13,"I got the pros and they kept falling out. Even tried all different sizes. Got to the stage where Apple wouldn’t accept the return because they got damaged as a result. 

I ended up buying Powerbeats Pro (apple product) that clip around the ear."
2024-12-13,"Pro 2’s ANC is so bad you can’t tell it’s even on, you’ll be constantly checking if it’s actually in pass through mode as you can hear everything around you perfectly clearly. 

So I would say do not buy them whatsoever. Any good reviews you see about ANC were before they removed it with an update."
2024-12-13,"I have both.  The 4s fit my ear better, so they are my daily use pair.  The Pro 2s have pretty much been relegated to airplane use, because the noise cancelling is better (though the 4s are better than I thought they'd be there)."
2024-12-14,I swear this question gets asked. Every. Single. Day.
2024-12-14,"I have both. AirPods 4 is small for my ears and honestly noise canceling is non-existent, sometimes I cannot even understand if active or not.

Get the AirPods Pro."
2024-12-14,Just bought the 4s yesterday and I’m returning it cause it keeps slipping out of my ears 😭
2024-12-14,"You know you can get a replacement from Apple, right?

I think theyre like $60"
2024-12-14,"Depends what you want. Do you want the best there is, or do you want a slightly ‘lighter’ experience"
2024-12-14,which pair has the features you want the most? Buy those ones.
2024-12-14,"I have Pro 1st gen and yesterday bought Airpods 4 with ANC. I would return it and get the Pro 2. 

4 is just too light for my liking"
2024-12-14,"I have the 1st gen pros and the 4(ANC). I like the 4s better but the pros never really fit my ears well even with the different size silicone tips. I’ve always liked no tips better anyway. This is personal experience. And don’t be fooled by the 4s not having silicone tips…the anc works extremely well without it. I mow my yard every week with them using a gas mower, and I can still hear the motor, but it drowns it out very well."
2024-12-14,AirPods 4. Silicone tip is just uncomfortable and I’d rather hear my surroundings a bit
2024-12-14,Wait for Pro 3
2024-12-14,"AirPods 4, I don’t like the rubber tips, in particular when I only wear one of two"
2024-12-14,"the airpod knockoffs on amazon for $30. work beautifully, and if you lose one you dont have to go spend $200 again."
