date,text
2024-11-30,Well I‘m convinced they‘re worth the money alone for the ANC already. I consider them crucial for using public transportation and give me the chills even in crowded situations. I just love them because of this.
2024-11-30,It's the best Apple product literally for me
2024-11-30,"I bought mine a couple of weeks ago while it was on sale  (at a local store) and the experience so far has been satisfactory.

PROS: The ANC is decent (although sometimes it’s a hit or miss at certain places) and the audio quality when listening to music is amazing. The main reason I love it is because of its auto device switching feature, it works like a charm when you’re switching between Apple devices at a time. 

CONS: Mic quality is horrendous if you’re not in a silent room. It just got worse in the recent firmware update (btw you don’t have a choice to upgrade or not, they force it on you) 

All and all I’d say purchase it ONLY if it’s on sale. I can’t justify paying full price for it because of some of the cons."
2024-11-30,"Yes !! And Amazon has them on sale for $153 right now this very moment - bought them 2 days ago & there brand new , non refurbished air pod pro 2 h2 chip 

Sold by Amazon 

Deff worth it , and almost $100 off for Black Friday - cop them 

https://a.co/d/b8oSjVX"
2024-11-30,Yup
2024-11-30,"Is there no Black Friday deal now?

I wouldn’t pay 289 but if you can find them around the 200 tag I’d say go for it. Bought them on September two years ago and it’s the product I’ve been happiest with and use every freaking single day"
2024-11-30,They are amazing honestly…joined the club recently and I am a big fan.
2024-11-30,"Definitely worth it. I had the AirPods Pro 1 since 2019 and was happy with them. Honestly, I didn’t think the Pro 2 would be much different. But last week, I bought the Pro 2 because it was on sale, and oh my gosh, the difference is like night and day! 

The sound on the Pro 2 is so much better—it feels like I’m using a completely different pair of headphones!"
2024-11-30,YES
2024-11-30,"I have them but prefer the AirPod 4 with active noise canceling, the noise canceling is better on the pros but the sacrifice in noise canceling is worth it for the improvement in comfort on the 4s for me. I just say this to point out ear shape can be a factor, as the pro  for me don’t fit as well and are less comfortable."
2024-11-30,They’re great but the battery life is pretty poor compared to my Powerbeats Pro
2024-12-01,they’re…something… but nice for commutes. still prefer my over ear headphones but the ap2 are great for noise cancelling etc
2024-12-01,"Yes if you have an iPhone full stop. Everything is straight forward and the anc is really really good. I already saw that some people are bringing up specific headphones that have better anc. Yes it’s not the best but you will feel weird the first time you turn on anc.  No good way to explain but they also sound really good for wireless iems. 

I don’t understand why Reddit is so hateful"
2024-12-01,"If you like the gummies that stick out of the part that sound comes out of, yes. Otherwise go for a different model.

One obnoxious thing is that you have to adjust the volume of notifications every time you want to use them vs not use them. If you always have your phone on vibrate, this isn’t an issue, but for someone who normally has text message notification volume on 100% // or alarm volume on 100%, if you forget to change it when putting your earbuds in, you will definitely get hearing loss problems.

Another issue is that once dust, dirt or earwax gets into the mesh, it is impossible to clean it out. Over time, it will affect the sound and your only choice to have crisp audio again will be to get new ones. 

If your mind is set on getting some, you can get them way cheaper online. 289€ is way too expensive. I got some yesterday for $160. Try shopping Apple’s online store or Best Buy’s store, especially on Cyber Monday. Idk if your country acknowledges Cyber Monday but you can always try getting it shipped from America for cheaper, I can’t imagine overseas charges would add up to more than what you say it costs over there."
2024-12-01,Love them! Having them for I think a year and a half now and work totally fine! 💖✨ get them with the BF sales!
2025-03-25,I bought mine a couple of weeks ago and I just returned them today. There is no difference from the first one to the second one.
2024-11-30,Get airpods 4 the are better and cheaper
2024-11-29,"Nah, honestly if you aren’t in a place to get good sales ( Black Friday in the US) you should go for the AirPod gen 4’s with noise cancellation. Pros are crazy good but I like my Gen 4’s better ( parents have the pro 2’s). Only main difference is the ear tips which seals a lot more sound in and prevents a lot more sound from getting in. I don’t like that feature though, it makes my ears feel a little too plugged, whereas the gen 4 AirPods with noise cancellation have pretty good ANC, but they feel more sleek and better fitting for me."
2024-11-29,"Nope, I'm not happy with the sound quality. The ""gadgets"" in them are nice, but I'm interested in the sound and should be way better for the price tag"
2024-11-30,Dominates them how?
2024-12-05,"dolls correct simplistic divide hospital sand cautious dam instinctive wise

 *This post was mass deleted and anonymized with [Redact](https://redact.dev/home)*"
2024-11-29,Thank you
2024-11-30,"I've went through 4 airpods pros first gen and second gens and they always end up breaking(ANC, transparency making a noise and battery life becomes worthless). For how much they go for, it's safe to say plastic doesn't cost 260 euros and using last gen 5.3 bluetooth, i'd expect them to use 6.0 bluetooth and to top that all of no multipoint and no codecs."
2024-11-29,I dont have any airpods yet
2024-11-30,"I got them at 180 cad so roughly 128 usd brand hew and I would still be quite happy to pay more because of how good the battery life, sound, noise cancellation is compared to the previous gen"
2024-11-30,"Since you use it all the time, how are you not worried about getting ear damage? Do you have some safety measures turned on?"
2024-11-29,I have a watch and iphone but nothing else
2024-11-29,So after 2 years they are still really good?
2024-12-01,"I had some sort of static noise with mine instantly right out of the package doesnt matter which mode i was on, decided to give them back, i assume thats normal? Even tough ive seen many complaints online"
2024-11-30,How’d you get that price?
2024-11-29,from where?
2024-11-29,I dont have any airpods yet so If im gonna buy any I want the best so I can have them for a long time
2024-11-29,Wow thats all good to know. I cant find airpods 1 anywhere are they not selling them anymore? I also never had noise cancelation so I wont really see how better the first ones were. I am worried about my ears hurting but the basic ones I have tried from friends and they dont stay in my ears so I think this would be a better option. I dont know what I will do I have never had any airpods so Im still thinking about it. Thank you for all of this info
2025-02-23,Airpods pro 2 are literally the same outer shell as the airpod pro 1. Did you get some fake 2s?
2024-11-29,I do like the fitted tips the ordinary I have tried from a friend and they just dont stay in my ears
2024-11-29,I do want them mostly for those options I have never had any good ones with any type of noise canceling and I would really like that
2024-11-29,Who sells them for £140?
2024-11-29,Im not from US or UK😔
2024-11-29,"Im from croatia 
Non of those are really a thing here as they are in US or UK or some other bigger countries😕 the blackfriday sale is 15€ off😑 so from 304€ to 289€😂"
2024-11-29,Well my black friday is 15€ off😂 from 304€ to 289😂
2024-11-29,Thats the best price here in croatia and thats is 15€ off for blackfriday😂 everywhere here they are 300-350€
2024-11-29,Wow thats amazing thank you
2024-11-29,I dont have any airpods version at all yet😂
2024-11-30,Dont have walmart whete Im from hahah
2024-11-30,"No hahah from croatia 
And thats for blackfriday they gave 15€ off😂😂"
2024-11-30,I would If they didnt fall out of my ear😞
2024-11-29,I would get 4’s without thinking if all of those originals didnt fall out of my ear 😞
2024-11-30,"Better sound, ANC, spacial"
2024-12-05,Yeah
2024-11-30,"The AirPods Pro (2nd generation) were released on September 23, 2022."
2024-11-30,You're talking about the re-release with usb C port
2024-11-30,"Valid point! No, when I say I use them all the time it’s more that I use them daily during commutes and such - not literally all the time!  
I also use the noice threshold to avoid blasting my ears at full volume - and so far I am doing excellent on my yearly health checks, which also include hearing health. I’m glad you brought this up, though, more people should be aware of how using headphones regularly without afterthought could impact their hearing!"
2024-11-30,"Then there might be cheaper alternatives if you’re on a budget. They are still great, and as far as I’m aware you could use only pre-downloaded stuff on the watch (or streamed if you have the eSIM-edition)."
2024-11-29,"Yeah, sound is still perfect. There is some battery loss on the pods themselves, haven’t noticed on the case but it’s not bad. They charge so fast though, it’s really not an issue. I haven’t compared side by side either though. All in all, they’re still great"
2024-11-30,"I only just bought some on sale for about €180 as my AirPods Pro died after about a year, and Apple hasn’t accepted responsibility to replace them despite the other recall they’ve done of AirPods Pro. I had gone back to my old AirPods and unless you really need noise cancelling or other special ‘pro’ features, I’m not convinced that an amount over €250 is worth it compared with the Beats that I love!"
2024-11-30,If you have target account or credit card with them you’ll get even cheaper. They currently have coupons if you spend $150 you’ll get $25 off.
2024-11-29,It was a short lived Black Friday deal from one of the main mobile network operators in my country
2024-11-29,Then get the pro 2s fs
2024-11-29,Costco have a Black Friday deal on for £159. Haven't seen them cheaper
2024-11-30,it was on sale from amazon until two weeks ago for $180 (\~£140)
2024-11-30,Whaat?! Wow. £50 for me. £229 to £179
2024-11-29,"Wow okay fair enough, I mean they are good but maybe there is some alternative in your country that offers same quality for cheaper price? Sony?

Do you use iPhone as well?"
2024-11-29,"No problem! Make sure to check out the latest deal, unfortunately, I’m in US so I got AirPods Pro with AppleCare+ in just $199. As of now, Black Friday deals made it even crazy, going low as $154 on Amazon and Target, although you’re not from US so that’s a bad luck for you! 😭"
2024-11-30,I’d say get them for sure. I love mine
2024-11-30,That’s way way too much! 🤯
2024-11-30,"Lol no way. 

Sony MX5s have much better ANC, spatial and sound. 

AirPods have better integration with iPhones but that’s about it."
2024-11-30,I’m seeing them for $169.99 right now. Hmmm
2024-11-29,Germany?
2024-11-29,I will look into that thank you
2024-11-29,"Yes I use Iphone
I was looking into some alternatives but idk I will check what else is there for sure before I buy"
2024-11-29,Yess If I had those deals I wouldnt be thinking about it I would just buy them😂
2024-11-30,You’re comparing over the ear headphones with ear buds. It’s not exactly a fair comparison
2024-11-30,"I agree, the Sonys sound 1000 times better!! I have a lot of pairs of tws and frankly my AirPods Pro 2 are just for calls on the go, videos are everything when it comes to music the wf1000xm5 are way ahead for me the best ANC, I use them in anc at the gym, the passive anc is so excellent! The sound is Sony, very well managed no matter the style chosen and very open! 

Everyone knows that the AirPods Pro 2 sound much better without anc without spatial audio (more natural) but it remains generic, very well integrated into the Apple ecosystem"
2024-11-30,"I also have Bose QCU’s an Sennheiser true sport which sound really good, but the Pro 2’s just sound better"
2024-11-29,You’re welcome
2024-11-30,It’s changed few hours ago.
2024-11-30,Walmart has them for $154
2024-11-29,cheers mate
2024-11-29,"Yeah come up with a shortlist of options, maybe if there is something much cheaper.

Otherwise if there isn't then yeah these earphones are very good choice for iPhone users"
2024-11-29,Gotcha! 🤓
2024-11-30,"No, I’m comparing Sony earbuds with Apple earbuds. 

Bose earbuds also have better ANC and arguably better sound. 

Here’s some proof 

https://www.cnet.com/tech/mobile/best-noise-canceling-wireless-earbuds/

Here’s some more 

https://www.soundguys.com/best-noise-cancelling-wireless-earbuds-27207/"
2024-11-30,"Bah, that was my fear! I’ll keep watching it in case it drops again. Enjoy your new pair!"
2024-11-30,You can price match and use $25 off for $150. If you register the account from Target.
2024-11-30,When I looked up Sony xm5’s all I found were the over the ear ones. Had to specifically add earbuds to the search for them to pop up. You right
2024-11-30,My airlods have always had better anc at the gym
2025-02-14,https://www.soundguys.com/airpods-pro-3-wait-124219/
2024-11-30,Yup. Check in Amazon its still in same price $154
2024-11-30,You ain’t google hard enough..
2025-02-15,lol ok
2025-02-15,So the guy you mention says they are the best (he owns it)
2025-02-16,He does not. He says they “can keep up”.
2024-05-05,pro gen 2 are worth it for me. sound cancelling is much better
2024-05-05,If you liked gen 1 you’ll love gen 2. If you didn’t like gen 1 gen 2 probably won’t convince you.
2024-05-05,"Yes. I have the original AirPod Pros and there are some significant upgrades. 

Especially the tracking feature"
2024-05-05,YES!!! The noise canceling on these is amazing. My partner snores like a freight train and I can’t hear him at all with these in. WORTH EVERY PENNY!
2024-05-05,There incredible sound so so good
2024-05-05,I just went to a concert and these adaptive audio mode changed my life forever.
2024-05-06,Wait and see what the 2024 ones look like. They are supposed to a be a total overhaul
2024-05-05,"Yes, yes and hell yes. I had the gen 1s and upgraded to the 2s. The noise cancelling was already excellent, and these are even better."
2024-05-05,Tips are basically the same material but they do come in with different sizes to change them . I really like the adaption to sound.
2024-05-05,"Any generation AirPod Pro is 10000% better than any generation AirPod due to the tips. The difference the tips make is unreal. I would take a Gen 1 AirPod Pro over the latest AirPod any day of the week. There’s just no comparison in terms of comfort, fit, how well they stay in your ears (and thus how often you lose them), and sound quality.

On the other hand, AirPod Pro gen 3 is 1% better than AirPod Pro gen 1’s. I’ve never succeeded in getting the side volume slider to work correctly. If you can use an AirPod Pro instead of an Airpod, always choose that option. But which version of the AirPod Pro you use does not matter. The only nice thing about the Gen 3 over Gen 2 is the USB-C connection instead of Lightning, and the only nice thing about the Gen 2 over Gen 1 is that it sticks to magnetic charging stations better (thus making which port it uses to charge irrelevant)

Try different tips. SpinDrift makes tips for AirPod Pros that come in more sizes and are more comfortable."
2024-05-05,Mine have the Problem that about half a year after buying them (directly from apple) the left earbud is significantly more quiet then the right one and I've seen no solution to fix it so far :(
2024-05-06,If the tips don’t work for you you can buy third party tips made of different materials. They’re worth it for sure either way
2024-05-06,If it’s on sale in your country definitely get it! I lost my older pair so I recently got the second gen. There are also additional settings
2024-05-06,"Worth every single penny, even at full price! I don’t know how I can fly without them, the noise cancelling feature is phenomenal 💪"
2024-05-06,"I got a pair recently to replace my original ones, and the ability to adjust the volume and activate the different modes makes them so worth it. My one gripe is that I don't really like the rubber nubs, I prefer the feel of a solid plastic piece. Had I known I would have definitely gotten a pair without the rubber ear nubs."
2024-05-06,"Bro i just got mine today because my left gen 1AirPods Pro started with crackling and white noise so I decided to upgrade to gen 2 and the sound quality is much better, also noise canceling and transparency modes are way better than Gen 1. Totally worth it"
2024-05-06,"Yes, but still a bit overpriced, at least in India it is the case."
2024-05-06,"I bought this 4 months ago and used it when working out , now the charging connectors have rust and even if it’s in warranty they won’t repair or replace the product. When I make calls my I have to adjust it a little bit so the other end can hear my voice. For me it’s a risky product if it works it works great but without good service and warranty this can easily become an expensive mistake like it feels for me."
2024-05-05,"Stick to the 3, my son got the pro 1 and didn’t fit me well and bought the 3 which are perfect. Now the pro 1 are busted and he got the pro 2, tested them last week and are the exact same fit as 1."
2024-05-05,Nope. Had mine for a year before they started doing the loud crackle static sound which physically hurt my ears. Tossing them was the best decision I could have made pertaining to them
2024-05-05,yes
2024-05-05,"Can’t get them to stay in my ears. Try end so many after market plugs. Dunno, my ears don’t like ear buds. I folded and went for the over ear apple headset. I way prefer everything about those ."
2024-05-05,I upgraded from Gen 1 and I’m absolutely blown away.
2024-05-05,Kinda 🤷‍♂️  now your getting them for the apple ecosystem. For about half of the price you can get nothing a2 with the same specs. They also break easily. So I wouldnt buy them in 2024
2024-05-05,"I recently switched and yes, definitely!"
2024-05-05,"Best in ears concerning sound quality, they can even keep up with some better over ears. They are absolutely worth it, especially with the very good noise canceling snd the adaptive transparency they are a dream to use."
2024-05-05,"You can get custom made tips for the Pros that are made based on a scan from a audiometrist (is that the correct word for those people who make hearing aids?)

Quite pricey and I don’t have one of those, but might be worth having a look at it"
2024-05-05,"Yes, especially if you can get them for $179 or $189. I don’t know if I’d pay full price for them seeing gen 3 will be out in the fall but if you can get them on sale (Amazon or Best Buy regularly have them for the prices I mentioned) then absolutely."
2024-05-05,Smokey!
2024-05-06,"Yes the transparency adaptive and the conversation detection makes it similar to the experience of wearing bone conduction headphones while blocking out unwanted noise.
While it’s not the same you can add a silicone cover with eartips to regular AirPods. But you won’t get transparency and anc and you have to take them on and off to charge"
2024-05-06,Loved the noise canceling in gen 2s but what surprised me the most is the adaptive transparency mode. Its so good
2024-05-06,Definitely worth it if you cool enough
2024-05-06,With 126 ms latency? Certainly worth it if you have money.
2024-05-06,Yeah imo. My wife has the Pro Max headphones and these have like 90% the same audio quality and noise cancelling (probably better noise cancelling if I’m being honest) at half the price. And they’re just really convenient to carry around.
2024-05-06,They are worth it. I wouldn’t have bothered to answer this thread if they weren’t.
2024-05-06,Absolutely. I work construction and the noise cancelling is perfect. The noise reduction is also incredible. I run that 80% of the time. It compresses loud sounds but I can still hear my guys.
2024-05-06,"Went from samsung buds 2 to airpods pro 2 gen usb. Sound quality is neck and neck, but noice cancelation is on another level."
2024-05-06,"I bought my 2nd gen pair because I lost my 1st gen pair, then I found my 1st gen pair :/ haven’t noticed too much of a difference"
2024-05-06,I love my gen 2 I’d buy them again if I needed to
2024-05-06,depends on ear
2024-05-06,"Absolutely , I just got some 2 weeks ago and don’t regret it one bit. That noise cancellation is amazing and always comes in clutch. Don’t even get me started on the Spatial Audio, all tho I think the AirPod gen 3 also has it. Transparency is also insanely good if you care about that"
2024-05-06,"I find these so uncomfortable, pros were a good investment"
2024-05-06,"Excellent Pods, I use the noise canceling on Plane flights... They come in Clutch when there is a Crying Brat on board"
2024-05-06,"For general use, they are amazing. But they are not low latency."
2024-05-06,"For me, the biggest difference from the Airpod Pro Gen1 and Gen 2 is transparency mode. Transparency mode in the gen 1's was good compared but the Gen 2's were the closest to normal hearing I've ever heard with any headphones I've owned. Better than the Sennheiser Momentums, Beoplay E2, Sony 1000xm5 and the gen1's. 

I also had problem with them falling out of my ears until I replaced the eartips with the Foam Master Memory Foam v4's.  These were a night and day difference for me and they don't fall out of my ears even after some activity. Kinda pricey though."
2024-05-06,"bought 2 pairs off the street for 50 bucks but

![gif](giphy|w0mylo7p4OXUQ)

and yeah they work great, audiophile here 2 🕺🏻"
2024-05-06,"I'm new to the Apple ecosystem, well not new but haven't owned anything since the first ipod haha I'm a samsung user and have the airpod Pro 2s for my phone and laptop. 

The sound quality is really top notch, they sound great with good clarity. ANC is honestly amazing and the besr ive swen even compared to headphones, transparency is really nice too but i hardly, if ever, use it. 

The only con I've come across is the quality if the mic - its actually terrible, even more so at this price point. Ive been told the mic sounds distant, muted, or muffled and looking online on, on reddit and apple forums, this is a very common and known issue with no fix. 

My dad has an iphone that I used to check for updates and change settings, made a couple calls as well with the same issue, so the mic issue isnt because ""im not using an iphone"", even more so since apple forums are littered with the same issue lol 

I do say however, the pros outweigh the cons and im happy with my purchase. Well worth it."
2024-05-06,It depends with your needs. I think you’d be better off buying the previous gen as the changes are not that significant
2024-05-06,No get pros
2024-05-06,Yes! Adaptive Noise Cancellation is incredible.
2024-05-06,they are incredible! 🤩. the noise cancelling takes me away to my own world!
2024-05-06,"That picture is of regular AirPods, not AirPods Pro, isn't it?

I think the AirPods Pro 2 are quite good, fwiw."
2024-05-06,"Yes, everything that was wrong with the first gen, the second one optimised it and ANC is much better"
2024-05-06,Calling experience is really bad for the person who is trying to listen u. People always tell me I need new pair of headphones. Worst apple product. Noise canceling is really bad. The good: transparent mode and spatial sound mixed togueter bring a nice experience
2024-05-06,"The ANC is one of the best if not the best. I've tested the Sony's xm5s too and they're the only true competitors to the airpods pro gen 2. App2 are better because of the form factor and the seamless apple ecosystem.

PS: If you can, get an applecare plus for airpods. It will save a ton of money if they get damaged."
2024-05-06,I have both gen 1 and gen 2 pros. 2’s are way better in every way. Longer battery kind of similar noise cancelling effect.
2024-05-06,If u have more money left out in your bank account and u don't know how to spend it then airpods are 100% worth to buy
2024-05-06,I enjoyed getting the gen 2 pros. Better than the first gen but I handed those down for an upgrade excuse to get the new ones. I do like the newer features added to the case and the noise canceling is much better
2024-05-06,The ANC were so good as in you felt like drowning in a deep pool
2024-05-06,"I’ve had AirPods1, Pro, and Pro gen 2. Pro gen 2 is superior to gen 1 on sound quality and adaptive audio. Also, and this may be minor to some, the ability to adjust the volume with a swipe on the earbud is a game changer for me."
2024-05-06,Well those are AirPods Gen 3 not AirPods Pro Gen 2
2024-05-06,The sound on these is great.  The problem for me is that they won't stay in my ears even with the largest tips.  I tried some of those foam tips on Amazon but those are no better.
2024-05-06,I feel like it’s the bass isn’t as strong as the first gen.
2024-05-06,I believe the tips are the same.
2024-05-06,"To me they were not, or at least not as much if I had bought them for full retail price. But they may be worth it for you, though. The ANC didn’t work well in my APP2’s."
2024-05-06,I did gen 3 because battery life was better but almost a year into them and the sound SUCKS!!!
2024-05-06,Yes..
2024-05-06,They have XS tips and you can also buy third party tips.
2024-05-08,https://amzn.to/3JRjmUf
