date,text
2023-03-28,I really love watching about stuff I cannot afford.
2023-03-28,"One thing I've noticed is the directionality of the transparency mode seems much improved. I go on a lot of walks with my camera and take pictures of birds, and often have my Airpods in listening to music, but use transparency mode to listen for birds. On the previous generation, it was often difficult to pinpoint exactly where a bird was. It was more a general direction, like to the left or right of me, but pinpointing a specific direction or height was difficult. First walk with the new ones and I was hearing the birds so clearly and coming from such a specific direction that I couldn't initially tell if it was coming from the song I was listening to or not. I heard a bird from directly above me and looked up just in time to see a bird flying directly overhead, exactly where I heard the sound come from. I could easily hear the footsteps of people coming up from behind me on the walking path too. Really excited to go for my first run with them tonight and hopefully get some experience with the adaptive part of the transparency mode."
2023-03-28,Whoever edited the explanation on how adaptive transparency works did a beautiful job!
2024-07-30,Just came here to justify my purchase.
2023-03-28,I'm a fire alarm technician and we usually do alarm verifications and work near really loud equipment on a day to day basis. I tried the adaptive transparency mode today because we were working near a loud water pump and holy that thing really works well! I can see myself using this feature a lot for my work specially as I work around other team mates and want to be able to hear them but still cut out the loud horn or bell noise whenever we have to ring them which are sometimes over 85 decibels and can be painful to hear when its too loud. Killer feature!
2023-03-28,You just explained the adaptive transparency mode 10x better than Apple did on stage! Great video!
2023-03-28,"These AirPods Pro have been a game changer for me, I am on a high school drumline and had the 1st generation Pro's that I used for noise canceling. This caused me to always have to have noise cancelation on and constantly have to take them in and out to hear my instructors comments. With the new AirPods I am able to keep transparency mode on. This means, when we're drumming and the loud noises are happening, the sound is reduced, however, the moment the drumming stops and our instructor starts talking, immediately I can hear him and everyone around me clearly. A game changer for drummers."
2025-02-25,Marques is the best video on the AirPods Pro 2 so far this convinced me to buy them! Anyone know a good quality leather case that will last a long time?
2023-03-28,"0:00 Intro
0:41 Small New Features
1:36 Battery Life
1:53 Ear Tips
 Case Features
 Volume Control
 H2 Chip - The Thing That Convinced Marques 
 Ranking Against Others
 Sound Quality
 Transparency Mode
 Talks To Noise App
 Mismatched AirPods
 Ear Scan For spatial Audio
 Overall Evaluation"
2023-03-28,Modern tech will never fail to amaze me. How they do all that in such a little device blows my little normal mind.
2023-03-28,the technology behind the ability for them to reduce noise is underrated asf. The signal processing there is on point.
2024-03-27,"One thing worth adding is that the AirPods Pro 2 integrate well with Android phones. As a Galaxy S23 user who previously was using Galaxy Buds2, AirPods work the same as in an iPhone for the features I use. Probably the only nice to have feature when connected to Android would be pausing the audio when removing one of the AirPods to speak to people but even that can be obsolete since you can just pause and enable transparency mode (which is out of this world). Would like to see Galaxy Buds improve to get on the AirPods level though."
2023-03-28,"I have to admit, I do dig this guy. Not for the Air Pod thing but the quality of his videos. He is really good at what he does. Nicely done."
2023-03-28,"Oh yes, that Watch the Throne test"
2023-03-28,"Just got mine and wore them at my local gym. at first I was thinking the ANC was about the same as my last pair of pro's, but then I took one out to chat with a friend and noticed how LOUD the gym was that day. Seriously impressed by these and I actually love that they were able to do it without changing the design which would have made them stand out more as a ""status symbol."" Thanks for the great review!"
2024-12-27,"Getting mine in the next 24 hours. Already bought them, your reviews are just that good… I’m still convinced they’re a good investment."
2023-03-28,"I tested the transparency in a loud environment and I was amazed. My girlfriend and friends like to go to loud bars and concerts, but because of my Autism I can’t handle the loud sounds like that but I always want to join. I occasionally went out with them using the last gen AirPods Pro and used noise canceling to help. But using the transparency mode on these second gens I can actually listen to the music and not get overstimulated due to the loud sounds. Worth the purchase"
2023-03-28,"I'm a musician in a rock cover band and wore these things this weekend at our gig and the transparency mode was absolutely amazing.  I'd never even tried using my first gen pro's but these, man the way they compress the loud sounds down to a normal decibel level into your ears is great.  I've resisted using in ear monitors for years because I hate not being able to ""hear the room"" and these new pro's fix that and my ears weren't ringing the next morning.  Bravo."
2023-03-28,"Just wanted to point out that personalized spatial audio is an iOS 16 feature, NOT an H2 exclusive. You can also set it up with gen 1 pros."
2023-03-28,Is it just me or does anyone else think he should be the one on stage for every Apple release? He is so clear and straight to the point hitting all of the key features that are so vaguely described by Apple themselves. Thanks for the time you take to do the research and always doing top notch tech reviews! Apple hire this guy and make him CEO!
2023-03-28,"Having gone to many rock concerts and having been in GA front and center, your description of experiencing a concert and feeling the bass in your chest without having to worry about the hearing damage (or having to use standard earplugs) sounds AMAZING"
2023-03-28,"As someone who uses these for work to cut out noise , the different between gen 1 to gen 2 is 100% noticeable , combined that with battery and better transparency it’s well worth the upgrade to me ."
2023-03-28,I like how Marques always conveys the target audience that a particular product is best suited for.. that’s an awesome detail in his videos!
2023-03-28,"I love these! Idk why I continue to watch reviews on things once I already have them, but if you’re someone with anxiety and it gets to a point where the world just feels like a lot…having everything get quite to almost nothing is so satisfying."
2023-03-28,"Marques is the GOAT of tech youtube, killer frisbee player, incredibly creative, and obviously very intelligent. That said, the way he repeatedly pronounced “ambulance” really threw me for a loop."
2023-03-28,"Just got my pair yesterday and the noise cancellation just blew my brains out. Never thought that noise cancellation was actually a technology thing as i thought that the silicone tips do the job but this proved me wrong. And watching this AGAIN would probably make me appreciate the transparency mode. 
I do love my pair and one of my best purchases so damn far."
2023-03-28,"Just picked up my pair today after considering it for a couple months…Super glad I did! The transparency mode alone is done really, really well. From someone that wears them 5-6 hours a day, 10/10"
2023-03-28,"I have to say, the presentation, the cadence, the clarity is what stood out the most on how to present and talk about a product. He kept you engaged without resorting to clickbait tactics. Well done sir."
2023-03-28,i love how relaxed he is with allthis info. thanks for not being like other youtube channels and shoving weird stuff at us and not explaning
2023-03-28,"This is honestly really cool to see. The gen 1 pros are already pretty good, and to see the 2s be even better is incredible"
2023-03-28,"Just got mine yesterday, and I have to say that there are a lot of improvement form the previous gen. The noise cancelling and transparency is fire. Also, if you love bass, definitely going to love it."
2024-03-27,"Bought these because of this review (I never had any AirPods before) and everything he says is spot-on.  I use them to cut my grass on a really loud riding mower that used to require earplugs, but with these on noise cancellation, the mower sounds like a tiny little electric mower.  It's almost unbelieveable how well they cancel noise, to the point where you feel like the mower couldn't possibly be running.  They also sound amazing with music or podcasts.  Really cool tech and I'm glad I got them."
2023-03-28,"As someone who works outside for 12 hours a day 6 days a week, transparency mode is very important to me and it’s all I use. This is great information!"
2023-03-28,"I took mine on a couple flights to Spain and Germany this week and was absolutely blown away by how good the ANC was! From just small little buds the sound of the plane vanished. Also pretty great for the underground spare a certain section of the jubilee line that hits 110dB normally. 
I bought these as I have big issues losing things (such as the case) but was very pleasantly surprised by just how much better they are than my original pros."
2023-03-28,"As someone who grew up in the 90s with cassette tapes on the radio and CDs, new tech these days never fail to amaze me. We’ve come so far in just such a short time!"
2024-03-27,"The noise cancellation is well worth the price, I’m hearing impaired so it’s more about cutting the noise versus turning up the volume, as a result, I can now hear things more clearly at lower volumes. I’ve heard new parts in songs that I’ve always listened to. I adopted taking these with me EVERYWHERE, at all times, especially movie theaters where they BLAST the sound; and toggle between transparency mode to flat out noise cancellation"
2023-03-28,"I watch this guy on various tech topics I'm not even interested in and find he ALWAYS makes it interesting and useful to the masses and nerds alike. The background research he does and the way he explains things is second to none, and I watch a lot of tech channels. He's the best of them."
2023-03-28,That transparency mode ear protection by lowering high decibels is game changer
2023-03-28,"Just copped my pair recently. When I first put them in , the noise cancellation is pre activated. I instantly felt an amazing feeling of ‘ calm ‘ and definitely loved the transition from noise to super quiet. 

For me , I enjoy quietness . These airpods are like gold heaven to me.

As I walked down the street and kicked the noise canceling in it was amazing. Cars were in motion but you couldn’t hear them."
2024-06-30,I have used Airpods for sound protection around loud engines and metal sawing. Very useful for communication while still protecting your hearing.
2023-03-28,"Thought I lost my first gen so bought the second gen. I noticed significantly better sound quality and anc. But the volume touch control is my favorite, it is really convenient and responsive. If you have the first gen I don't think upgrading is necessary."
2023-03-28,"I completely agree about the best new feature. Something amazing about my new AP2s is the adaptive transparency. To test this, I went into my wood shop with transparency on and used my miter saw. I actually thought it wasn’t working until I removed them and tried again. It was amazing and undetectable. 

I have special ear protection for my shop that has a similar feature, but there is a click when it suppresses the damaging sound. These AP2s are leaps and bounds above. I am VERY impressed."
2023-03-28,"I wore my AirPods Pro Gen 1 for hours on end for editing, music, videos etc and these new AirPods Pro 2 are insane with noise cancellation. Love the extra two hours of NC time as well"
2023-03-28,my friend bought these and let me try them out at work. I work at a movie theater and the concession stand gets extremely loud with the constant crowds of people and machines beeping/running but omg the noise cancellation cut out EVERYTHING i was in awe
2023-03-28,I used mine on a 6 hour (multiple) train journey yesterday. They lasted the whole trip door to door without taking them out of my ears. The transparency mode is seriously impressive it honestly sounds like you're not even wearing them. I replaced my Bose QC35's with these and don't think I'll be going back anytime soon.
2023-03-28,"Had the original airpods, they happened to just die yesterday. Went and picked the new ones up around 1 pm and have used em for about 8 hours since then. Absolutely love them! Can't speak to how much better they are than the pro's, but certainly an insane upgrade to the original airpods."
2023-03-28,Marques is my go to for tech reviews on youtube. Love the quality content and professionalism. Great review!
2024-05-01,"After 1 year of use I can confirm the following:- 
1- it’s getting better and better with the constant updates. 
2- almost flowless when it comes to connection to and b/w Mac & iPhone and Apple ecosystem. 
3- the battery still as good as new. 
4- it sounds pretty good and way better than any other AirPods I’ve tried. 
5- the only issue I had with it:- the in-ear wheezing sound after using it for a while. I don’t know if it’ll affect my ears health but it’s concerning for sure. 

I would give it 8/10 and it’s definitely worth it."
2023-03-28,I just ordered these today due to your review. You are the first channel I search when reviewing electronics and I value your honest opinion. Thank you!
2023-03-28,"I preordered mine and have been using them for a few days now. As someone who had the OG airpods and then the OG AirPods Pros since launch week, these are by far the best iteration of the technology we’ve seen since wireless earbuds. 

The sound is actually amazing considering everything being offered in the package. It’s clean, flat, punchy and just a beautiful listening experience. noise cancelling is like nothing else, and transparency mode was already unrivaled and now it’s so good it sounds like you’re wearing open back headphones. Battery life has been fantastic, improvements to the case are fantastic, touch volume is responsive and intuitive. Apple has once again outdone themselves with these earbuds. People will say they’re overpriced and not worth, but as someone who got thousands of listening hours out of my last pair, you couldn’t pay me to use a different brand. These things are supreme"
2023-03-28,I just lost my AirPods Pro (1st Gen) like a couple days ago. So I decided to pick up the 2nd Gen recently and….. man an immediate upgrade from the 1st Gen. The Noise Cancellation is insane and Transparency mode is incredible and really almost feels like the AirPods aren’t even there
2024-03-27,"My wife got me these for Christmas. I came to this video to get a better understanding on how they work. Coming from a pair of beats that are 10 years old, these pods blow my mind. They’re so good."
2023-03-28,Actually really appreciate this review. Just misplaced my AirPods Pro case last night and that made me want to get the new generation already. So to hear about the improved sound quality and NC is just pure icing on the cake.
2023-03-28,"I wear the pros all day and use them as hearing aids.  I love the noise cancellation on them to, and glad to hear these new ones are even better.  It’s so calming to turn off everything annoying.    Your reviews are always spot on."
2023-03-28,"I got a pair today after using (and eventually losing) 1st Gen AirPods Pro for a couple years. Turning on the noise cancellation just outside the store floored me just as much as the originals had.

They also sound really damn good, lol"
2024-12-27,"I work in the hotel industry working the night shift. My work allows me to wear my AirPods as long as transparency is on so i can hear stuff over the music. It’s awesome for hourly walks, i don’t have to take my AirPod out i can just pause my music and still hear. Never realised how much i rely on it"
2023-03-28,"I bought a set because of the attenuation in transparency mode. I play in a symphony orchestra for a living and am now middle-aged. I can wear these during rehearsals and hear what I need to hear without damage to my hearing. I hear enough to balance. Intonation and timing are not an issue for me. I am not sure these are for everyone in my situation, but they may have added four or five more years to my potential career. Good video. Thanks for doing such a good job in your reviews."
2023-03-28,"Apple outsmarted all of their competition when they decided to approach earbuds as a convenience product that would be developed into good audio equipment over time. They officially caught up with the competition in sound, and are still kings of features."
2023-03-28,"For the ear scan for personalised spatial audio i would recommend doing it a couple times until it sounds better, there is a huge difference between normal and spatial especially for orchestral classical sounds, another game changer."
2024-12-27,"The hearing aid feature and hearing test feature is insane, I love it,  to mention you can shake your head “no” to decline a phone call, and “yes” to answer it"
2023-03-28,"The better bass profile is going to be the main reason I upgrade to these from the last generation. I listen to pretty much only bass oriented music, as a bass producer, so I'm really happy to hear they did this. Great review."
2023-03-28,"I did just what you mentioned @MKBHD, I wore the Gen 1 AirPods Pro to a Duran Duran concert recently and actually just used the ANC. It cut the decibels by a bit more than half and I still thoroughly enjoyed the concert.
Agree with you that with the V2s it would be even more enjoyable 
Great review as always"
2023-03-28,I love how your videos are such honest reviews with a great balance between the pro’s & cons and how this product is just so spot on that your video has this overall sense of “Yup. These are on the ones”.
2024-03-27,8:05 Having done this a few concerts over the last year I can confirm that the Airpods are awesome at concerts. They don't muffle the audio and change the sound signature nearly as much as actual earplugs like the Loop earbuds which are also really good but not the same as active transparency.
2023-03-28,Can confirm everything you said. For me they are and kind of have been the gold standard for wireless earbuds. Sometimes I even wear them without anything playing just to reduce the noise level around me.
2023-03-28,"The transparency mode on the original Pro's never blew me away. I always feel like it makes traffic and other ambient noise way too loud but doesn't amplify things that I actually care about like people talking to me. For example, if I'm walking down the street in a busy city and I stop to talk to someone, I still have to take one APP out to have a regular conversation because the city noises are too loud."
2023-03-28,As somebody who started exercising these are a life saver.  I’ve used wired headphones ever since I was 13 and pulled countless cd players tape players and phones off the table or equipment I am working out on.  These things are a God send.
2024-03-27,I used the AirPod Pro 1 and now use the AirPods Pro 2 and I fully agree that the noise cancellation and sound quality is massively superior !
2023-03-28,That transparency mode is next level considering they have the technology to scale down high decibel sounds in real time. I wonder if that technology could be reversed for those with hearing impairments.
2023-03-28,This is the ONLY YouTuber who explained me the adaptive transparency mode in the most easiest way!!
2023-03-28,Just a heads up: the personalized spatial audio works on the original airpods pro as well and it's worked great for me.
2024-03-27,I just got these today. The noise cancellation is so good I thought I went deaf. I felt like I was in a womb. This is great.
2023-03-28,I’m so excited to get mine tomorrow. I work in loud environments and I’m glad to hear these are going to do what I thought they were going to do
2023-03-28,I'm so glad you decided to do this review. I had no idea that they had this many upgrades!
2023-03-28,"I bought a pair and I love them. I only don’t care for the softness of the plastic of the case. It scratches real easy,so what ever you have in your pockets scars the surface."
2024-03-27,"Wearing them at a concert is the best idea ever. I was always annoyed with my earplugs. It protects my hearing, but I miss out so much.. the crowd around me, the proper sound of the music that's playing. And I'd still do it because my hearing is more important than that, but if AirPods 2 would work with that - that would be a huge game changer, I fully agree with you"
2023-03-28,"Listening to this on my new AirPods Pro 2nd gen’s that came in today and I can confirm: the transparency mode is next level. Not only is the adaptive transparency mode thing great, but what I also noticed is vastly improved is the whatever adaptive EQ’ing they are doing. Now, I literally cannot tell if I have the AirPods in on transparency mode or if they are just not in unless I am myself speaking. When I am speaking, I hear more highs in my voice than I would without the AirPods in. Really incredible, though. And yes, the noise cancelling is much better too. Very happy with my purchase.

My comparisons are to my wife’s AirPods Pro 1st gens that I used for the last month leading up to getting these."
2023-03-28,"For a reference, the concert idea would work I believe.  As a piccolo player, I once used my airpod pro 1's to block out the sound, and they worked magnificently!"
2023-03-28,"I just bought a pair of these, and they do sound better than my previous Air pods Pro, however, the volume controls on the stalks don't work as smoothly as I thought. I wish they had put the volume controls on the OUTSIDE of the stalks. Other than that, I feel they are a major upgrade."
2024-05-01,I never heard anyone giving such a comprehensive laying out of specs on any electronic gadget!!  Thank you for laying out such a clear picture for all
2023-03-28,"I just picked up some yesterday after my 1st gens stopped working, and omg they’re so much better than the 1st Gen. The sound quality and the improvements to noise cancellation and transparency is crazy. The option to change the volume on the stem is a nice touch"
2023-03-28,Marques deserves  an  award.He really takes his time and makes sure he delivers top notch content:)
2023-03-28,I use the current airpod pro in my workshop as they work pretty well at cancelling the machines loud noise while also allowing me to hear them for safety. So this sounds like a great upgrade.
2024-03-27,"Just bought mine recently. The ANC is definitely miles better. What will eventually concern me is the problem I had with the 1st Gen APsP where the sound drivers would just completely degrade to the point that they introduce a ton of peripheral sound as static and vibrate the earbuds while they're in my ear. My last ones sounded so incredibly hollow as a result of this on top of the static.

And these were the third pair I had to go through warranty for the same problem before effectively being convinced to just buy the new gen."
2023-03-28,That adaptive transparency feature sounds a lot like the electronic headphone noise cancellation that is in the headphones that are used for sport shooting. They let you amplify the sounds around you while simultaneously damping sudden sounds like gunshots and bangs.
2023-03-28,"The noise canceling and transparency modes are great for races.  I wore mine to the Rolex 24, where you want to hear the cars racing, but it's too loud to stay at the track without some ear protection, and they worked great!"
2023-03-28,"This is a game changer! I love my Airpods Pro 1st gen, they are holding pretty strong after more than 2 years, and these improvements on 2nd gen seems to be better than what I expected"
2024-05-31,"Marques I did wear my AirPods Pro 2 to a whole-day music festival wherein I was front row right in front of the huge speakers and it worked!!!! I would hear the music so well but at a more comfortable volume for my ears (like I couldn’t believe how the people around me could not go deaf with the loud sound! ) I also noticed that my Apple Watch would only notify me of the loud noise only whenever I would take off my AirPods. In short,  it knows that I took it off so it warned me about the loud sound level. Haters gonna hate but I love the Apple ecosystem!"
2023-03-28,"Coming from my 3 year old AirPods gen 2, these were such a big improvement.  Still getting used to the ear tips.   But I’m having a lot of fun experience with the noise cancellation, on my way into the city."
2023-03-28,It's really cool that the engraving also displays on your iPhone
2023-03-28,Got mine a couple days ago and Marquees is absolutely right. I notice the difference as an owner of the 1st generation Pro. The volume control for me is the best because I no longer have to reach my iPhone in the pocket while walking my dog. 2nd best feature is the improved noise cancellation and Adaptive Transparency mode!
2023-03-28,"You’ve become my “one stop shop” for reviews when I’m looking to purchase a new Apple product.
I recently purchased an iPad Pro based on your review and Apples pricing ladder! 
I’m now going to buy AirPod pro 2's."
