date,text
2024-11-27,Why the airpods pro 2 don’t show the battery  porcentaje “of the case”  like airpods pro 1 do
2024-03-27,I just got a pair of AirPods Pro 2nd Gen I originally got the 3rd gen AirPods and wish i had just got the AirPods Pro 2nd gen but now i have two pairs of AirPods
2024-03-27,Amazing review!!! please cold you tell me what the green thing is at 3:15 ? Thanks!
2024-03-27,"Hi Marques, Love your new studio. How you were able to bounce the sounds so you almost get no background noise and offcourse your RED cams and lenses.
I have a question. I’m from The Netherlands. And if I go here on the official Apple website. They say these new AirPods Pro 2.0 are supported from the iPhone 8 series. When I go to the American Apple site they say the AirPods Pro 2.0 are supported from the 6 series iPhones. Isn’t that weird?"
2024-03-27,"I think I did this one backwards. I just blindly ordered them because my old air pods were dying. They arrived today so now I'm trying to see what features they actually have. 

Sounds like I made an ok choice though."
2023-03-28,Just bought them love them
2024-03-27,Love the Commitment
2024-03-27,Marques is the goat. Hands down and it’s not even close.
2024-03-27,i just ordered this…hope its good
6  ago,"Just picked a pair up for $200 flat , replacing my OG pair of AirPod pros from 2019. Can’t wait …"
2024-03-27,"I was literally shocked at the noise cancellation for me. Sorry to be cheesy, but it’s actually changing my life lol"
2023-03-28,thank you so much for your videos!
2024-03-27,Is the audio quality better than AirPods Pro first gen ?
2024-03-27,When is apple going to add colour. That’s all I’m asking. I want black or orange.
2024-03-27,Thank you.  Well done.
2024-10-28,Thanks for the video. Very informative.
2024-03-27,"No microphone on them? No word. As a mobile producer, I use apple wired earbuds to lay down scratch vocals while fleshing out ideas. Was interested in these for that purpose. Now I’m sad."
2024-03-27,Are they good to use for gaming aswell?
2025-03-06,As a band member I use them with transparency mode on at practise or at concerts and without them I would be deaf rn
2024-09-28,going from a 30 dollar pair of skull candies. much wow. love mine. especially the noise cancelling.
2024-03-27,I need them to make a ear tip size in-between medium and small
2024-03-27,I will be getting these now my gen 1 airpod pro's are bugging
2023-03-28,Will they protect your hearing from really loud sounds?  Like at a shooting range?  (Asking for a friend)
2024-03-27,"What about wear comfort? Also, nc is not as good as Bose. Should update this video to see what's new with latest firmware"
2024-03-27,Just saw this video with the airpods
2024-03-27,Technology should come with an MKBHD approved sticker. Any time I consider buying something I look up a review by MKBHD first.
2024-03-27,Accidentally washed mine and now i don't know what to do or how  much damage has been done
2024-09-28,They are so good they haven't been updated in a long time.
2024-08-29,"A natural presenter with great info. When you see 4.3K thumbs up to a comment, you know it's gonna be a top-quality video."
2024-03-27,I work in schools. And this has to be true for anyone in public. Transparency mode terrifies me that I won’t be able to hear gunshots.
2024-03-27,Excellent review. Thanx.
2024-07-30,"I'm thinking about getting AirPods Pro 2, however I'm wondering two things:
1. Won't the 3's come out in 2-3 months? I don't mind waiting.
2. Can you enable/disable the noise cancelling? If so, how? Because I will only be using them connected to my Macbook, and I don't have an iPhone (yep), so I can't use a designated iOS app/setting for that."
2024-03-27,"Yes these things are great, just got them, the case battery just isn’t the best though"
2024-03-27,Great review!! Thank you
2024-03-27,I really appreciate the review
2024-05-31,adaptive transparency mode is its own mode now.
2024-03-27,which iPhone were you holding in this video. I like the looks
2024-03-27,"How did they perform for you in terms of remaining connected to your smart TV if the TV is anything but an Apple? Why does no reviewer ever mention this? If you change channel, pause, FFW, rewind, or anything that momentarily interrupts the sound output of the TV, when you resume, no sound from the Pro 2s. Didn't happen with previous Air Pod versions, doesn't happen with my Sonys. Google it. Happens with Samsung, LG and other smart TVs. Known problem since release and all firmware updates. This problem is never mentioned in YT reviews?"
2024-03-27,"Hi Marques, I appreciate your efforts this is an amazing content and AirPods people's is a great word!

This device made my life better for real, I'am using it as Hearing Aid so I can hear even a normal conversations!

I see that Apple take hearing loss seriously while developing this amazing level of ""Transparency Mode"" especially the ""Conversation boost"" feature.

With 249$ and just adding the data from your audiogram you can have almost your hearing back! Where the average hearing aid price falls between $1,000 to $5,000. (More than 90% of its users in my country are strangling from dailly battery cost, the daily cost of two hearing aids is $1 to $7 per day!).

I hope you can add those informations on the next review so people who cannot afford even the old hearing aids that useses standard disposable batteries and also works without any kind of connections like bluetooth! Can have an alternative. Which I personally see it a better solution even on the social level! Thank you :)

* I highly recommend @Doctor Cliff, AuD for more."
2024-03-27,Great informative review.
2024-03-27,"It’s me, I’m AirPods people haha. Just got a pair of these yesterday and I’m blown away by them!"
2024-12-27,I got them for Black Friday
2024-03-27,Just got these at Best Buy
2024-06-30,"thats the thing when I use the transparency mode, I get easily startled whenever some random harsh sound happens. I want to upgrade to these badly since I had my Airpods Pro 1st gen since 2019 but at the same time I feel like next gen Airpods could be announce and I could hold off the gen 2 for gen 3."
2025-01-26,Really great overview!!!
2024-05-31,"I swear, Marques has the smoothest merch plugs! lol"
2024-11-27,Skeptic but no more.  Best sound paired with Spatial Audio.  Noise cancellation is the best I’ve experienced in a while. I’m a big Bose fan and these are better to my ears.
2024-03-27,"Can you do sound tests on ear protection products? There are a lot of gun companies selling noise cancelling products with both foam and silicon. People claim that they are superior to AirPods. I can’t imagine these companies are putting in equal funding for development. Thanks.

I personally want to use foam tips for shooting with my AirPods."
2024-03-27,"I live in the UK where it rains every other day, these look great but impractical without a decent waterproof rating, thanks apple"
2024-03-27,Superb review!
2024-03-27,"I just bought it but I don’t see a difference between transparency mode and noise cancelling mode. In fact, even the nose cancelling mode does not work well either :/"
2023-03-28,I just got them today and I am trying to learn how I find them like this 2:46
2023-03-28,Got these. Thanks.
2023-03-28,I have been watching reviews on these for months. There is one thing stopping me. Is there a noticeable difference between these and the Huawei freebuds pro 1? Thanks
2024-03-27,Does it hurt your ears and can you sleep comfortably when you sleep in lateral position wearing these airpods pro 2?
2024-03-27,Wow! Apple added a compressor in the AirPods i love it!
2024-11-27,So the adaptive transparency is essentially a compressor? But also a reducer?
2024-03-27,"Got these for Christmas and they are amazing. I’ve never had AirPods before because I figured they would not fit and I heard people say they are too quiet. And tbh, I’m pretty positive the regular AirPods would not fit me but these ones do very well. Can’t wait to start bringing them to the gym and I love all these features I keep finding."
2024-10-28,Loved this video. Thank you!
2024-03-27,"When i sit below ceiling fan it cant block the wind sound.
Need improvement there."
2024-12-27,Just got these today $170 Black Friday deals
2023-03-28,"7:02 isn't it an Idea in honk and ambulance siren to be that loud and harsh, so you pay attention to it?"
2024-09-28,Thanks for these videos
2024-03-27,Transparency mode is going to help. I got shot 8 times November of 2021 and I didn’t notice the guy in the bushes waiting for me because I had the AirPods in.
2024-11-27,Now they must make it NOT disrespectful to wear earpods when talking to someone
2024-03-27,Please ignore MKBHD and do not wear AirPods Pros to a gig. They do not and will not protect your hearing.
2024-11-27,Why the airpods pro 2 show 3 headphones  when they are connected to bluetooth? The airpods pro 1 show 2 (what’s it normal…. also the airpods pro 1 show them on the screen including the case battery porcentaje) and the airpods pro 2 don’t
2024-07-30,With that adaptive noise reduction ability how effective are these for ear protection while shooting a firearm?
2024-03-27,"@marquees, a lot of peeps bought the airpods with engrave but the engrave is not showing in the airpods notification"
2024-03-27,I got my secondhand airpods pro 2nd gen for only $120 with AppleCare+ until June 2025
2024-05-31,"On a serious note, I want you to test microphone. I have had microphone issues while travelling outside (everyone complained that they barely hear me). Had this issue after even replacing the headset twice! Can you test?"
2024-03-27,"Tbh the highlight is not the sound quality, it’s the features"
2024-03-27,"Hey Marques, didn't find any reference to call quality or the mic quality?"
2024-03-27,How does it sound when you talk with the AirPods in your ear? Some earbuds that I tried that has the tips in the ear canal makes it muffled like you are covering your ears so it’s better to remove them every time you talk or sing.
2024-08-29,"got one in transition of getting an iphone, tranparency mode is night and day to pixel buds pro"
2024-03-27,I thought I was the only person who used these to save my hearing during loud events and concerts!
2024-07-30,Prime day and my employe discount came in clutch today
2024-03-27,PERSONALISED SPACIAL AUDIO is very accurate with AIRPODS MAX  for me. BUT with the AirPods 3rd gen it is changing nothing .
2024-03-27,at this point idk if were gonna get the gen 3 apple airpods pro. i think i might just go ahead and get the gen 2 pros. thoughts? should i wait?
2024-09-28,Just purchased a certified refurbished version and came here to rewatch this review
2024-03-27,This upgrade is what I love the most also however I still need to test it out at the range I assumed my first air pod pros would be fine at the gun range and the first shot blew them apart as far as the speakers working after the sound of the Glock. Now the setting was on an open ranch in the mountains of Utah however the sound from the gun just ruined the air pod pros. I thought it could handle it lol my bad
2024-08-29,Trust me they r mind blowing. Even with my iPhone 8
2023-03-28,Curious if it would work for lowering gun shots if you were at the gun range.
2024-03-27,Wish mine would cancel out next door's dog barking! Even in noise cancellation mode I can hear it.
2024-03-27,First time watching this man and he’s already capping in the first ten seconds
2024-03-27,I’m buying this for me this weekend
2024-07-30,Another great video but what on earth was that pronunciation of 'ambulance' about?
2023-03-28,How long it takes to be fully charged using 20w apple adapter?
6  ago,still a great vid love these
2024-03-27,Love this review
2024-09-28,So helpful -- thank you!
2024-03-27,"So, addressing 8:11 could you use Airpods Pro 2 on a “jamming with a band“ scenario? Where the drums, guitar amps, and PA system is so loud in a small space… I usually use earplugs but it just muffles the sound… 

would Airpods Pro 2 work better to protect my ears without the “muffleness“?"
2024-06-30,Awesome review
2024-03-27,Nice review thank you
2023-03-28,"8:18 It’s funny you mention the “wearing Airpods in transparency mode mid-concert” thing, as I’ve done this multiple times with my Gen 1s. I was always very impressed with the results, and would consistently come out of concerts with my hearing intact where as my friends would complain about their ears still ringing. Very excited to try this out with my Gen 2s!"
2024-03-27,Does the spatial audio still work on spotify?
2024-03-27,"But here’s the thing, as good as every new version of Apple AirPods come out, they still always break! Something goes wrong with them or the case. For me it has never been worth it to spend hundreds of dollars on this if I know they are going to break! Let me hear from other people about this, because I can’t believe I’m the only one"
2024-03-27,"I’m looking to buy these or the AirPods Max, I bought today my very first iPhone, a 15 ProMax"
2024-03-27,"Great video, does the case work with gen 1 pros?"
2024-03-27,Please review every upcoming dell XPS laptop please.
2024-05-31,I love my AirPods. The best sounding music ever. The best $299 I have ever spent!
2024-03-27,Just got a pair
2024-08-29,"Apple want you to buy in to their ""ecosystem"" by purchasing multiple Apple devices, yet do not include multipoint Bluetooth to connect to multiple devices simultaneously with their $250 earbuds. Technology that has been around for years and included with other $50 earbuds."
2024-03-27,One word - INSANE
2024-03-27,Mine arrived literally an hour ago and the noise canceling is insane. My 2018 Airpods 2nd gen are garbage in comparison!
2024-09-28,"Can anyone have answer for this Q

i want to buy the AirPods Pro 2023 with USB-C

Does there are difference between 2023 and Sept 2024 edition ?

The new features will be comes in software update ??"
2023-03-28,Is anyone having a problem with their AirPods where it won’t update to the right firmware?
2024-03-27,"I’d really like them to ad a mic on the case so I can talk into it for phone calls, or make it possible to use the iPhone mic to talk into it, while receiving the phone call sound on the AirPods. Could someone maybe ask them to do that? Or just something to make it possible to talk on the airpods without having to scream. or is it just me?"
2023-03-28,Listening this on air pods pods 2nd generation
2024-05-31,I still can’t do the sound control like turning the volume down and up
2024-03-27,"I watched this and went and bought my own pair, i detail cars so they help but when I use an air blower my right AirPod has a lot of static noise is there any reason for that?"
2024-03-27,I got 1st gen Pros near the end of their cycle and they used to attempt to mask loud noises (maybe a prototype feature? idk i havent found anything on it) I would slam a door shut and the airpod would go into full noise cancellation and then slowly adjust back into transparency mode kinda weird
2024-05-31,Strange how little tech reviewers speak of the sound quality.
2024-03-27,Mkbhd you have to review soundcore q45s
2024-03-27,"In order for the 85db reduction to work, the airpods would need to have a seal to your ears similar to an actual earplug. But they don't have such a seal."
2024-03-27,You became an amazing tools for most of Co.s
2024-03-27,"Being an audiotrician, please be careful with using any noise reduction headphones. The noise reduction, unless physical, can still be damaging to your ears. I am not exactly sure how these AirPods work, but if a noise reduction happens with an override of additional sound isolation,  with for example different combinations and frequencies of white/grey/ sound, then the noise reduction is done with sound. And as such, it won't protect your physical ear from damage in a loud environment. In addition, it creates additional sound strain on your ear. Please consult experts and get medical advice  We see uptake in hearing damage in the general population."
2023-03-28,Can these connect to 2 devices at once…and change between them automatically (based on which device I use)
2024-11-27,Great review. Thanks !
2024-03-27,Do u have mic issues with call while in car or outside ? I replaced my pods now but still the problem persists
2024-03-27,Am I the only one who is  woundering if the transparency mode works when your shooting guns
2024-03-27,This made me realize that I often do keep earbuds in for over 6 hours at a time...
2024-03-27,"I never found mine. Its still showing the same last location. I literally went back at that place within 15 minutes of loosing them. This place is a car mechanic on the side of  a busy highway. Btw i was never able to recover mine. Also lost jabra 65t elite active, and jabra 75 pro And lastly the airpods pro 2nd wasnt able to recover any one of those.. today i grabbed a new pair l after about 1 month of loosing my last pair."
2024-05-31,watching this may 6th 2024 and there's an apple event tomorrow at 7am but i do pln on buying these
2024-05-01,are these good for Netflix movies at home ? bcoz my max are showing technical issues..can pro 2 replace max ?
2024-05-01,He had so many names for them. Air buds. Ear pod pros lol.  so many products he reviews I don’t blame him. Love it
2024-03-27,Charging your respods with Apple Watch charger is the least Apple thing I’ve seen.
2024-03-27,late to the party but man do i love them
2024-03-27,"Man this is pretty insane. I had the 1st gen pros and loved them. I actually used to wear them at the drag strip with straight pipe hellcats everywhere and believe me they will make your ears bleed. The gen 1’s made them tolerable, and if these are better than those then holy cow!"
2023-03-28,"I have got AirPods Pro 2 and can compare them with custom silicon earplugs for noice cancelling. Also compare them by music with 200$ wired Meze 99 Neo and  with 200$ wired earbuds Master&Dynamics ME05.

As for noice cancelling without a music Pro 2 blocks sufficient amount of noice but less than custom silicon earplugs. As for music the most detailed - ME05, the best bass - Meze 99, the biggest space - Pro 2, they sounds like semi-open headphones. Overall for music the best is Meze 99, as they give a little more natural sound and better bass. Not very far from them - Pro 2. It is surprising that this little bugs can be even close to such big wired guys as Meze, also Pro 2 occasionally at some compositions may take the 1st place as give the biggest space. 

For watching movies and videos the best are Pro 2, it seems that the sound goes from a screen. Pro 2 gives a lot of comfort and always at hand. Good noice cancelling while watching movies, listen music. Transparency mode is a plus. They seamlessly connect to different Apple devices and give the sound from that device you use in the moment. Actually very-very like them, a very comfortable experience."
2024-06-30,Good ‘ol Ambu-Lance
2024-12-27,"Something to add onto the video: The AirPods Pro 2 with USB-C case actually allow lossless. That is, if paired with an Apple Vision Pro, which sounds like a desperate attempt to sell the Apple Vision Pro."
2024-08-29,Anyone know if the mic is better? I have always had problems on phone calls with people saying it sounds like I’m in a tunnel
2024-10-28,Great review. Thanks.
2025-01-26,"Any thoughts on mic quality for zoom, teams, phone calls etc? Thanks"
2024-08-29,Anyone know if the mic is better? I have always had problems on phone calls with people saying it sounds like I’m in a tunnel.
2024-12-27,I am wondering how bass sounds on them? Is there anyone used them with sony mp3 player?
2024-03-27,i love watching stuff i’m about to get
2024-07-30,"Bros rockin the kursgesagt book, YESIRRRRRRRRRRRRRRRRRRRRRRRRRRRRRRRRRRR"
2024-03-27,I have a fake version but I still like them they are good
2024-03-27,"Bro, for the whole concert scenario. There are analog earbuds that have been doing exactly that for 20$... So let's chill a bit shall we."
2024-05-31,11:15 Wouldn't you hear the real sounds also at the same time?
2025-02-25,Normally people would get AirPods for their iPhone.. I actually got an iPhone for my AirPods
2024-03-27,Best airpod
2024-08-29,"Just got my pair, they’re great but I ALWAYS accidentally activate the touch  controls when taking them out, adjusting them, putting them, anyone have suggestions to fix this?"
2025-01-26,Just came here to confirm my purchase
2024-03-27,"I bought the AirPods Pro 2nd gen about 2 months ago. These are the best earbuds for iPhone users. Period. The Active Noise Cancellation is so useful when you're outdoors or even when you're trying to work and don't want to listen to the outside world. It just creates an awesome seal of silence in your ear and it feels discomforting to a first time user but you eventually get used to it. I never use these airpods in transparency mode because the ANC is too damn good. And boy, the connectivity between my mac, iPhone, watch... it's seamless."
2024-03-27,I am in the middle of Do i really need it because this will just die in few years say 3-4 years. You dont have any option to replace battery or cheaper replacement offer.
2024-10-28,"You should be the key speaker for Apple events… Tim Cook has no personality whatsoever, he’s dead in the water before he opens his mouth. You on the other hand… I could listen to for hours. You’ve got real charisma and you sound as honest as Walter Cronkit. Lol. If you even know who that is."
2024-03-27,"After ordering Temu's $6 ""Lenovo"" ear buds, I had a laugh, and ordered the AirPaos Pro 2, LOL!
I've always been on the fence about buying any kind of high dollar ear pods, but I think these will suit me, for what I need, especially the transparency mode, because I attend a church on Fridays, that's loud, REALLY LOUD!!!
I think this will be exactly what I need.
I can't wait for the pastor to ask me why I'm wearing ear buds... LOL!"
2024-03-27,"Hi, can the latest Airpod Pro 2 still be used as a hearing aid for mild/medium hearing loss people? If yes, it what ways has it been improved compared to the previous version? Thanks."
2023-03-28,I upgraded from the 1st gen and the 2nd gen blew me away
2024-03-27,"When I first opened my AirPod Pro 2, I had  “not your AirPods Pro ” pop up on my phone 
Does it mean it’s fake?"
2024-11-27,Didn’t mention the hearing aid component.
2024-03-27,My mom bought this for her work and I tried them on my android. I love this design and very comfortable. I'm thinking to buy this next. And no! I will never EVER buy iPhone products.
2024-09-28,I had the pro 1 and the ANC on the pro 2 are a crap ton better
2024-03-27,Should I upgrade from AirPods Pro gen.1?
9  ago,"What configuration takes the best sound quality out of it? I feel like spacial audio mode spreads sound in a way it takes off a little bit of sharpness from it. I don’t know if I’m used to stereo music, but I feel better to listen to it with spacial audio off."
2024-03-27,"Try those with an M2 MacBook, brand new experience than a iPhone or iPad"
2024-10-28,1:18 my guy streaming one of the most underrated songs on WTT
2024-03-27,Watching this video with the airpods pro 2
2024-03-27,That h2 chip amazing
2024-03-27,Started using the AirPods Pro 2 and my ear aches. Tried multiple buds but after 15-20mins of runtime it aches. Any work around?
2024-03-27,Is it a good idea to use these as hearing aids?
2024-03-27,"this product might be good, but i dont understand how us, students need such an expensive pair of earphones just for daily spotify uses, most of the people cant even tell the difference between good quality and average quality, it doesnt even matter to most of the people (mainly friends and other students i see at school) yet they purchase such an expensive product. I personally don't have much preference as long as theres noise cancelling, mine costing 25 dollars work just as well."
2024-03-27,Sony linkbuds S with a smaller form and LDAC  would kill this.
2024-03-27,"How come I hear transparacy mode if you take one out, and noice canceling is not working any more?"
2025-01-26,How good is the bass when listening to music? Bought the air pods 4 recently and was the worst purchase I could ever make sense of course they don't make the air pod 2 anymore.
2024-12-27,"This video makes it seem like Adaptive is always on in Transparency mode, but I see them as two separate modes. Does the normal default transparency mode not reduce harmful noises? Do I have to be in Adaptive for that?"
2024-08-29,"If you struggle with which ones to get: AirPods Pro 2 >>> AirPods Max. My only complaint with AirPods Pro 2 is that conversation awareness is terrible, it's triggered when I don't want it to and doesn't activate fast enough when I need it. They really need to amp up that neural engine in the next generation."
2024-03-27,"How are these for meetings? If I am speaking from a noisy room, will the computational audio capabilities of H2 filter my voice from the background noise?"
2024-03-27,Doing audio test with Spotify  on an apple device with Apple AirPods
2023-03-28,The noise is gone it’s unreal my Vornado fan couldn’t hear it at all lol
2024-03-27,The 6 million dollar qustion can u use there earphones on samsung phones???? Or any Bluetooth like TV???
2024-03-27,Darn it... I had no intentions of buying ipods and now I want them...
2024-03-27,Banger im picking up two pairs one for me one for my daughter
2024-03-27,the volume on these are so low even at max volume and the bass is not that great
2024-10-28,This or the non pro gen 3? In terms of SQ
2023-03-28,Is airpods pro 2 ( A2618 ) genuine or not..?
2025-03-06,"it is worth it to upgrade , because mine the previous one already 5 year and have problem"
