date,text
2024-11-20,"No, I’m skipping because this is legitimately the longest post I have ever seen on reddit. You put to shame every teenager who writes a book on their relationship problems."
2024-11-20,Any chance you can expand on your thoughts 😒
2025-02-05,"A bit long lol but anyway, thanks to this post, I got the AirPods Pro 2 they are much better from the 1 generation. Any suggestions for a leather case?"
2024-11-20,I would love to read these but it's just too long man. Maybe try paraphrasing each paragraph? Would love to read these if it were shorter.
2024-11-20,"I love that in spite of the extensive knowledge and experience offered in this post, I will see at least 5 more posts tomorrow of ""Are the Airpods Pro 2 worth it?"""
2024-11-20,"Nice review. Not sure why you're getting cooked for it being long. Would rather a review be detailed than it be just a set of bullet points with no elaboration. Was able to get through *most* of it without skipping to the bottom, though I did skip some of the later sections comparing the APP2 with the APP1 and the AP4 since I already own the APP2. I generally agree with you on most points with a few differences in opinion that mostly come down to personal preference. Only nitpick would be your equating larger headphone driver size with better sound quality since it's not quite as simple as that, but otherwise, good looks 👍"
2024-11-20,"i have been rocking them since there release however I have always had terrible experience with the microphone, sound quality is good for ear buds for sure but nothing out of the world, a 60$ noise cancelling over the ear headphone easily outperforms airpods, but can not give you the portability and the apple experience."
2024-11-20,"I dont mind this being long, clearly you enjoyed doing it more people need to just do things they find joy in and pass on it if they don't rather than dragging others down for doing it in the first place."
2024-11-20,"Though seeing the post I thought it’s too long to read, when I started reading it was flowing. I could also see which portions I can skip. Good writing. Thanks for the review. I got a pair of AirPods Pro C version from my company. I have to set it up."
2024-11-20,"I appreciate how much detail you went into, as someone deciding whether to buy APP2 when they go on sale to upgrade from the OGs. Yes, it is a long post... I didn't have time to read it, so I chose to have Siri read it to me -- id rather have all the info from someone who has used all the options for a long time that what most reveiws are... ""I just got these today, they seem amazing so far!"" LOL"
2024-11-21,My English teacher is hounding me for the annotations on this puppy. due Friday
2024-11-21,"People hating on the best, most thorough review   I've seen on AirPods Pro gen 2s is so stupid. If you want a review, you should want one with all the details you can fit in it. I know that half the people hating are very unsatisfied with their other purchases due to the fact they can't read a review cuz it's ""too long""."
2024-11-22,Nice review. I’m a new Air Pod user and mainly bought them as a hearing aid. After many years in a manufacturing environment my ability to hear high soft voices is frustrating. I also listen to music and have several blue tooth over the ear sets. The initial hearing test was a bust for me as it kept getting an error message in the end saying that the noise in the room was too loud. That wasn’t the problem and after reading on Apples forum it a big problem. I was able to use an App called Mimi and upload those results after an hour of hearing tests. I really like them and use them for everything from watching tv to any important conversations. They are a game changer for the money to me.
2024-11-20,Is this writing prompts?
2024-11-20,Do you expect anybody to read your dribble of a review
2024-11-20,Please elaborate on your points
2024-11-21,"motherfucker made an entire fucking essay for a pair of airpods jfc

thank god for that summary but…

GOOD MICROPHONE???? this sentence alone made your entire 10k word essay invalid. This is a very bad lie and there’s no way in heck you have any idea of how a mic should actually sound like"
2024-11-21,"I had to skip, bud. This is too akin to reading the Terms & Agreement section of a product. 😵‍💫😮‍💨"
2024-11-21,MKBHD just find his rival !!  And now I’m following you.
2024-11-22,"Welp, that's probably around 5-10 minutes of Youtube video in writing.

I just have a question though, your battery life is 4-4.5 hours after 2 years of daily usage or that's what you got when it's brand new?"
2024-11-30,"Nice review and a good read. By some of the comments, it does amuse me how lazy people have gotten and expect everything to pushed into their eyeballs by some crappy TikTok video."
2024-12-26,this review has convinced me to pull the trigger and buy the APP 2’s. Thank you for taking your time and adding much needed details and personal experience with the product in question
2025-01-12,Thanks mate for this review… I found a good deal of new airpods pro 2 with lightning for 150 euro and i was hesitant buying them due to the lightning. Seeing your post though changed my mind. Thanks
2025-03-16,Thank you for the comprehensive post. It was well written and nmot too long as it covers all aspects in detail and was very easy to read.
2024-11-20,"Great review. Idk why people are beating you up about how long the post is…
Wouldn’t you guys want a more in depth review? If you don’t have the time to read it that’s your problem, not OPs"
2024-11-20,Great well flushed out review! Willing to bet half the people commenting wouldn’t have an issue if there was some subway surfers at the bottom and an AI voice narrating it lol
2024-11-20,Going to have to Apple AI summary that
2024-11-20,"I tried apple airpod 2 after having beat fit pro and swear I couldn’t tell a sound quality difference,"
2024-11-20,"I bought these for video meetings but they neither work with Microsoft Teams, or Google Meet - known issue that Apple doesn't care to worry about."
2024-11-20,I‘ve seen other posts and noticed myself that the ANC has gotten worse maybe because of the hearing health updat? Did you notice the same thinng or is it just getting used to it?
2024-11-20,I‘ve seen other posts and noticed myself that ANC has gotten worse. Is it because of the hearing health update or just getting used to it?
2024-11-20,"Anyone has had problems with ANC?

Like i had blood dripping from my ears and it happened two times i read ANC it’s not safe to continuous use and i never had this problems until i bought my APP2 :(

Just ended never using ANC anymore"
2024-11-20,"Good review but I recently tried the APP2, and personally was not a fan with the sound, it was too neutral for my liking"
2024-11-20,They suck. Mine only lasted 2 years before being fried from using. Apple Store said there’s nothing they can do but I can drop 300 for a new pair. Fuck these.
2024-11-20,"I returned my AirPods Pro gen 2, sound quality was awful on them so idk if I got a bunk pair or not but they sounded so nasally and the bass was barely there. My xm4 earbuds are still superior"
2024-11-20,Nobody:  The Original AirPods are so comfortable
2024-11-20,This is so long it exceeds the context window of ChatGPT bro
2024-11-21,Skipped post and came straight here for the comments.
2024-11-21,"My long term review:



Sounds good. 1 and half years in the right side stopped working. Classic Apple move, 6/10"
2024-11-21,Mucho texto
2024-11-21,Someone lmk what happened to his case cuz ain’t nobody reading that post 😂
2024-11-22,Don’t know why so many people are ragging on an in-depth review…
2024-11-22,"I would want a review this long for a car maybe.

I ain’t reading all that for a pair of headphones 🤣"
2024-11-22,Yeah whatever just put the fries in the bag bro
2024-11-22,"crazy replies, thanks for this post. ill get a pair this black friday"
2024-11-22,What happened to the case? Looks melted
2024-11-22,"I've been using them for a couple months, they seem to be more reliable than jabra, sony or bose breakage wise in reviews with second best anc after bose, bose qc fails to even pair correctly, but inferior battery life to sony and not water resistant like jabra. I also got that terrible right bud buzzing bug a few times which is so unacceptable on a new product. Sometimes they won't even fix or replace your product if it has this. I have applecare and it's gone away so well see I guess. Like any bud besides sony I have to listen on like 35 percent volume with ANC enabled to get 4-5 hr battery life. I use them with android and works fine so far . They really need to aim for a higher water resistance as well

Can I turn on this loud sound reduction for better performance in full ANC mode? Any way to do in on android, or do it on an iPhone and keep it set that way on android"
2024-11-23,"I was having buyers remorse from purchasing them from Amazon because I already have the AirPod pros, but this post made me excited for them.

I’ve had my AirPod pros since 2021 and I have definitely noticed battery degradation. The left pod also makes an odd sound unless I use both pods at the same time. That left pod also makes a weird sound to whoever I’m on the phone with, so I’m basically forced to only ever use the right pod.

I also had been looking into beats or sonys for my new headphones and was a bit sad I wouldn’t be trying something “new” but that feeling is also gone because I love my AirPods. This post made me excited to receive a brand new, upgraded pair of my favorite headphones.

Thanks for this write up, my buyers remorse has disappeared."
2024-11-23,Congrats on finishing your dissertation bro
2024-11-24,Shit even chat gpt malfunctioned when I asked it to summarize this saying it’s too long
2024-11-24,“I have come to believe that AirPods cases are largely a mistake. They just make them more bulky and don’t do that much to protect them.” - I gave up reading at this point…
2024-11-24,"This weird thing about attention is really off putting. This is much longer than it needs to be and people are not interested in wasting their time listening to you wax poetics, get over yourself lmao. Gtfo here with that weird postering shit bro"
2024-11-24,"I have the AirPods first gen and second gen and I love it! Last year I found a brand new AirPods Pro 2, like 7 days since actived. I tried to reach out the owner but he was from another country and told me I could keep it since would be too much work to shipping and stuffs ( he might be some rich 😅). So now I’m using it and it’s pretty amazing. The noise cancellation it’s just amazing! To travelers it’s perfect! I could finally sleep in an airplane flight!"
2024-11-25,Good review bro
2024-11-27,"""Obviously, a pair of over-ear headphones like AirPods Max will have better sound quality and bass due to having much larger drivers, but for the size of the earbud, they’re super impressive.""  
I actually disagree. I \*am\* one of those audio people, and the airpods pro 2 sound multiple times better than the airpods max in my opinion. it's that much better. Seriously, these things sound amazing."
2024-11-28,Can anyone comment on their experience Airpods Pro 2nd Gen. vs. Airpods Pro 2
2024-11-29,this a video script not a Reddit post
2024-12-03,"Thanks for the review and your thoughts. They fit my ears well (which was not true with Airpod Pros 1, which fell out), and the sound and noise reduction greatly improved."
2024-12-04,i aint readin allat😭🙏
2024-12-05,"Even chatGPT could not summarise this. Thank you for the very long, detailed review"
2024-12-20,"At first glance, I didn’t want to read all of this. After all the hate comments, I decided to give this post a shot anyway. It was thorough, well written (as a review should be) and offered short summaries for those of you with learning issues. Well done and I found the information I needed!"
2024-12-22,Can you elaborate some more please 🤣
2024-12-22,"I read the whole review and like the comparisons with the airpods 4 and pros 2 as im in the market at the moment and was undecided. Coming from the AirPods 2, any of these two is an improvement. Thank you! Im gonna try to pros 2 as they are on sale at the moment."
2024-12-29,Very detailed thank you - just trying decide if I buy in man or wait 8 months now as I suspect the next will be out in September 2024
2025-01-01,"They're a waste of money. I bought $30 ear buds that do 100% what these do. They even provide more noise canceling. I took my new airpods out three or four times today because outside noise was bothering me. The price of this subpar product is exactly whi I avoid Apple like the plague. Only reason I bought them is my sister bought me a $15 case I loved that only fit them. Only good thing I can say, Apple is finally using the same charger port everything else is. In summary, if you enjoy your own farts and music on vinyl, this product is for you. If you actually work hard for your money and watch your budget, there are far better options."
2025-01-08,Have you had any issue with crackling sounds in noise cancellation mode?  That’s my main reason for wanting to upgrade.
2025-01-15,I read every single bit of your review and thoroughly appreciate the effort. I currently use Heavys H1H headphones and they’re the best I’ve ever had. But they suck to travel with which is why I’m considering APP2. This was super helpful.
2025-01-20,Holy fuck even skipping over that took awhile.. I’m just gonna buy em lol
2025-01-22,Can you make this any fucking longer???
2025-01-26,just picked some up for $50. theyre pretty good.
2025-01-31,"Nice writeup. I just bought pro 2 and wanted to read someone’s experience, this fit the bill perfectly. Thanks."
2025-02-01,"So many people are hating on how long it is, and sure it’s long, but you’re getting overhated man. I read the whole thing and I know my exact thoughts on these airpods now lmao."
2025-02-12,"Thank you so much for the review.  I have the Shokz conduction set of headphones, and while they do a pretty good job when they work, they are inconsistent in connecting, and I am considering the Airpods Pro 2."
2025-02-13,I just bought my first air pods today at Costco for $180. I don't know if this is a good price as I never bought air pods before. I read 90% of your post and I think I made the right choice as you seem happy. Costco also had the regular 3rd gen there for $149. I will attempt to connect them to the phone now as I think the case is fully charged which I don't know but I had it plugged in to the charger for 2-3 hours. a red light blinks when i move the case but never see green. Maybe there is no green. Anyway thanks for your review.
2025-02-13,[deleted]
2025-02-14,"Excellent review!  Mahalo nui!  And no, your review wasn’t too long, I appreciate your thoroughness. I have been using Sony WF-C700N earbuds for two years now. They’ve done well, but they just lost the microphone function. I am considering buying AirPods Pro 2 or Bose QuietComfort. Any opinions on this choice are appreciated."
2025-02-18,"Here you go guys:

AirPods Pro 2: Two-Year Review Gist
Overall: The author is very satisfied with the AirPods Pro 2 after two years of daily use, citing excellent sound quality, impressive noise cancellation, and convenient features.  While there are some minor design flaws, they are overshadowed by the pros.
Key Points:
 * Design: Comfortable fit, durable buds, but the case scratches easily and the charging pins are finicky.  Case design could be improved to prevent AirPods from flying out when dropped.
 * Sound:  Excellent sound quality for the size, good microphone quality.  Personalized Spatial Audio is a plus, but Conversation Awareness and Personalized Volume are less useful. No built-in EQ.
 * ANC/Transparency: ANC is highly effective, even rivaling some over-ear headphones. Transparency mode is good but not as natural as removing the earbuds. Adaptive Audio is less useful than either.
 * Battery: Battery life is satisfactory, with quick charging. Degradation is noticeable after two years.
 * iOS 18:  Hearing health features (hearing test, hearing aid functionality, hearing protection) are revolutionary. Siri Interactions are less useful.  Spatial Audio for gaming and improved voice isolation are welcome additions.
 * Upgrades:  Upgrading from older AirPods or first-gen AirPods Pro is recommended if battery is degraded or new features are desired. Upgrading from Pro 2 with Lightning to USB-C is generally not worth it (unless you have specific connectivity issues with the Lightning version and use a Vision Pro).
 * AirPods 4: The author strongly recommends AirPods Pro 2 over AirPods 4 due to significantly better noise cancellation and the lack of volume controls on the AirPods 4. The open-ear design of the AirPods 4 results in significant sound leakage and inferior ANC.
TLDR (Apple Intelligence Summary):
The AirPods Pro 2 offer a comfortable design, impressive sound quality, and highly effective noise cancellation.  While the case has some minor issues, the overall experience is excellent.  Upgrading is recommended for users of older AirPods or first-gen AirPods Pro.  The new hearing health features in iOS 18 are a major selling point.  Avoid the AirPods 4 in favor of the Pro 2 unless the in-ear fit is absolutely unbearable.  Upgrading to the USB-C version of the Pro 2 is generally unnecessary."
2025-02-20,"From my experience they are not good at all,You can’t use Siri and connectivity issues. As of now one of my airpods refuse to connect because I have to update them but its been hours since then and they still don’t work..i never had a problem with the other airpods pro."
2025-02-25,"Thanks for the detail, I'm considering buying these refurbished when they go down in price"
2025-02-25,"OMG - Are you one of the last remaining humans that can think longer than a Tik Tok or Instagram post? Be very careful, soon you be hunted for having your own, very detailed thoughts. Chemical kosh coming for you!

How dare you write an actual review with comments that may be genuinely useful for someone who is thinking of buying them.

Next time can you please use chat gpt to create something and then ask it to then reduce it to 8 words and post it?"
2025-02-27,I really appreciate the post! Helped me a lot😁
2025-02-28,"I have an unrelated question. How do you return used AirPods, after having opened the packaging and sealing etc? Serious question. I've been wanting to try on some AirPods prior to investing in them, but no stores offer that."
2025-02-28,Recently just got my APP1’s stolen after having them for 3 years and this convinced me to get the upgrade next month for my birthday. Thanks! Also I don’t understand the people who are saying the review is long. I think you summed up the points perfectly and I was able to skim through some of your explanations without missing much.
2025-03-01,Do not buy these POS! Not worth a penny of what they charge.
2025-03-04,"hi, i read through the sound quality and i couldn’t find if you said anything about sound leaks so just wondering if there were any sound leaks when you have it at a moderately high volume"
2025-03-05,"Im having so much connectivity issue with mine, so just using my airpod pro 1 again."
2025-03-13,mine got ran over by a truck and lost in the snow for 2 months and they work and charge the same
2025-03-13,Thank you for the in-depth post:) What I needed
2025-03-14,"man had a great time reading the review and you have convinced me thoroughly, just wondering about two things; can people hear my music if I have it blasted all the way up and will they pop out if im excercising, say playing basketball. thanks"
2025-03-25,"I bought these AirPods maybe a month ago… my only complaint is when I am on the phone with the AirPods in, I can almost hear myself? Like it’s like I can hear myself on the other end of the person I’m talking to… almost like an echo…? I don’t know how to describe it but it is SO irritating. I never noticed this with any previous AirPods I owned. I know these AirPods have a setting where when you’re talking, the music can turn down so you can have a conversation with the AirPods in, but I have this feature turned off. Is anyone else experiencing this? And if so, is there a setting that can be turned off because I currently DESPISE having any phone call with these AirPods in"
2025-03-26,"Look. I had a big concern of whether to upgrade to the AirPods Pro 2 or the AirPods 4 having owned the AirPods Pro 1 for a long time. The AirPods Pro 1 are a very good AirPods but my seller asked me to just test the AirPods Pro 2s and if I did not like then I could return. We did a bet. 

Results: The transparency mode on the AirPods Pro 2 is miles….miles …..miles better than the AirPods Pro 1s. For get noise cancelation. These AirPods Pro 2 sit on my ears like I am wearing nothing. 

Another thing. When I was wearing the AirPods Pro 1 with the transparency set in accommodation mode I would bang the car door and want to remove the AirPods. The bang was so loud because of the sensitivity. The AirPods Pro 2s removes that completely.

Finally the hissing that came with transparency is gone.

In short. AirPods Pro 2s are far ….far better than the AirPods Pro 1s. 

As for the AirPods 4s what I hear is the noise cancellation is not as good as the AirPods Pro 2s. Of course this is the case because they have no proper seal the the ANC algorithm keeps having to work hard to compensate."
2024-11-20,"Jesus, take a breath m8."
2024-11-20,Uhm why
2024-11-20,"I asked ChatGPT to summarize your post and it says “it’s too long, submit something shorter”"
2024-11-20,Brother post a TLDR. Ain’t nobody all that.
2024-11-20,I will get in 2 weeks airpods pro 2 type c (lightning is unavilable and i would still get typce c)
2024-11-20,AirPod 4 is better.
2024-11-20,they lwky suck if i’m being realistic right now
2024-11-20,My exact thoughts even the TLDR is too long
2024-11-20,I hate the fact that I am compelled to make a post that I hate the fact that someone has enough time to write something this long.
2025-01-19,made me self-conscious about my attention span for a second.
2025-02-20,lol redditors are so whiny
2024-11-20,"Yes, check out my profile for the rest of my in depth reviews. But I forgot you people need everything spoon-fed to you in a way that doesn’t make you do any work whatsoever"
2025-02-17,Are they comfortable for long usage? Say binging a show or listening to music for a long time while studying. Cause I find the pris comfy but when I wear them for a long time my ears start sweating a bit.
2025-02-21,Maybe too late but I bought the nomad leather case at Best Buy like 4 years ago and they aged great
2024-11-21,Past it in chat gpt and ask for the main take away. Or apple intelligence
2025-01-25,have ya'll ever heard of skimming?
2024-12-26,Why would you admit that?
2025-01-07,"TLDR good ANC, Spatial Audio, voice isolation, and sound. Also reliable, good battery and uses USB-C."
2024-11-20,Without a doubt
2024-11-21,Is the AirPod pro 2 worth it? Either way I’m getting a pair for hearing aids 😂
2024-11-21,And then complain because the text is too long
2024-11-20,Some people just don't like to read i guess lol.
2024-11-20,Thanks for your input!
2024-12-20,"The user chose to present information in a qualitative format.  That's just life. I just value the information shared, regardless how it is presented."
2024-11-27,really? that's interesting considering they measure really well. better than pretty much any wireless over-ear ever.
2024-11-20,"Nope, I did use the proofread feature to correct grammar and mistypes. That’s it though"
2024-11-21,Thank you Garglyballs69 for your productive and insightful comments
2024-11-22,My experience it's like that brand new listening at only 35 percent volume with anc enabled. Sony supposedly gets better life but they have round tips and seem to break more.
2024-12-01,Thank you. Good to know there are still people who are able to read more than a sentence. I’ll make sure next time to upload it in video form with AI reading it over subway surfers
2024-12-26,Thank you for the kind words! So glad it was helpful! Enjoy your AirPods Pro!
2025-01-12,Glad to hear it! I’m sure you’ll love them! And with wireless charging it basically makes the lightning port irrelevant!
2025-03-17,Thanks for reading! Glad it’s still helping people even months later
2024-11-20,"Thank you lol, I forgot many people are incapable of reading anything longer than a sentence these days"
2024-11-20,"Not to mention, they have the ability to just stop reading and move on. Instead, they spend the time they could have used to read the post or move on to other things to point out that the review was ""too long"" for them.

I personally enjoyed the in-depth review as I was really on the fence about upgrading from the APP1 to APP2."
2024-11-21,"Agreed, it’s definitely helped me make up my mind about my next purchase! Thanks OP"
2024-11-20,Exactly lol 😂or if I made a YouTube video instead
2024-11-21,I feel like you stole this from TikTok about a woman doing just that for her husband because her text was too long
2024-11-20,If you read the very first sentence then you’d know that I offer exactly that at the end
2024-11-20,"because apple owns beats, so I'm pretty sure they have very similar innards."
2024-11-21,My firm just updated our laptops and now my AirPod pro 2s always connect! They did not on my old one. I started a thread about it a few years ago on Apples site.
2024-11-20,What do you mean? Are you connecting to a Mac? I’ve joined both teams meetings and google meets using the AirPods with no issues
