date,text
2024-03-29,I want a super cut of ‘My Hands!!’
2024-03-29,No Third party Imemrsive experience allowed. You can't even watch 360 Stereo Videos. it just shown as side by side
2024-03-29,Super cool. Am curious on using The Apple Watch with the Vision Pro on like seeing the watch on the Vision Pro and if it affects anything when using the Vision Pro?
2024-03-29,I loved that we could see your POV when using the Vision Pro! Can’t wait to try it out myself
2024-03-29,Excellent video!  LOL when Justine was chair dancing
2024-03-29,Incredible video! This thing is going to be revolutionary.
2024-03-29,"""I feel like a god"" this is exactly what it is all about!"
2024-03-29,Looks totally amazing!
2024-03-29,Persona was really awesome!   Apple just killed it.  You all looked like you.
2024-03-29,I have the exact feeling from Vison pro as it was with first iPhone. A mixture of excitement  from defenitely a breakthrough piece of gear and a pinch of disappointment from aspects.
2024-03-29,Wow it looks so mind-blowing looks awesome.
2024-07-02,"Finally received the Apple Vision Pro! 

Hi everyone! I asked a friend who was returning from the United States to buy me a Apple VIsion Pro and I received it 2 days ago! I’m really enjoying using it!! The App Store not working in India is not all a hindrance! 

Also i can watch already purchased movies on  the Apple TV app..

Interacting with the user interface is very simple… amazed at how Apple made it possible and ditched physical controls.

Also I am enjoying taking spatial videos! 

And when I want to zone out of my environment I just rotate the crown to view my favourite environment!"
2024-03-29,hmmm a woman named her channel iJustine sure she will do the most honest review ever right
2024-03-29,I love thw dj part so cute i love your dancing i was having fun too
2024-03-29,The FaceTime was hilarious. But all jokes aside this is an amazing piece of technology.
2024-03-29,Looks nice but I’ll wait for vision pro MAX
2024-10-30,i get it when some people have said its way better than having a meta quest 3 but at the price that they are charging and the fact that you cant just use it as as stand alone device you need an iphone macbook or ipa to set it up makes it even more exspensive
2024-03-29,Nice video iJ!
2024-03-29,"Great introduction to the Vision Pro, thanks! I am very excited about the possibilities of this opens up for gaming..."
2024-03-29,Great review.  Very entertaining
2024-03-29,Omg omg omg I said it here first I’ve always dreamt of a harry potter game with this can u imagine the wand movement and limitless possibilities Tim cook really cooked and knew what he was doing
2024-03-29,Superb unboxing and review.  Subbed
2024-03-29,"I don’t care about the item itself, I just care I’m watching a unboxing video"
2024-03-29,The DJ app was the best because it utilised the spatial aspect. Loved the demo overall.
2024-03-29,"I'm a little bit heart-broken....   That video editing experience was lackluster.   That interface should have been mnd-blowing.  You main screen should be a theater.  You timeline should be big, touchable, and right in front-of you.  Your entire field of view should have transformed into a freakin control center for video editing.  Instead it was the iPad app in a floating window?!?

They dropped the ball on that one."
2024-08-31,Yay! I love this music
2024-03-29,I can't wait to See it Through when i get one.
2024-03-29,Awesome Video!!!!  I pick my Apple Vision Pro up tomorow!
2024-03-29,I'm trying to figure out how this wouldn't rub my makeup off
2024-03-29,I was born in 1996 and I always grew up with technology evolving. I think this is the point where I will get left behind
2024-03-29,Thank you iJustine! This really gives me an idea of what it’s like to have the Vision Pro. :)
2024-03-29,I would love to own one of these unfortunately since I can not see because I’m totally blind it would have no use for me but I can only imagine the endless possibilities with people with vision with these glasses. Although I do wonder what kind of accessibility would they have in the future for navigational purposes with people with visual impairment.
2024-03-29,thank you so much. Really good walkthrough of the Vision Pro. I can't wait to try it on
2024-03-29,That was great
2024-03-29,Great job covering everything by the way. Even though I feel a little woozy now.
2024-03-29,Thank you for this video. Truly amazing job conveying the experience to us
2024-03-29,"Wow! It was so fu*kin crazy thing that I have ever seen
Thanks Justine for this amazing video️"
2024-03-29,The Dj segment just made me think what it would look like once they put Final cut and logic pro on there
2024-03-29,The best video ive seen on this product youre the best to do it GOOD STUFF
2024-03-29,I dunno.. it look sinteresting but as a long time VR user the things Justine goes bananas about are kindof my bread and butter now.. lol.
2024-03-29,"Ngl Apple has perfectly executed the concept of spatial computing with it’s Marvelous Vision Pro it’s superb and its integration to real life is mind blowing 
And in the whole video @iJustine did a great job doing by showcasing how Vision Pro works and feels when you experience it tbh she really deserves to give presentation at Steve Jobs Theater ..  her reaction when she was presented virtually at stage , she truly rocked while reviewing Vision Pro nothing but Respect to one of the most beautiful, best & brilliant tech YouTuber 🫡
My doubt is we will be prone to get eye fatigue using it for for more 1 hour idk about but it’s just my speculation what are your thoughts on this Justine ?"
2024-03-29,On one hand I'm always weary of how she never sees anything wrong in an apple product and on the other hand I'm glad she's so enthused by this product despite the many concerns
2024-03-29,It's quite strange you did not do the review for samsung s24 ultra .Is apple so much priority
2024-03-29,Great that you brought others into the experience. Thank you for the awesome experience!
2024-03-29,I like this review of the Apple Vision Pro by iVocalFry Pro Max
2024-03-29,"Thank you for such a lovely video! I had been waiting for the videos about Vision Pro, (obviously, that's because I can't afford it and I'm not even in US), so this video was very helpful to feel what it is like unboxing and trying the headset! I can't wait for them to ship one of those to Japan someday!"
2024-03-29,THIS IS SO COOL!!!!!!!!!!!!!!!!!
2024-03-29,"last time I was this excited about a new gadget was with the first iPhone, I was still in college, so I got a job and started saving for my first iPhone, I was able to buy the first 3G version"
2024-03-29,8:58 Thank you for the reenactment of a blind person being cured by Jesus
2024-03-29,"idk the last time a product surpassed my expectation, usually first gen products are okayishh!! but this thingg like dude i neeed thiss so bad!!"
2024-03-29,The excitement with the laser pointer
2024-03-29,"Thanks for sharing your personal experience with this amazing technology! The big question is whether the headset can be worn for extended periods of time for daily productivity. My personal experience with other VR's is that wearing it for more than an hour at a time is extremely uncomfortable and causes great discomfort with the head, neck, and face. I still don't see how it could replace multiple large monitors and a traditional keyboard and mouse for speed and efficiency. There is no way you could edit movies faster with finger gestures than instant clicks on a mouse and keyboard!"
2024-03-29,This video was a breath of fresh after the negative Verge review
2024-03-29,Wow so impressive video good job Justine Vision Pro look so cool
2024-03-29,I had to come here first for the best first unboxing
2024-03-29,Don’t comment on YouTube videos but for this one I will.  Really enjoyed your presentation and how thorough you were.  Great job.  Too expensive for me and my needs but a really nice device.
2024-03-29,"I'm waiting for Apple Vision Pro 5 to come out, so I can buy this version  Hello from Croatia"
2024-03-29,"C'MON!!! I WANT THIS NOW!!! The DJ App is for me!!  Thank you for this video, its excellent!!"
2024-03-29,"Always love your reviews 

I want one!"
2024-03-29,Loved it! Good job! Thank you Justine!!!
2024-03-29,This is really impressive
2024-03-29,This is a really great video on showing what this product is about. Great job. I hated this thing but after watching. I MUST have one. But I have to wait till the price drops unfortunately because it’s quite expensive.
2024-03-29,I really enjoy your enthusiasm :D Made my day
2024-03-29,"Hey Justine, it'd be awesome if you shared your thoughts on how lossless audio sounds between Airpods Pro 2 USB- C and Apple Vision Pro. I am really curious to hear your thoughts."
2024-03-29,Now this is just impressive
2024-03-29,I don’t know why I’m watching this it’s going to make me buy it
2024-03-29,Can’t wait for the 5th generation of these
2024-03-29,Just ordered one.  Thanks Justine!
2024-03-29,It looked so good.
2024-03-29,The way you type on finger to vision pro is how I type normally  I never followed the proper hand positions
2024-03-29,bro that facetime is sooo scary
2024-03-29,"Amazing!! No worries on the length of the video, I want to see more! I need to win the lotto and get one of these!"
2024-03-29,"Airpod Max : Oh...welcome, vision pro. I have been so lonely since I was released. Now I have a friend like me."
2024-03-29,Great video. Thanks for the hands on.
2024-03-29,Thank you for this video. I would like to see more Apple Arcade videos if possible with the vision
2024-03-29,"If this is what we’re getting with their first attempt, I’m so excited for the future of these."
2024-03-29,Love the MacOS X Galaxy background in the thumbnail
2024-03-29,Can’t believe that Apple includes a lot of accessories for users these days
2024-03-29,In my mind : I justine look like a Tim cook
2024-03-29,Need one now
2024-03-29,I wonder why Brian’s avatar looked the most accurate to how he looks compared to iJustine and MKBHD?? Seems like a dope experience tbh. I just think it’s a very niche product.
2024-03-29,"By the way (it may sound funny), I am your youngest Turkish follower. Because you are the only one in the U.S. who promotes Apple products properly. I can tell you my age if you ask."
2024-03-29,"What would convince me to buy one is if Apple designed a physical form for Siri to act like a hologram personal assistant that shows up when you talk to her, like Cortana."
2024-03-29,"Justine's avatar looks like reincarnation of Jesus Christ, I just can't"
2024-03-29,"Maby I'll buy vision pro in the future, just because of it's cute bag"
2024-03-29,This is my new fav video on the web
2024-03-29,This is absolutely beautiful. I’m definitely gonna get one but I’m trying to figure out what could be the use case of it?
2024-03-29,I AM JUST LOOOVVINGGGG THIS....!!! APPLE VISION PRO IS JUST SO COOL AND AMAZINNNGGGGG!!
2024-03-29,I just realized you were on a episode of The Vampire Diaries omg!!!
2024-03-29,Love your energy
2024-03-29,one video - 3 reviews & 3 reviewers... expecting more crossovers like this..
2024-03-29,"We need more of it. Follow up video Please Justine. ️
And also I love you I love your videos you are the Best."
2024-03-29,"It's a funny moment when you pretend to ""see"" through it for the first time! (since you had it on at the apple event and a few weeks ago)  But I like the emotion!"
2024-03-29,When we can walk about in these is when I’ll invest in one
2024-03-29,This is revolutionary
2024-03-29,"Looks amazing, doesn't it come with all the cellophane cover to protect everything ? Looks stunning  I have CV1 from 2016"
2024-03-29,Age comes for us all. I saw her on MK and had to see her on here.
2024-03-29,Nice device that surfs off of the development of other companies. I am waiting to see how many software developers will support it... besides Apple. I do see a breakage issue with the front custom glass.
2024-03-29,so amazing and wonderful video it is comprehensive video for this product and you are so beautiful and charming as I told you before you are really Apple Icon you are captivates the heart by your face  your voice and your expression method congratulations babe for this new product  and don't care about negative comments
2024-03-29,I would say Apple glasses woulld be much more cooll..wait for it
2024-03-29,Seems cool but I wish the MacBook experience could give a second display. I love using my MacBook on my lap and would love a secondary large display behind it for my FCP viewer window.
2024-03-29,"I thought Justine was going to pass out she was so excited! And she's usually always excited for Apple products. I'm actually afraid to go test this out at the Apple store because then I'm going to attempt to justify spending $3,500!"
2024-03-29,I’m so happy you’re healthy again miss
2024-03-29,Thank you for showing this.  I would love to be able to purchase the Vision Pro but alas out of my price range.  Hopefully Apple will have a more affordable one in the future.
2024-03-29,This was like watching a 10 year old with it
2024-03-29,"hahahaha a Bra, Justine is so real for this, luv the content."
2024-03-29,Are the Personas in FaceTime shown to Vision Pro users as 3D with depth against a background or flat?
2024-03-29,The Apple Vision E-Waste. Plastic / scratches at level 2 with deeper grooves at level 3
2024-03-29,This is why I think Vision Pro is for business people and not the everyday consumer especially with the price tag of 4k pretty much when you buy the extra accessories.
2024-03-29,Judging by allot thr things which gets iJustine excited? Her using the Vision Pro is probably how humans can actually have sex with technology.
2024-03-29,"Hey iJustine 
Thanks for the video.. Awesome job 
Does anyone know how much interactions can have 2 dudes or chicks when both wearing their own VisionPro ?
Can they watch the same movie??? Etc..
If yes I buy 2 of them … lol (would just be happy to have 1… some day)"
2024-03-29,"When I first tried VR with the Quest 2, I kept experiencing the urge to teleport or thumbstick forward after taking the headset off and just being in real life. That went away after about a week haha. This looks pretty great but Quest 3 is good enough for $500. Looking forward to the next gen. Oh but I love how clean that hand occlusion is on the Apple Vision Pro."
2024-03-29,The Steve Jobs Theatre? That's so cool!
2024-03-29,iJustine doesnt have a youtube premium account :P 17:07
2024-03-29,Just think how 150 years ago movies didnt even exist yet and now we have these. Wow
2024-03-29,"Old days- “don’t sit so close to TV. It may damage your eyes”

Today- let’s fit a TV on face."
2024-03-29,Lots of incredible things about this
2024-03-29,Steve would’ve gotten a kick out of this. The future is here folks.
2024-03-29,"Look at her smile ,it's like"
2024-03-29,The actual use of this vision pro is in the workspace along side macbooks and opening multiple tabs and in the Apple ecosystem
2024-03-29,This is a must buy
2024-03-29,"its such a bummer that Johnny Ive couldn't introduce this product. its missing that special feel and introduction. I would be in much more ""awe"" if he narrated and introduced it. He has a way of truly connecting the company to the product while offering it to the consumer in an effortless union."
2024-03-29,I love how they managed to put in this battery case 1\3 or a battery that should fit in... guess what is going to be the next optional accessory for $1000 more :) new battery with 2\3 so around 6000mah.
2024-03-29,When does the rest of the scubba gear come out?
2024-03-29,Amazing video!
2024-03-29,MKBHD showing at every vision pro review I had watched
2024-03-29,I'm hoping there's a lot more to come since SO FAR everything that has been demoed is just a combination of very good pass through of the environment and subpar VR compared to what is already out there...
2024-03-29,Hoth Rebel vibes. I want an orange jumpsuit and jetpack next gen
2024-03-29,"Excellent video, informative, and exciting to see your reactions to the VisionPro, Justine. QQ. How did you capture the VisionPro video? That was very cool. Waiting for mine to get here on Friday to play with it and experience the VisionPro by myself."
2024-03-29,Thank you very much for the exciting video. I really hope that I will soon be able to buy the Apple Vision Pro in Germany.
2024-03-29,Amazing!!! Video…  thank you so much!!!
2024-03-29,"This is the future. Again , apple has reinvented virtual reality"
2024-03-29,That’s crazy omg! I can’t wait to buy it.
2024-03-29,Great review.
2024-03-29,An advice from a 10 years Apple fan: always buy the second or later generation of an Apple product
2024-03-29,I'm SO JEALOUS because I'm in Canada. We don't have VisionOS
2024-03-29,this is insanely cool
2024-03-29,Never going to buy it but good to see how cool it is tho!
2024-03-29,ok yall after using the 300$ quest 2 I can't say I find this any more impressive
2024-03-29,I really would like to buy one ️
2024-03-29,Full on Mufasa & Simba Moment!
2024-03-29,"That's so cool! Knowing Apple usually has great accessibility features, I wonder if it would still be usable by someone who might be blind, or might not be able to use their hands (to pinch/click)"
2024-03-29,"It's more of a toy than a helpful tool. As on the iPhone, the AR is not precise, the sensors do not recognize objects, hands and edges correctly. The cameras are bad, especially in dark rooms. VisionOS could still be improved and there are no useful apps. Unfortunately, it is not useful in the current state. Hopefully something will change in the next few years, but I think it will be like the Apple Pippin....."
2024-03-29,this could be a great alternative for a 4K/8K TV
2024-03-29,Justin: i am swimming in the mountains
2024-03-29,I would love to have one of this just to watch movies!
2024-03-29,seems like it has a lot of kinks. super excited to see the competition!
2024-03-29,15:53 he is like screaming cowboy meme
2024-03-29,"This is absolutely revolutionary, a product that can revolutionize the world, I wish Steve Jobs was here, to see that."
2024-03-29,Ok she is really paid by Apple  Nearly no critics about this product..This is not a review this is a small Test by a fanboy! More than 3500! Quest 3 also makes use of spatial Videos…
2024-03-29,"I really enjoyed this video. I think Vision Pro is awesome.  My problem is that these will never be affordable for just the average person, and by the time the price comes down these will be old tech. I understand the tech that is involved but could be cheaper"
2024-03-29,"Like, it's expensive and clunky, but I can see how awesome this will be when it's the size of a pair of Tony Stark shades."
2024-03-29,Its all fun and games until ya wanna masterb8 and you become fully aware you have a computer on your face thats tracking your hands ALL THE TIME :O
2024-03-29,That travel case looks something from NASA
2024-03-29,"iJustine listen to me, do you really want a computer that is always looking to your hands ?"
2024-03-29,NOT manifesting lmaoooo  loved that part
2024-03-29,26:10 your dog is sooo cute
2024-03-29,"Meta quest just got meta axed. Apple Vision Pro is mesmerizing, beautiful, and an illusion"
2024-03-29,"Glad I haven't purchased one yet, it's cool but I don't see myself or anyone using it for doing some serious work, but more for media consumption...Can't wait to see how it evolves in the coming years!"
2024-03-29,"i love that she mutes the “hey siri” cuz she knows it’s gonna make like 100,000 phones go off"
2024-03-29,Okay this is crazy right here
2024-03-29,Great video!!
2024-03-29,"Yeah, an Apple watch for your head!. Your expression is just like a 4 year old girl opening a Christmas present. Great unboxing and walk thru."
2024-03-29,"I can’t wait for them to finish the scuba diving gear in the next decade! But really, because it looks cool but I know there’s probably 50 different things sold separately for no reason"
2024-03-29,Looking forward to the affordable version.
2024-03-29,21:15 OMG thats is the map app I was imagining what apple could deliver with their map app with the 3d sky view and street view in the US as well as other available regions. honestly looking forward to that U_U
2024-03-29,oh my gosh!!  is INSANE!!!
2024-03-29,i liked the Steve Jobs theater part lol
2024-03-29,Wow! This is so amazing!
2024-03-29,"Wow, that is something extraordinary, well I must say Samsung would be working to bring a copy of this"
2024-03-29,iJustine videos are apple ads to be honest. Still watch them though.
2024-03-29,I'm in search of the perfect gear for my upcoming winter skiing adventure. Any recommendations?
2024-03-29,"I just skipped around the video, and heard her say ""I'll get used to the eye fatigue"""
2024-03-29,Ame las visión ella único producto de Apple que me encanta
2024-03-29,"Omg I love this! Also great video as always!  I’m just thinking, how would i use this on a daily basis, i feel like it would be too overwhelming to be in it everyday even if i wear it for like 2 hours! Thoughts?"
2024-03-29,"Currently, I feel I am doing spatial computing with a Model-T Ford.  I have a MacBook Pro MAX and two 34"" LCD displays.  I can't take them with me to the living room or to my library as they need to remain at my desk.  I can't bring them on a plane or train.  Using a touch pad or mouse, it's so slow and awkward to move my mouse between the limited 3 physical screens.  I still have to open and close or resize windows too frequently in order to share the limited displays.   It's time to release my bondage to the past.  I'm getting my future looking spatial computer on Friday ... an Apple Vision Pro !!!   (Oh ... by the way, it also has VR/AR entertainment possibilities, but that is only icing on the cake of having a real spatial computer)

I hope the above statement can help differential what a Spatial Computer is and why Vision Pro has a use case well beyond other limited VR/AR headsets."
2024-03-29,i dont want it to be used like a phone i just want vr headsets to be a gaming console i hope they develop more games for vr headset. one vr game that i like is echo vr it looks so cool and immersive like a real vr e-sport.
2024-03-29,Imagine if we had the Vision Pro during COVID
2024-03-29,Looks amazing!!! I want one so bad right now. The only problem is that price tag
2024-03-29,I’d love to see how well it can generate files for 3D CAD apps
2024-03-29,"I have a Quest 3 and it does way more what I need than the Vision Pro does and at 1/7th the cost. Maybe in 5-6 years when the Vision Pro has the library of games that Quest does and it's below $1500, only then will I think about getting one."
2024-03-29,Every time a new apple product comes out I'm running to iJustine's channel!
2024-03-29,This review is exactly what I thought it was going to be lol pretty cool tho
2024-03-29,"I heard if you look at a Gen 1 iPod classic through these, the Steve Jobs hologram/Persona appears in front of you with a special message. I think you need to have a screen lock on the iPod with the code '1984' to unlock it."
2024-03-29,Woahhh there’s lot of stuffs in this device
2024-03-29,so good!!! Lucky you
2024-03-29,I can already see the increase of eye disabilities in the future by just solely using this
2024-03-29,Thanks for censoring the “Hey Siri”
2024-03-29,It feels like I’m watching an episode of black mirror lol  like the first day they got implanted haha’ can’t wait when we won’t need to wear the glass and will just show up in your brain  but that will take a while… first step to it
2024-03-29,"Where does the sounds come from? I see you are wearing AirPods, do you need to wear them or are there speakers?"
2024-03-29,I admit it looks cool
2024-03-29,It really is like the glasses from Back To The Future 2
2024-03-29,I’m sorry but I couldn’t take this girl seriously at all.. MKBHD is the one. Even though she has some great visuals to show us
2024-03-29,I want one!
2024-03-29,"The headset looks better in person (1) because of video compression. But (2) and more importantly because it’s doing divested rendering to save on performance cost. Foveation means they focus rendering resources on the area where you are looking which correlates to the part of the screen that a portion of your retina called the fovea is looking. This is the port of your retina with good high light color vision and acuity and it’s very densely packed with photoreceptor cells each of which is better represented inside of the brain itself. The rest of the retina is low acuity, performs better in low light, reacts more responsively to fast motion, has poor color reception, and is less well represented inside the of the brain. Because your vision in those areas sucks the part of the image that hits those doesn’t have to be very high quality like the part that hits your fovea."
2024-03-29,"OMG, so crazy inovation and technolgy apple"
2024-03-29,the zeiss lenses as so well thought of !!
2024-03-29,"Justine, could you do a comparison between The Nreal Glasses and The Apple Vision Pro please?"
2024-03-29,still a baddie 10 years later
2024-03-29,It’s like holding a piece of the future
2024-03-29,"wait so… if someone comes over and u wanna show them, u cant? it needs to be you? that kinda sucks lol"
2024-03-29,"Impressive technology but I still can’t see a practical use. However, you can’t get to the size of glasses until you produce these. Can’t wait to see what this technology looks like in 3-5 years."
