date,text
2023-03-28,"As someone who uses small engines frequently at work, the Airpods Pro have been an absolute gamechanger. I may look into upgrade to these."
2023-03-28,"This is why MKBHD is one of the top reviewers, he makes a review like a story. An amazing script here, very tallented."
2023-03-28,"The two main things for me is the massively improved noise cancellation; I can wear these in a loud gym and get almost no noise bleed at all, and the far more organic sounding transparency mode."
2024-03-27,Your reviews are always crisp and succinct.  Thank you.
2023-03-28,Bought them last Friday. I saw Flume live on Saturday …you’re absolutely right. Adaptive transparency is leagues beyond the competition!
2023-03-28,I tried the concert transparency mode thing. It works so well
2023-03-28,"Been using these for the last 4 days, and I can say, major improvement I’ve the 1st gen. Absolutely blown away by how awesome the ANC is and the spatial audio is just killing it.

It’s an experience worth investing into. The old one’s go to my brother coz I upgraded now"
2024-03-27,"I recently bought these because I broke my left one from 1st gen and the right one’s mic was essentially broken so I decided to splurge a little (a lot) and get these and tbh I’m loving them, the noise cancellation is perfect for when I have the fans going at night or when I’m on break at work and have the AC going in the car and the transparency mode is amazing when I’m talking to my wife or if I’m at work and someone on the job needs something or I’m on the scissor lift and need to hear if someone is calling for me 40 ft below me, here’s hoping they hold up to sweat and I can enjoy these for years to come"
2023-03-28,Adaptive Transparency mode is like Sunglasses for Noise.
2023-03-28,"Marques, your reviews are always informative and insightful. I was in the on the about these, but definitely picking them up as a xmas present to myself. Thanks for this great review."
2023-03-28,"Only review where you learn something new about the product, thanks Marques for your incredible work man!"
2024-03-27,Love your video!! Thank you  just got them as a gift & love the noise canceling effect
2023-03-28,"You create the most unbiased and detailed content around any device. Unlike people who just go ""i"" this ""i"" that so much so they put ""i"" in their name itself! Great work."
2023-03-28,I have used them at a concert (like in the example) and stood by the speakers. And I thought they weren’t turning it down that much. But then I took the AirPods out and it was crazy how amazing a job the AirPods were doing
2023-03-28,"I love this videos , straight to the point and coming of a stellar individual with amazing knowledge!"
2024-03-27,"finally upgrading to these from the first ever airpods  i am so excited

Edit: They did not disappoint"
2023-03-28,"Like others have mentioned, I’m watching this review while wearing my AirPods Pro 2 and I completely agree with everything said. I never tried the 1st gen, but have a variety of other things I use from original AirPods, Jabra’s, Sony WH1000-XM4, etc. Simply put, these will undoubtably be my most used from this point on. The combination of the sound, noise cancellation, and the extremely pleasant transparency mode add up to create a beautiful cocktail of a product  that will be coming with me every time I leave the house."
2023-03-28,"I was going to run down my old pair since they got replaced not long ago, but dang the new ones sound amazing to me and considering how much I use them it’s worth the upgrade"
2023-03-28,"I've only had mine for a little over 24 hours at this point and have to say that they are pretty solid. Have a few flights coming in less than a month and excited to see how to noise cancellation works in that environment. 

I'm also noticing a frequent ""I was not going to review these, but ....."" trend going on with AirPod Pro 2 videos this week ."
2025-02-25,Just bought these used yesterday at a store! Used them yesterday at work and went to the same store to sell my Beats Studio buds today! Now I’m here to find the tricks and secrets to them.
2023-03-28,"I’ve been using AirPods Pro (1) for concerts since day one. Works really well. I’m afraid the adaptive nature of AirPods Pro (2) will change the sound too much in an adaptive manner though, for concerts? I guess I just have to try it. I’d love if they introduced concert mode."
2023-03-28,"I have been to a concert with these yesterday
it is ABSOLUTELY INCREDIBLE"
2023-03-28,"Got the new Airpods Pro at launch and I was also pretty blown away by how much better they are in just about every way. The stem volume control was a bit disappointing though, I was hoping it would be more granular. But it's there and it works."
2024-03-27,"Thanks my man, I know this is a year old review, but it was so thorough that I’m buying them now.  Just lost my old ones"
2023-03-28,Great review. I agree that the new AirPods Pro 2 are a significant upgrade. However I would like to point out the AirPods Pro 1 sell for $180 at most major retailers vs $240-$250 for the new ones which makes the choice a little less clear.
2023-03-28,"i just bought a pair over the weekend and i am loving them so much. the improved battery life, amazing bass and crisp clear sound is incredible. the improved transparency and noise cancellation is crazy good too."
2023-03-28,"I actually use the transparency mode of my Airpods Pro 1st Gen and boosted the passthrough volume in my accessibility settings to allow me to hear my professor easier!! Its actually very useful and I use it very often. They are basically hearing aids that play music, how neat haha"
2024-03-27,This is what I needed to hear to get them. My sensory is noise. I wore out my last AirPod pro after four years because of how much I wore them. I don’t drive and walk everywhere. The adaptive transparency would help me. Sometimes I don’t even listen to music.
2023-03-28,"I’m 14 years old,I used like 40% of my 5 month savings to buy these AirPods Pro’s and I didn’t regret it,it’s also my first AirPods that I got"
2023-03-28,I bought them a week ago and i am more then satisfied. I had a pair on airpods gen. 2 before so an upgrade was necessary lol. I love the noise canceling and sound. The sound is really comforting. I fit only the extra small tips so i found this very good. Also switching from like i said the airpods 2 i loved that the case kind of flips up and stays there. The controls are AWESOME. Like i love it. No more tapping em. Can definitely recommend but if youre more on a budget theres equally good or even better for less money.
2023-03-28,"Great review, noise cancellation on these are crazy good. I honestly thought Apple was making things up with the “up to 2X more noise cancellation”, but after having these for a bit that may be accurate. Bass sounds a lot better especially in transparency mode. Overall sound is better. Surprised, but happy they didn’t raise the price of these."
2024-03-27,I’m getting my first set of AirPods today and stumbled across your review. I’m really glad I discovered you! You’re easy listen to and provide great information! Thanks so much!
2023-03-28,"the volume control has become much more of a light flick for me, it’s responsive enough that you don’t really need to slide that much"
2023-03-28,I gotta get these. First apple headphones ever for me.
2023-03-28,"Two things:
1) The concert/ear plug idea: As far as I know it hasn't yet been conclusively proven that the inverted soundwaves used in ANC actually help with hearing damage. So in that case, you'd maybe just hear the concert less loudly, but it would still result in the same amplitudes in your cochlea and damage your hearing just the same. I mean, it'd be awesome, but I don't think we're ready to get to that conclusion yet.
2) The animation explaining the soundwave and the ambulance is not really correct: Given the axes that are usually used in soundwave portrayal, you just shifted the frequency down, (x-axis) without changing/limiting the amplitude (y-axis)."
2024-03-27,Very useful pocket size gadget when in need of some quietness.
2023-03-28,I'm honestly keen to see how transparency will reduce the loudness of a concert without trimming high frequencies like earplugs do.
2023-03-28,"Yeah, they are damn good. I did a shootout this past Sunday with these, Galaxy Buds Pro 2, S22 Ultra and iPhone 12. They came out on top. What surprised me was how good they sounded on my S22 Ultra compared to the 1st gen. They sounded better on the S22 than they did on the iPhone 12"
2023-03-28,"I was superbly impressed. I honestly just bought them because I was starting to get a bit underwhelmed by the noise cancellation on my Gen 1s and wanted the improvement. However...WOW. Sound really does take a big leap, the noise cancellation is frighteningly good (I blasted a YouTube video on my 2021 16"" MacBook Pro and it chopped the noise down to like 15%), and the adaptive transparency mode is also really good. I found the gesture for volume control to be fidgety, but it didn't cross my mind to just grip the AirPods on both sides and slide down instead of whatever dinosaur-claw gesture I was doing.

Even if you have Gen 1 Pros, definitely get these. They're awesome."
2024-03-27,I watched your review before buying...thank you for the honest review; I'm now a fan of airpods
2023-03-28,"i havent had the 1st gen pros but upgrading from the 2nd gens to these the noise cancellation is like my own white space, its mindblowing how ill just be in a classroom and it cancels out all the white noise + outside noise so i can focus better without having to have music playing and the transparency mode is just i dont think i have enough words to describe it, needless to say i never take them out of my ear."
2023-03-28,"I def am gonna need these, my watch goes off about 5-6 times a day with noise notifications… Easy buy for me"
2023-03-28,I'm curious how's the sound quality compared to the XM4  Would love a comparison video between these earphones!
2024-03-27,Bought these on a whim because I kept having issues with 3rd gen Airpods. They're fantastic!
2023-03-28,"Got mine today and after playing around with the tips, the ANC seems a lot better than before. Sound quality is the biggest improvement for me."
2023-03-28,"His intros never feel bored.
It's a great time for his fans having continuous videos"
2023-03-28,"I use transparency mode when filming live sessions with artists/bands - I genuinely didn't realise the work these AirPods were doing until by chance, I took them out whilst the band was sound checking.

The sudden jump in volume through my ears was startling! I was blown away at how they regulated loud sound, I use them every time I film with loud music acts now, so much easier to focus on my job, whilst still hearing what the band is playing !"
2024-06-30,Just got the Air Pro 2 . Thank you for your review .
2023-03-28,"8:34 whoah that scenario is an extremely good use-case for any earbud product. Hopefully you can test it in that scenario and let us know if they didn't just clip/distort and ruin the whole experience.
As an personal approach to protecting my hearing in abusively loud stages and clubs as a DJ, I invested close to $2000 on a musician-rated professional form of the same technology that Apple is now pioneering. The biggest difference being that my solution is wired and requires a belt pack with batteries. For anybody curious: Sensaphonics Active Ambient 3D is what I use. The sound is amazing (as it should be) and the microphones on the ear-buds can deal with the ridiculous volume levels musicians endure for hours on tours and stages across the world. Apple is definitely the only thing I've tried that has brought similar features to the consumer world, and it's extremely cool to see that they just raised the bar on an already awesome technology!"
2023-03-28,6:45 is the weirdest pronunciation of ambulance i have ever heard
2023-03-28,Who else is watching this with these Airpods
2023-03-28,Fantasic review. Thank you. I just bought some last weekend. They're my first pair. The noise cancellation feature sold me as soon as I heard it. Worth the price!
2023-03-28,"9:04 Geniunely thought it said ""not your airpods bro"""
2023-03-28,"Your explanation on the new transparency mode is better than what Apple told us on stage 

I got these new AirPods and I'm really impressed by the new noise cancellation, that does an amazing job, better than AirPods Max. And I prefer it over the Bose one that somehow feels ""oppressing"" for me"
2023-03-28,I am super impressed with the ANC on the Pro 2 when on a flight. It was amazing. And battery life is great.
2023-03-28,"I used the 1st pro version noise cancellation feature, inside a container vessel main engine area and near the diesel generators for 2h straight. imagine the crazy sound level. Airpods pro got me through this without even blinking and i could hear my colleagues talking to me with no real problem. I can't wait to see how this new transparency mode can work on other use cases."
2023-03-28,"I use beats fit pro, and the spatial audio personalisation is available for me as well. And I use iPhone 11. I think it has come with the iOS and not just the AirPods Pro 2. But it feels very different like you have mentioned. I like the fact that you go in detail with whatever I need to know with every device. Thank you"
2023-03-28,"I just got these for an early Christmas present today. I love them but I can’t figure out how to work the volume, play, pause or any of the features, lol. But I still love them."
2025-02-25,finally upgraded from pro 1s after 5 years!
2023-03-28,"I fly for work a lot. I love my air pods first gen but on those long flights, I'd still use my Bose QC 45. These seem like they might be at a level where I can just leave them in on a flight if I'd like. Thanks for an awesome review."
2023-03-28,1:26 just want to clarify that these do NOT support 16 bit 48khz since that would be lossless.
2023-03-28,"Great video! I just got my first pair of Air Pod's, love them!"
2023-03-28,"Thanks for the great review and break down! I'm an ""Airpods Person"" and also a wedding photographer. Your idea at the end about wearing these in Transparency mode at loud concerts illuminated a lightbulb in my head that I need to upgrade to v2, and wear them during the loud dance music every night! I have suffered from hearing loss and have tinnitus from loud sound exposure, so I will definitely start trying this and see how it works. Great idea and thanks for sharing!"
2023-03-28,"Consider AirPods Pro, too, as a legitimate and indispensable work device. You mention that you’d never have ear buds in for 6 hours straight and while I agree that would be a big no-no for consumption (such as watching videos, listening to music), I find not enough people talk about these little guys for their professional benefit.  I bought the first AirPods Pro specifically to teach online courses when the pandemic hit, and use them for every video call, virtual meeting, and phone call (choosing the Pros for the ability to switch between transparency and noise cancellation mode so I can still hear myself when I talk but then can shut out sound when I need to focus). This is the only device I can comfortably work in all day.  1000% a life-changer."
2023-03-28,"In my 2 minutes of experience with them, the ANC was comparable to that of my old Bose headphones'. That's actually scarily surprising to me"
2024-03-27,Really love to watch your opinion on electronics and love the way you describe.. You’re so convincing that I went and bought it for myself  and I am completely agreeing with you they are amazing the noise cancellation is mind blowing
2024-03-27,Great review. I have the new AirPod pro 2 and I love them but I didn’t know how to explain to people how good they are. This is this perfect review for it
2023-03-28,"Agreed on all counts! Love the new pros. At first they don’t feel like an exciting upgrade since they feel and look literally the same, but every upgrade on them is a good one. I’ve been dying for the AirTag features to be built into the case. No need to use an AirTag case on them like I did with my old pros. Good review!"
2024-03-27,"I just got a pair of these. Noise cancelation seems to work a bit better than the Sony buds I had before. Transparency mode is nice, and the sound quality is great. I'm happy with them. Another good thing is that I don't have to plug them in, just plop them down on my magsafe charger. So much better."
2023-03-28,"When I tough your content can't get any better, it does.. The production quality and the actual content are out of this world, Marques! Keep it up!"
2025-02-25,The transparency mode on the pixel pro 2s is insanely good.
2023-03-28,I put in a order awhile back and they're coming in this weekend. So it's good to hear they are a substantial upgrade from the 1st gen. Especially with the music quality & transparency mode getting a nice boost
2023-03-28,"@mkhd the new ANC and Transparency mode are super awesome! I actually used it at a concert in the exactly same mode you suggested (before watching your review ), and man! It was just exactly as you had dreamt it! I was in the 3rd row from the front,  in front of the gigantic speaker and it sounded so much comfortable! Just blew my mind!"
2023-03-28,"So many MKBHD videos lately! Loving it
I really love watching about stuff I cannot afford."
2024-03-27,"The way he explained, the “adaptive transparency”mode is ridiculously amazing"
2023-03-28,"I've been wearing my last-gen Airpods Pro as a hearing aid, because transparency mode in that model is that good. Thinking about an upgrade now with these transparency mode upgrades. Even with my previous airpods pro purchase and purchase of new ones, I'm still out less $$ than if I purchase prescription hearing aids! Also, the Db limiter sounds like I should be able to wear them while duck hunting, which would be a bonus for me."
2023-03-28,you can absolutely do that at concerts. i use the pro 1s on noise canceling mode at concerts and it works perfect so im sure the adaptive mode will be just as good if not better. Also the ear scan function works with the 1st gen pros as well.
2023-03-28,Noise cancelation is magic! Love them.
2024-03-27,"Fantastic review. So much information cogently presented and clearly articulated. Your knowledge and expertise are awesome. Thanks for a great review. I just got the Apple AirPods Pro 2 for Christmas from my wife and I noticed the difference immediately and learned A LOT from your video. Fan for life, Marques."
2023-03-28,The biggest selling point to me the the noise cancellation. I work in huge data center environment which has lots of noise around. The first gen is working ok but still hearing noise when I step onto data floor. The 2nd gen gets much better and I can even have meeting on data floor troubleshooting things with vendor meeting which is nearly impossible on the 1st gen.
2023-03-28,Could you use transparency mode at a gun range? I know similar technology has existed for awhile for hunters and shooters
2023-03-28,"I’ve been using AirPods Pro to concerts and clubs anytime I forget my earplugs (which is half the time). I’m a bit self-conscious about having AirPods in in those situations, but honestly they work so much better than earplugs. I’ve always used noise cancellation but looking forward to getting these new ones and trying out the transparency mode. I think it will be useful in a loud city like Barcelona. Thanks for the review!"
2023-03-28,"I lost my old airpods case so ""is it worth the upgrade"" is kind of a moot point for me but I do still wanna know what Im getting that's better."
2023-03-28,"I had no plan to buy the new ones, then I lost the left one… and these new ones are miles ahead, the older ones were pretty trash, for sound quality, the anc was great when I bought them in sept 2021, but they lost their anc also after march 2022… the vocals and surround are incredible, if they had a lot more bass or came with an option to increase base, there would be no competition for these"
2023-03-28,"If the iPhone can be updated for as long as the Airpods Pro, I believe there will be huge changes every time."
2023-03-28,Apple just got another best seller in their hands now!
2024-03-27,"Honestly I just got my pair for my birthday (USB- C version thanks EU) and the differences are amazing! Top three has got to be sound, ANC, and the new adaptive transparency! It’s honestly super good, highly recommend. I have a flight soon, so I’ll probably be very grateful for the extra battery life, too. Especially with the Black Friday coming up soon I highly recommend picking up a pair!"
2023-03-28,"I like the volume up and volume down feature now, but I think they should have probably placed it where the black part is, and that could basically just be the slider, up and down for volume. Push a bit and slide up and down, the area it’s at now is kinda small to control volume, I don’t know if this makes sense but I hope someone understands what I’m sauing"
2023-03-28,"I used the AirPods Pro all day everyday basically. So I got the AirPods Pro 2 immediately and wow I’m impressed, the sound is so much better, and the noise cancellation blew me away, definitely happy with them"
2023-03-28,One thing I've always wondered about noise cancellation. Does it actually perfectly physically cancel out the sound waves (thereby providing proper hearing protection) or does it just do it close enough to trick your brain but your physical eardrums could still potentially be damaged by the too intense sound waves?
2024-03-27,"You always have some of the best, top notch, hyper professional videos. Very informative and honest.  Well done"
2023-03-28,"As a Samsung-exclusive user, the Airpods Pro is probably my favorite Apple product. I have plenty of different wireless earbuds (highly recommend the Tranya brand, btw), but I tend to look for my Airpods Pro after a while. I love the 3rd generation Airpods as well, and firmly believe that this should have been released as the 1st generation Airpods. I'm most likely going to be skipping the new Airpods Pro, but I'd be real jealous of those that do! That transparency mode is CRAZY."
2023-03-28,"2 thoughts I had while watching:
1: It would be interesting if they made a feature that cancels out repeated noise like loud computer fans or airplane sounds, but keeps transparency mode for like people talking to you. So basically it’s noise cancellation 90% of the time, but if someone it talking to you it’s transparency mode for just their voice
2: Im interested to see what upgrades they bring to the airpod maxes... if these new airpod pros were improved this much by the H2 chip, how much can the maxes be improved by the H2 chip?"
2023-03-28,"The Gen 1 AirPods Pro already have adaptive transparency. I know mine do. It must’ve come through an update and Apple just didn’t say anything about it. But mine definitely minimize environmental noise.

But damn it! I think you’ve convinced me to drop the cash and get the Gen 2s…. Hard to imagine a better pair of AirPods Pro but my biggest gripe is battery life so an extra 2 hours would be huge!"
2024-06-30,"i bought mine a few days ago and its lowk the best pair of headphones i bought, i used soundcore and jlab and the airpods are so nice to help u not have ur ears blow up from high db sounds"
2023-03-28,"Love the new transparency mode. Hated it in gen 1, but it’s so much better. I commute by bike and anne would have to ride with just one airpod in for safety, but now I can ride with both in transparency mode. I also use my AirPods as ear protection while shooting small calibers."
2023-03-28,"Been waiting on this review, feels like there's been a ton of noise cancelling headphones/earbuds in the last year"
2023-03-28,"I'm really impressed I wasn't going to upgrade as my 1st gen where only a year old, but I'm really impressed with how much better they sound, for me the speed at which the connect is huge."
2024-07-30,"Just upgraded my 2019 AirPods Pro, due to crackling noises on the right earpiece. I did turn them in in 2022 to get them fixed but 2 years later crackling came back. Bought the 2nd gen and I love them so far. My original AirPods Pro lasted 5 years hopefully these last for 5 years as well."
2023-03-28,"There is a bug where your AirPods tone volume preference is ignored while listening to music.
Sound effects will always play at full volume while something different is playing in the background. Any idea if there is a fix coming?

You can test it yourself by setting the Tone Volume to 15% and playing a YouTube video, while switching transparancy modes."
2023-03-28,"i""m still impressed each time i use them, i still got the gen 1 , but damn, the Spatial audio is way better imho , i've noticed that especially if your move your head up or down the sound stage will make you feel the difference , active transparency is awesome, at first i wasn't planning on getting these, but worth the upgrade ^^"
2024-12-27,Just bought one rn!
2025-02-25,(Im special needs where I can’t focus a lot) so my moms rewarding me when I get done with home school. I’m honestly just watching this cause I’m jealous rn
2023-03-28,"I think the Pros 2 will be perfect for me coming from the Max, the small form factor is good when going outside"
2023-03-28,"I loved my first pair of the pros, just got the new gen 2 pros for Christmas and I wear them for 10hr work days. I weld and they seem to do a good job with noise cancellation when welding, but they do get feedback when sanding and seem to be more sensitive to high pitch noises when walking by air nozzles and air grinders in use compared to the gen 1 pros"
